A: Paragraph Index,B: AI: Cross Scale (Consensus),C: Human Agreement with B (Agree/Disagree/Notes),All Models Align,Disagreement Type,Source,Full Paragraph Text,claude4: Interaction Present,claude4: Confidence,claude4: Scales,claude4: Links,claude4: Final Link,claude4: Scale Explanations,claude4: Summary,claude4: Rationale,gpt5: Interaction Present,gpt5: Confidence,gpt5: Scales,gpt5: Links,gpt5: Final Link,gpt5: Scale Explanations,gpt5: Summary,gpt5: Rationale,4o: Interaction Present,4o: Confidence,4o: Scales,4o: Links,4o: Final Link,4o: Scale Explanations,4o: Summary,4o: Rationale,gemini2.5: Interaction Present,gemini2.5: Confidence,gemini2.5: Scales,gemini2.5: Links,gemini2.5: Final Link,gemini2.5: Scale Explanations,gemini2.5: Summary,gemini2.5: Rationale
0,No,,Yes,Unanimous,Nestle_Annual_Report_2014_page_4.pdf,"We remain the only infant formula manufacturer included in FTSE’s responsible investment index, based on our performance in human rights, labour rights, responsible marketing of breast-milk substitutes and more.",No,0.9,N/A,N/A,N/A,N/A,N/A,"The paragraph describes a company's inclusion in an investment index based on performance metrics, but contains no explicit causal interactions between different scales. It presents a static achievement rather than describing how one scale influences another.",No,0.82,N/A,N/A,N/A,N/A,N/A,"Only organizational actors are mentioned (the manufacturer and FTSE’s index). The causal relation is org-to-org, not cross-scale, and no societal or individual actor explicitly interacts.",No,0.9,N/A,N/A,N/A,N/A,N/A,"The paragraph describes an organization's inclusion in an index based on performance criteria, but does not explicitly show cross-scale causality between different scales.",No,1.0,N/A,N/A,N/A,N/A,N/A,"The paragraph describes an interaction between two organizations (the infant formula manufacturer and FTSE). Both actors map to the 'Organizational' scale, meaning no cross-scale causality is present as per the protocol."
1,Mixed,,No,Split Yes/No,Nestle_Annual_Report_2014_page_4.pdf,"We were ranked number one by the charity Oxfam in its 2014 scorecard, Behind the Brands. The survey scored 10 food and beverage companies on their efforts to improve food security.",No,0.9,N/A,N/A,N/A,N/A,N/A,The paragraph only describes a ranking outcome by Oxfam without any explicit causal interactions between different scales. It states what happened (ranking) but not how one scale influenced another.,Yes,0.67,"Organizational, Environmental and Societal",Organizational -> Environmental and Societal,Organizational -> Environmental and Societal,Organizational: Oxfam and the 10 food and beverage companies are individual organizations.; Environmental and Societal: Food security is a societal-level system.,"[Organizational, Environmental and Societal] Companies’ efforts targeted improving food security, a societal system.",The text explicitly connects companies’ actions to improving food security. Oxfam’s ranking is org-to-org and thus excluded. No individual or sector-system actors are described.,No,0.9,N/A,N/A,N/A,N/A,N/A,The paragraph describes a ranking by Oxfam but does not explicitly state any cross-scale causal influence between defined scales.,Yes,1.0,"Organizational, Environmental and Societal",Organizational -> Environmental and Societal,Organizational -> Environmental and Societal,"Organizational: ""We"" (the company), ""Oxfam"", and ""10 food and beverage companies"" are all individual organizations or collections of individual organizations.; Environmental and Societal: ""food security"" represents a broad societal-level system or issue.","[Organizational, Environmental and Societal] Organizational actors' efforts explicitly influence environmental and societal food security.","The text explicitly states that '10 food and beverage companies' (Organizational scale) undertake 'efforts to improve food security' (Environmental and Societal scale), establishing a direct causal link. Other interactions, such as Oxfam ranking companies, occur within the Organizational scale and are thus not cross-scale. Only two distinct scales were identified."
2,Yes,,Yes,Unanimous,Nestle_Annual_Report_2014_page_6.pdf,"The business environment was again marked by great uncertainty in 2014. Disruptive socio-economic and political change continued to affect growth in many parts of the world. In the emerging markets, economic volatility worsened as growth rates slowed and currencies weakened. In the developed markets, deflationary pressures and soft consumer demand resulted in a continued challenging trading environment. In the face of such uncertainty it was more important than ever to stay the course and remain loyal to our strategy, driving short-term performance while ensuring we made the right decisions to deliver our long-term goals. We took decisive steps to further our ambition to be the world’s recognised leading Nutrition, Health and Wellness company, trusted by all stakeholders, while again delivering financial results in 2014 that outperformed the market.",Yes,0.8,"Environmental and Societal, Organizational",Environmental and Societal -> Organizational,Environmental and Societal -> Organizational,"Environmental and Societal: Socio-economic and political changes, emerging markets, developed markets, deflationary pressures, consumer demand represent societal-level systems; Organizational: The company ('we', 'our strategy', 'our ambition') represents one specific organization","[Environmental and Societal, Organizational] Societal changes affected company performance and strategy decisions.",The text explicitly states that disruptive socio-economic and political changes affected the company's business environment and trading conditions. The company responded by staying loyal to strategy and making decisions for long-term goals.,Yes,0.72,"Environmental and Societal, Inter-Organizational / Sector, Organizational",Environmental and Societal -> Inter-Organizational / Sector | Environmental and Societal -> Organizational,Environmental and Societal -> Organizational,"Environmental and Societal: Macro conditions: socio-economic and political change, deflationary pressures, consumer demand.; Inter-Organizational / Sector: Sector-level market context described as the trading environment/market.; Organizational: The company (“we”) making strategic and performance decisions.",[Environmental and Societal; Inter-Organizational / Sector; Organizational] Macro uncertainty and deflation reshaped the trading environment and prompted the company to stick to its strategy.,"The text explicitly links macroeconomic pressures to a challenging trading environment and to the company’s strategic stance. Other statements (e.g., growth, volatility) are intra-environmental and not cross-scale, so only these two links are retained.",Yes,0.8,"Environmental and Societal, Organizational",Environmental and Societal -> Organizational,Environmental and Societal -> Organizational,Environmental and Societal: Socio-economic and political changes affecting global growth.; Organizational: The company's strategic decisions and performance.,"[Environmental and Societal, Organizational] Socio-economic and political changes influenced the company's strategic decisions and performance in 2014.",The paragraph describes how socio-economic and political changes (Environmental and Societal) influenced the company's strategy and performance (Organizational). No other scales were clearly defined.,Yes,0.9,"Individual, Organizational, Environmental and Societal",Individual -> Organizational | Environmental and Societal -> Organizational,Environmental and Societal -> Organizational,"Individual: Refers to 'consumer demand', representing the actions/preferences of individual consumers.; Organizational: Refers to 'we' (the company), a single organizational entity.; Environmental and Societal: Refers to 'deflationary pressures' and 'socio-economic and political change', which are characteristics of societal-level economic systems.","[Individual, Organizational, Environmental and Societal] Soft consumer demand and deflationary pressures from the broader environment created a challenging trading environment for the company.","The paragraph explicitly describes how both individual consumer behavior and broader environmental and societal economic conditions causally influenced the organizational trading environment. Specifically, 'soft consumer demand' (Individual) and 'deflationary pressures' (Environmental and Societal) are stated to have 'resulted in a continued challenging trading environment' for 'we' (Organizational). The company's subsequent actions were a response to these external cross-scale influences."
3,Yes,,Yes,Unanimous,Nestle_Annual_Report_2014_page_6.pdf,"Through continuous innovation and renovation of our food and beverages portfolio we are able to offer people healthier and tastier choices at every stage of their life, at any time of the day. Science-based innovation enables us to enhance the quality of people’s diets, using our knowledge and our research and development capability to make a positive contribution to society. Wherever you are in the world, we have safe, nutritious products to help you care for yourself and your family. A few years ago, we expanded the boundaries of Nutrition, Health and Wellness with the creation of Nestlé Health Science, motivated by the opportunity to forge a major therapeutic role for nutrition in the management of health. In line with this broadened strategy, in 2014 the Board approved the sale of 48.5 million L’Oréal shares to L’Oréal for cancellation. Part of the proceeds were used for the acquisition of the 50% stake in our joint venture Galderma from L’Oréal, bringing our ownership of Galderma to 100%. Galderma formed the foundation of a new Nestlé subsidiary, Nestlé Skin Health. Its goal is to be recognised as the leading company in skin health, offering science-based solutions to protect, nourish and enhance skin, and where needed to treat, correct and restore damaged skin over the course of people’s lives. Nestlé Skin Health provides prescription drugs, self-medication, therapeutic skin care and aesthetic and corrective medicine, allowing us to compete in the growing and promising multi-billion global skincare market. Nestlé Skin Health was further strengthened by the acquisition of the full rights to commercialise several key aesthetic dermatology products in the United States and Canada.",Yes,0.85,"Individual, Organizational, Environmental and Societal",Organizational -> Individual | Organizational -> Environmental and Societal,Organizational -> Individual,"Individual: People, families seeking healthier food choices and skin health solutions; Organizational: Nestlé as company, Nestlé Health Science, Galderma, L'Oréal as specific organizations; Environmental and Societal: Society receiving positive contributions, global skincare market as societal-level system","[Organizational, Individual, Environmental and Societal] Nestlé provides health solutions to individuals and contributes to society",The text shows Nestlé (organizational) explicitly offering products and solutions to people/families (individual) and making contributions to society (environmental and societal). These are clear causal relationships where the organization acts to influence other scales.,Yes,0.78,"Organizational, Individual, Environmental and Societal",Organizational -> Individual | Organizational -> Environmental and Societal,Organizational -> Individual,"Organizational: Nestlé entities (Nestlé, Nestlé Health Science, Nestlé Skin Health) act.; Individual: People, families, and their diets/skin are affected.; Environmental and Societal: ‘Society’ is explicitly referenced as beneficiary.","[Organizational, Individual, Environmental and Societal] Nestlé’s R&D and products directly shape individuals’ diets/skin care and are claimed to contribute positively to society.","Explicit statements tie Nestlé’s actions to impacts on people and on society. Mentions of the ‘global skincare market’ describe context but do not state a causal effect on the sector, so inter-organizational scale was excluded.",Yes,0.9,"Individual, Organizational, Inter-Organizational / Sector",Organizational -> Individual | Inter-Organizational / Sector -> Organizational,Organizational -> Individual,Individual: People benefiting from healthier choices and skin health solutions.; Organizational: Nestlé and its subsidiaries like Nestlé Skin Health.; Inter-Organizational / Sector: Joint ventures and acquisitions involving L’Oréal and Galderma.,"[Individual, Organizational, Inter-Organizational] Nestlé's strategic moves enhance individual health through organizational and inter-organizational actions.",The text describes Nestlé's organizational actions impacting individuals' health and inter-organizational transactions affecting Nestlé's structure. These illustrate clear cross-scale interactions.,Yes,1.0,"Individual, Organizational, Environmental and Societal",Organizational -> Individual | Organizational -> Individual | Organizational -> Environmental and Societal | Organizational -> Individual | Organizational -> Individual | Organizational -> Environmental and Societal | Organizational -> Environmental and Societal,Organizational -> Individual,"Individual: Refers to 'people', 'you', 'yourself and your family' whose choices, diets, and health are influenced.; Organizational: Refers to 'we' (Nestlé), 'our food and beverages portfolio', 'Nestlé Health Science', 'Nestlé Skin Health', 'the Board', and 'L’Oréal'.; Environmental and Societal: Refers to 'society', 'global skincare market', and 'United States and Canada' as market regions.","[Individual, Organizational, Environmental and Societal] Organizational actors like Nestlé directly influence individuals' health and choices through products and solutions, and strategically interact with societal markets.","The paragraph explicitly details how Organizational actors (Nestlé, its subsidiaries) causally influence Individuals by offering products and solutions for health and diet. Additionally, these Organizational actors interact with and compete within Environmental and Societal systems, such as global markets and national regions. All identified interactions are cross-scale and directly stated, with no more than three distinct scales involved."
4,Mixed,,No,Split Yes/No,Nestle_Annual_Report_2014_page_6.pdf,"These developments ensure that, building on the strong foundations of our food and beverages business and guided increasingly by science, we can further expand our portfolio to provide promising platforms for future growth in line with our strategy of Nutrition, Health and Wellness. At the same time, we continue the drive to ensure our company is organised efficiently and effectively to deliver continuous profitable growth over the long term. With this objective in mind we made some key decisions, adapting our organisational structure to better prepare ourselves today to meet the challenges of tomorrow.",No,0.9,N/A,N/A,N/A,N/A,N/A,"The paragraph describes internal organizational strategy and restructuring decisions but lacks explicit cross-scale causal interactions. All actions mentioned (expanding portfolio, organizational changes, strategic decisions) occur within the same organizational scale without clear causal influence from or to other defined scales.",Yes,0.61,"Environmental and Societal, Organizational",Environmental and Societal -> Organizational,Environmental and Societal -> Organizational,Environmental and Societal: Science as a societal knowledge system is said to guide actions.; Organizational: The company ('we/our company') making portfolio and structural decisions.,"[Environmental and Societal, Organizational] Science guides the company’s portfolio expansion.","The only explicit cross-scale influence is science guiding the company’s actions. Other statements concern internal strategy and structure, which are intra-organizational.",No,0.9,N/A,N/A,N/A,N/A,N/A,The paragraph discusses internal organizational changes and strategies without explicit cross-scale causality involving other defined scales.,No,1.0,N/A,N/A,N/A,N/A,N/A,"The paragraph exclusively describes actions and strategies of a single 'company' (Organizational scale). No explicit causal links between actors at different scales (Individual, Inter-Organizational, Environmental and Societal) are present. All identified actors and actions remain within the Organizational scale."
5,Mixed,,No,Split Yes/No,Nestle_Annual_Report_2014_page_6.pdf,"While our company continues to benefit from its decentralised structure, allowing key decisions to be made as close as possible to consumers, there is still an important opportunity to better leverage our scale. That is why in 2014 we set up Nestlé Business Excellence at Executive Board Level, combining GLOBE (Nestlé’s Global Business Excellence function) with Nestlé Business Services (our shared operation for transactional services around the world) and Nestlé Con tinuous Excellence (our continuous improvement and LEAN programme). Through a focus on three areas: Simplifying, Standardising and Sharing, Nestlé Business Excellence will allow us to decrease structural costs and operational expenses, freeing up resources to support growth. This will also allow our markets to keep a sharp focus on generating demand.",Yes,0.85,"Individual, Organizational, Inter-Organizational / Sector",Organizational -> Individual | Organizational -> Inter-Organizational / Sector,Organizational -> Individual,"Individual: Consumers who receive key decisions made close to them; Organizational: Nestlé company with its decentralized structure and internal units like GLOBE, Nestlé Business Services; Inter-Organizational / Sector: Markets that generate demand and operational systems spanning multiple organizational units","[Organizational, Individual, Inter-Organizational] Nestlé's structure enables consumer-focused decisions and market demand generation",The text shows Nestlé (organizational) explicitly making decisions close to consumers (individual) and enabling markets (inter-organizational) to focus on demand generation. These represent clear cross-scale causal relationships where organizational changes directly impact other scales.,No,0.77,N/A,N/A,N/A,N/A,N/A,"All described actions are internal restructuring and cost-focus within Nestlé and its units. Consumers are mentioned, but no explicit causal effect across scales (e.g., org -> consumers) is stated.",Yes,0.9,"Organizational, Individual, Environmental and Societal",Organizational -> Individual | Organizational -> Environmental and Societal,Organizational -> Environmental and Societal,Organizational: Nestlé and its internal units like Nestlé Business Excellence.; Individual: Consumers who are affected by decisions made close to them.; Environmental and Societal: Markets as societal-level systems influenced by organizational actions.,"[Organizational, Individual, Environmental and Societal] Nestlé's structure and initiatives influence consumer decisions and market demand generation.","The paragraph describes how Nestlé's organizational structure and initiatives impact both individual consumers and societal-level markets. The clearest links are from organizational actions to individual and societal outcomes, with a focus on decision-making and market demand.",Yes,1.0,"Individual, Organizational",Organizational -> Individual,Organizational -> Individual,"Individual: Consumers are specific people/customers.; Organizational: Our company (Nestlé) and its internal units (Nestlé Business Excellence, GLOBE, NBS, NCE, markets) are all parts of one organization.","[Individual, Organizational] The company's organizational structure influences decision-making proximity to individual consumers.","The paragraph explicitly states how the company's (Organizational) decentralized structure influences the proximity of decision-making to consumers (Individual). All other interactions described are internal to the Organizational scale, such as Nestlé Business Excellence influencing 'our markets'."
6,Mixed,,No,Split Yes/No,Nestle_Annual_Report_2014_page_6.pdf,"We have integrated the Maghreb, the Middle East, the North East Africa region, Turkey and Israel into Zone Europe to form Zone EMENA (Europe, Middle East and North Africa). This balances the different consumer dynamics and opportunities in each geography. Additionally it allows a sharper focus in Zone Asia, Oceania and Africa, a fast-growing part",No,0.9,N/A,N/A,N/A,N/A,N/A,"The paragraph describes organizational restructuring and geographic integration but lacks explicit cross-scale causal interactions. It mentions balancing consumer dynamics and allowing sharper focus, but these are strategic outcomes rather than concrete actors influencing other actors across scales.",Yes,0.56,"Organizational, Environmental and Societal",Organizational -> Environmental and Societal,Organizational -> Environmental and Societal,"Organizational: A company reorganizes regions into Zone EMENA and references Zone Asia, Oceania and Africa.; Environmental and Societal: Consumer dynamics and market opportunities across geographies.","[Organizational, Environmental and Societal] The firm's creation of Zone EMENA is stated to balance consumer dynamics/opportunities across geographies.","The text explicitly claims the organizational restructuring balances consumer dynamics/opportunities, creating a cross-scale effect. Other mentions (e.g., sharper focus in another zone) are intra-organizational and excluded. No inter-organizational or individual actors are present.",No,0.9,N/A,N/A,N/A,N/A,N/A,The paragraph describes a geographical integration strategy but lacks explicit cross-scale causal interactions between defined scales.,Yes,1.0,"Organizational, Individual",Organizational -> Individual,Organizational -> Individual,Organizational: The 'We' (implied company) and the 'Zone EMENA' are organizational entities/structures.; Individual: 'consumer dynamics' refers to the characteristics and behaviors of individual consumers.,"[Individual, Organizational] An organizational integration aims to balance individual consumer dynamics.","The text describes an organizational decision to integrate regions into a new zone. This organizational action is explicitly stated to 'balance the different consumer dynamics', which are characteristics of individuals. This establishes a direct causal link from the Organizational scale to the Individual scale."
7,Mixed,,No,Split Yes/No,Nestle_Annual_Report_2014_page_8.pdf,"The new Nestlé Business Excellence function is led by Chris Johnson, the former head of Zone Americas. Zone Americas is now led by Laurent Freixe, the former head of Zone Europe, and the new Zone EMENA by Luis Cantarell, who previously was in charge of Nestlé Nutrition and Nestlé Health Science. The new head of Nestlé Nutrition is Heiko Schipper, who was formerly responsible for our Global Infant Nutrition division. Nestlé Health Science is led by Greg Behar, who joined the company from Boehringer Ingelheim in July. The newly established Nestlé Skin Health is led by Humberto Antunes, former ly the Chief Executive Officer of our joint venture Galderma.",No,0.9,N/A,N/A,N/A,N/A,N/A,"The paragraph describes organizational restructuring and leadership appointments within Nestlé, but contains no explicit causal interactions between different hierarchical scales. All described actions involve organizational-level role changes without cross-scale influence.",Yes,0.86,"Individual, Organizational",Individual -> Organizational,Individual -> Organizational,"Individual: Named executives (e.g., Chris Johnson, Laurent Freixe).; Organizational: Nestlé units/companies (e.g., Business Excellence, Zone Americas, Nestlé Nutrition).","[Individual, Organizational] Named executives lead specific Nestlé units, indicating person-to-organization influence.","The text explicitly states individuals lead organizations ('is led by'), a clear cross-scale causal influence. Only Individual and Organizational scales are present; no societal or inter-organizational systems are described.",No,0.9,N/A,N/A,N/A,N/A,N/A,"The paragraph describes organizational changes within Nestlé, but no explicit cross-scale causal interactions are mentioned between different scales.",Yes,1.0,"Individual, Organizational",Individual -> Organizational | Individual -> Organizational | Individual -> Organizational | Individual -> Organizational | Individual -> Organizational | Individual -> Organizational | Individual -> Organizational | Individual -> Organizational | Individual -> Organizational | Individual -> Organizational | Organizational -> Individual | Individual -> Organizational | Individual -> Organizational,Individual -> Organizational,"Individual: Specific people (e.g., Chris Johnson, Laurent Freixe, Greg Behar) are identified as actors.; Organizational: Specific organizations or formal internal units (e.g., Nestlé Business Excellence function, Zone Americas, Boehringer Ingelheim, Galderma) are identified as actors.","[Individual, Organizational] The text details numerous instances of individuals leading organizational units and one instance of an organization hiring an individual.","The paragraph explicitly describes multiple individuals leading or having led specific organizational units, establishing clear causal links from the Individual to the Organizational scale. Additionally, one instance of an organization influencing an individual by hiring them is present. No other scales or types of cross-scale interactions were identified."
