279,Yes,,Yes,Unanimous,Unilever_Annual_Report_and_Accounts_2014_Strategic_Report_page_25.pdf,"Unilever’s work in moving from commitment to action in combating deforestation has been recognised. In November, we were ranked joint first for corporate action on tackling deforestation in our sector by CDP, formerly the Carbon Disclosure Project. The CDP report was produced on behalf of 240 investors, who together represent US $15 trillion in assets, and analysed the disclosures of 152 companies from around the world. It said: “Companies that regularly respond to CDP’s forests program are now identifying many more opportunities available to them, including securing their supply chain against the risks associated with deforestation and commodity sourcing. This in turn is helping to secure shareholder value.”",Yes,0.85,"Organizational, Inter-Organizational / Sector, Environmental and Societal",Inter-Organizational / Sector -> Organizational | Environmental and Societal -> Inter-Organizational / Sector | Inter-Organizational / Sector -> Environmental and Societal,Inter-Organizational / Sector -> Organizational,"Organizational: Unilever as a specific company and the 152 analyzed companies; Inter-Organizational / Sector: CDP program, supply chains, and sector-wide corporate actions; Environmental and Societal: 240 investors representing $15 trillion in assets and shareholder value systems","[Organizational, Inter-Organizational, Environmental] CDP program ranks companies while serving investor interests and securing shareholder value","The text shows explicit causality: investors commission CDP analysis, CDP evaluates companies, and this process secures shareholder value. Each link represents direct influence described in the paragraph.",Yes,0.78,"Organizational, Inter-Organizational / Sector, Environmental and Societal",Environmental and Societal -> Organizational | Organizational -> Inter-Organizational / Sector | Inter-Organizational / Sector -> Environmental and Societal,Inter-Organizational / Sector -> Environmental and Societal,"Organizational: CDP, Unilever, and companies are single organizations.; Inter-Organizational / Sector: Supply chains span multiple organizations.; Environmental and Societal: Investors and shareholder value relate to capital markets.","[Organizational, Inter-Organizational / Sector, Environmental and Societal] Investors prompted CDP’s report; companies secured supply chains, which in turn helped secure shareholder value.","Investors (capital markets) caused CDP (an organization) to produce the report. Companies’ actions affected supply chains, and secured supply chains helped shareholder value. Same-scale org–org effects were excluded.",Yes,0.9,"Organizational, Inter-Organizational / Sector, Environmental and Societal",Organizational -> Inter-Organizational / Sector | Inter-Organizational / Sector -> Environmental and Societal,Organizational -> Inter-Organizational / Sector,Organizational: Unilever is a specific company.; Inter-Organizational / Sector: CDP report involves multiple companies and investors.; Environmental and Societal: Investors represent a societal-level financial system.,"[Organizational, Inter-Organizational / Sector, Environmental and Societal] Unilever's deforestation actions influenced its CDP ranking, affecting investor decisions and societal assets.","Unilever's actions (Organizational) led to a high CDP ranking (Inter-Organizational / Sector), which impacts investor decisions (Environmental and Societal). These scales are clearly defined and linked.",Yes,1.0,"Organizational, Inter-Organizational / Sector, Environmental and Societal",Environmental and Societal -> Organizational | Organizational -> Inter-Organizational / Sector | Inter-Organizational / Sector -> Environmental and Societal,Inter-Organizational / Sector -> Environmental and Societal,"Organizational: CDP is a single NGO/agency. Unilever is a single company.; Inter-Organizational / Sector: Refers to a collective of 152 companies or 'companies' generally within a sector, indicating sector-level dynamics and supply chain actions.; Environmental and Societal: 240 investors represent capital markets. Shareholder value is an outcome within the capital market system.","[Organizational, Inter-Organizational / Sector, Environmental and Societal] Investors influence CDP, whose program guides companies in securing supply chains, ultimately impacting shareholder value.","The paragraph describes a causal chain where Environmental and Societal actors (investors) influence an Organizational actor (CDP). CDP's program then guides Inter-Organizational / Sector actors (companies) to take actions that, in turn, secure Environmental and Societal outcomes (shareholder value). Three distinct scales were clearly identified and linked."
280,Mixed,,No,Split Yes/No,Unilever_Annual_Report_and_Accounts_2014_Strategic_Report_page_25.pdf,In 2014 we were able to announce a significant achievement that by the end of the year all palm oil directly sourced for Unilever’s European Foods business was close to 100% traceable and certified sustainable (over 98% in December 2014 and on track to be 100% by the end of March 2015).,No,0.9,N/A,N/A,N/A,N/A,N/A,The paragraph describes Unilever's achievement in sourcing sustainable palm oil but contains no explicit cross-scale causal interactions. It only reports an organizational outcome without describing how different scales influenced each other.,No,0.73,N/A,N/A,N/A,N/A,N/A,The text reports Unilever’s achievement/status on palm oil traceability and certification but does not state a causal influence between distinct scales.,Yes,0.9,"Organizational, Inter-Organizational / Sector",Inter-Organizational / Sector -> Organizational,Inter-Organizational / Sector -> Organizational,Organizational: Unilever's European Foods business is a specific organization.; Inter-Organizational / Sector: The sourcing of palm oil involves supply chains and certification systems.,"[Organizational, Inter-Organizational / Sector] The traceability and certification of palm oil supply chains impact Unilever's European Foods business operations.","The paragraph describes how the certification and traceability of palm oil, a supply chain activity, directly affect Unilever's business operations. This is a clear cross-scale interaction between the supply chain and the organization.",No,1.0,N/A,N/A,N/A,N/A,N/A,"The paragraph describes an achievement by Unilever's European Foods business (Organizational scale) regarding the attributes of its sourced palm oil. It does not explicitly state any causal influence from or to another distinct scale. The 'certified sustainable' status is an attribute of the product, not an explicit interaction between different scales or actors."
281,Yes,,Yes,Unanimous,Unilever_Annual_Report_and_Accounts_2014_Strategic_Report_page_25.pdf,"On a global level Unilever is working hard to drive transparency in the palm oil supply chain. We now have visibility of about 1,800 crude palm oil mills, representing around two thirds of all mills in the global palm oil industry. We can also demonstrate traceability to a consumer product, which five years ago appeared unachievable. This represents a considerable breakthrough for Unilever and the food industry generally.",Yes,0.85,"Organizational, Inter-Organizational / Sector, Individual",Organizational -> Inter-Organizational / Sector | Inter-Organizational / Sector -> Individual,Organizational -> Inter-Organizational / Sector,Organizational: Unilever as a single company driving transparency initiatives; Inter-Organizational / Sector: Palm oil supply chain involving multiple organizations and mills across the industry; Individual: Consumers who purchase and use the traceable products,"[Org->Inter-Org->Individual] Unilever drives palm oil supply chain transparency, enabling product traceability to consumers","Two clear cross-scale links: Unilever (organizational) actively transforming supply chain systems (inter-organizational), which then enables traceability to consumer products (individual level). The chain flows from company action to industry transformation to consumer benefit.",Yes,0.78,"Organizational, Inter-Organizational / Sector",Organizational -> Inter-Organizational / Sector,Organizational -> Inter-Organizational / Sector,Organizational: Unilever is a single company.; Inter-Organizational / Sector: The palm oil supply chain and the global food industry are sector-level systems.,"[Organizational, Inter-Organizational / Sector] Unilever acts to increase transparency in the palm oil supply chain, benefiting the broader food industry.","The text explicitly states Unilever is driving transparency in a sector-level supply chain. Other mentions (mills, consumer product) do not state cross-scale causality. Thus only Org -> Inter-Org is included.",Yes,0.9,"Organizational, Inter-Organizational / Sector",Organizational -> Inter-Organizational / Sector,Organizational -> Inter-Organizational / Sector,Organizational: Unilever is a specific organization.; Inter-Organizational / Sector: The palm oil supply chain involves multiple organizations.,"[Organizational, Inter-Organizational / Sector] Unilever's actions enhance transparency in the palm oil supply chain, impacting the food industry.","Unilever (Organizational) is actively improving transparency in the palm oil supply chain (Inter-Organizational / Sector), showing a clear cross-scale interaction. No other scales are explicitly involved.",Yes,1.0,"Organizational, Inter-Organizational / Sector",Organizational -> Inter-Organizational / Sector | Organizational -> Inter-Organizational / Sector,Organizational -> Inter-Organizational / Sector,"Organizational: Unilever and crude palm oil mills are specific organizations.; Inter-Organizational / Sector: Palm oil supply chain, global palm oil industry, and food industry represent systems or collaborations among organizations.","[Organizational, Inter-Organizational / Sector] Unilever's organizational efforts drive transparency and breakthroughs within the broader inter-organizational palm oil and food industries.","The paragraph explicitly describes Unilever (Organizational) influencing the palm oil supply chain and food industry (both Inter-Organizational / Sector) through its efforts in transparency and achieving breakthroughs. Only two distinct scales were identified, meeting the scale limitation."
282,Yes,,Yes,Unanimous,Unilever_Annual_Report_and_Accounts_2014_Strategic_Report_page_25.pdf,Unilever is determined to work with the palm oil industry to drive deforestation out of its supply chain. Knowing the origin of palm oil is vital to halt deforestation.,Yes,0.85,"Organizational, Inter-Organizational / Sector, Environmental and Societal",Organizational -> Inter-Organizational / Sector | Inter-Organizational / Sector -> Environmental and Societal,Organizational -> Inter-Organizational / Sector,Organizational: Unilever as a specific company; Inter-Organizational / Sector: Palm oil industry and supply chain systems; Environmental and Societal: Deforestation as an environmental system,[Org->Inter-Org->Env] Unilever works with palm oil industry to eliminate deforestation from supply chains,"Clear causal chain where Unilever influences industry practices, which in turn affects environmental outcomes. Two explicit cross-scale interactions form a sequential pathway from company to environmental impact.",Yes,0.66,"Organizational, Inter-Organizational / Sector",Organizational -> Inter-Organizational / Sector,Organizational -> Inter-Organizational / Sector,Organizational: Unilever is a single company.; Inter-Organizational / Sector: The palm oil industry and a supply chain are multi-organization systems.,"[Organizational, Inter-Organizational] Unilever plans to work with the palm oil industry to change its supply chain.","The text explicitly states Unilever will act with the industry to alter its supply chain, a cross-scale link from organization to inter-org. Deforestation is a phenomenon, not an actor, so environmental scale is excluded.",Yes,0.9,"Organizational, Inter-Organizational / Sector",Organizational -> Inter-Organizational / Sector,Organizational -> Inter-Organizational / Sector,Organizational: Unilever is a specific company.; Inter-Organizational / Sector: The palm oil industry represents a sector.,"[Organizational, Inter-Organizational / Sector] Unilever seeks to influence the palm oil industry to eliminate deforestation from its supply chain.","Unilever (Organizational) is explicitly working with the palm oil industry (Inter-Organizational) to address deforestation, showing a clear cross-scale interaction.",Yes,1.0,"Organizational, Inter-Organizational / Sector, Environmental and Societal",Organizational -> Inter-Organizational / Sector | Inter-Organizational / Sector -> Environmental and Societal,Inter-Organizational / Sector -> Environmental and Societal,Organizational: Unilever is a single company.; Inter-Organizational / Sector: The 'palm oil industry' and 'supply chain' represent systems among organizations.; Environmental and Societal: 'Deforestation' is an environmental issue.,"[Organizational, Inter-Organizational / Sector, Environmental and Societal] Unilever (Organizational) collaborates with the palm oil industry (Inter-Organizational / Sector) to eliminate deforestation (Environmental and Societal).",The text explicitly describes Unilever (Organizational) engaging with the palm oil industry (Inter-Organizational / Sector). This collaboration then aims to causally influence deforestation (Environmental and Societal) by driving it out of the supply chain.
283,Yes,,Yes,Unanimous,Unilever_Annual_Report_and_Accounts_2014_Strategic_Report_page_25.pdf,"We want to build on our progress in Europe by repeating the achievement internationally. One of the next steps is our new processing plant in Sei Mangke, Indonesia. The plant is a significant investment to source palm oil from known and certified sources for our global use.",Yes,0.85,"Organizational, Environmental and Societal",Organizational -> Environmental and Societal,Organizational -> Environmental and Societal,Organizational: The company making the investment and operating the processing plant; Environmental and Societal: Indonesia as a country/region where the plant is located,"[Organizational, Environmental and Societal] Company invests in Indonesian processing plant for global palm oil sourcing",The text explicitly describes a company making a significant investment to build a processing plant in Indonesia. This represents clear organizational action affecting a geographical/societal location.,Yes,0.66,"Organizational, Inter-Organizational / Sector",Organizational -> Inter-Organizational / Sector,Organizational -> Inter-Organizational / Sector,Organizational: A company builds and invests in its processing plant.; Inter-Organizational / Sector: Sourcing from known and certified palm oil suppliers involves the supply chain.,"[Organizational, Inter-Organizational / Sector] The company’s new plant enables sourcing palm oil from certified suppliers.","The text explicitly links the company’s plant investment to sourcing from certified suppliers, a supply-chain action. No other scale interactions are stated, so only org-to-inter-org is included.",Yes,0.9,"Organizational, Environmental and Societal",Organizational -> Environmental and Societal,Organizational -> Environmental and Societal,Organizational: The company building the processing plant.; Environmental and Societal: The sourcing of palm oil from certified sources.,"[Organizational, Environmental and Societal] The company's new plant in Indonesia affects palm oil sourcing practices globally.",The paragraph describes a company's action (building a plant) that impacts societal-level sourcing practices. No other scales are explicitly involved.,Yes,0.9,"Organizational, Inter-Organizational / Sector, Environmental and Societal",Organizational -> Environmental and Societal | Organizational -> Inter-Organizational / Sector,Organizational -> Inter-Organizational / Sector,"Organizational: Refers to 'We' (the company) and 'our new processing plant'.; Inter-Organizational / Sector: Refers to 'known and certified sources', implying a network of suppliers or a supply chain.; Environmental and Societal: Refers to 'Europe', 'internationally', and 'Sei Mangke, Indonesia' as geographical and market contexts.","[Organizational, Inter-Organizational / Sector, Environmental and Societal] An organization builds on past progress in Europe and establishes a plant to source from certified inter-organizational supply chains.","Two distinct hierarchical cross-scale links were identified. The company (Organizational) influences the Environmental and Societal context through its progress. The new plant (Organizational) causally interacts with Inter-Organizational / Sector supply chains by sourcing from them. Only three distinct scales were identified, adhering to the protocol."
284,Yes,,Yes,Unanimous,Unilever_Annual_Report_and_Accounts_2014_Strategic_Report_page_26.pdf,"In 2014 Unilever enhanced its Unilever Sustainable Living Plan (USLP) by introducing new pillars to its goal of enhancing livelihoods. These were: fairness in the workplace, where we will advance human rights across our operations and extended supply chain; opportunities for women, where we will empower 5 million women by 2020; and inclusive business, where we will have a positive impact on the lives of 5.5 million people by 2020.",Yes,0.85,"Organizational, Inter-Organizational / Sector, Individual",Organizational -> Inter-Organizational / Sector | Organizational -> Individual,Organizational -> Individual,Organizational: Unilever as a single company implementing USLP; Inter-Organizational / Sector: Extended supply chain involving multiple organizations; Individual: 5 million women and 5.5 million people as specific individuals,"[Organizational, Inter-Organizational, Individual] Unilever's USLP targets supply chain human rights and individual empowerment","Unilever explicitly commits to advancing human rights across its supply chain and directly impacting millions of individuals through empowerment programs. The supply chain link represents organizational influence on inter-organizational systems, while the individual impact represents direct organizational-to-individual influence.",Yes,0.8,"Organizational, Inter-Organizational / Sector, Individual",Organizational -> Inter-Organizational / Sector | Organizational -> Individual,Organizational -> Individual,Organizational: Unilever as a single company implementing the USLP.; Inter-Organizational / Sector: The 'extended supply chain' spanning multiple organizations.; Individual: Women and people whose lives are targeted for empowerment/impact.,"[Organizational, Inter-Organizational / Sector, Individual] Unilever’s plan pushes human rights across its supply chain and commits to empower 5M women, directly affecting individuals.","The text explicitly states Unilever’s actions affecting its multi-organization supply chain and individual women/people. No explicit societal/government actor is named, so scales are limited to these three.",Yes,0.9,"Organizational, Individual, Inter-Organizational / Sector",Organizational -> Individual | Organizational -> Inter-Organizational / Sector,Organizational -> Individual,Organizational: Unilever is a company implementing the USLP.; Individual: The plan aims to empower and impact millions of individuals.; Inter-Organizational / Sector: The plan involves Unilever's extended supply chain.,"[Organizational, Individual, Inter-Organizational / Sector] Unilever's USLP aims to empower individuals and influence its supply chain, showing cross-scale interactions.","The paragraph describes Unilever's organizational actions affecting individuals and its supply chain. These interactions are explicit, with clear goals and targets.",Yes,1.0,"Organizational, Inter-Organizational / Sector, Individual",Organizational -> Inter-Organizational / Sector | Organizational -> Individual,Organizational -> Individual,Organizational: Unilever is a single company.; Inter-Organizational / Sector: The extended supply chain represents a system among organizations.; Individual: Women and people are specific groups of individuals.,"[Organizational, Inter-Organizational / Sector, Individual] Unilever's plan explicitly links its organizational actions to influencing its supply chain and directly impacting individuals.","The text explicitly describes Unilever (Organizational) acting to influence its extended supply chain (Inter-Organizational / Sector) and directly impacting women and people (Individual). All identified scales are distinct and causal relationships are clearly stated. Only three distinct scales were identified, adhering to the protocol."
285,Mixed,,No,Split Yes/No,Unilever_Annual_Report_and_Accounts_2014_Strategic_Report_page_26.pdf,This latter commitment includes improving livelihoods of smallholder farmers and links directly to our USLP goal of reducing our environmental impact through sustainable sourcing.,No,0.8,N/A,N/A,N/A,N/A,N/A,"The text describes commitments and goals but lacks explicit causal relationships between actors at different scales. While smallholder farmers (Individual) and USLP goals (Organizational) are mentioned, no direct causal influence is stated - only that commitments 'include' and 'link to' these elements without specifying how one scale affects another.",Yes,0.7,"Organizational, Individual, Environmental and Societal",Organizational -> Individual | Organizational -> Environmental and Societal,Organizational -> Environmental and Societal,Organizational: The entity with 'our USLP goal' making the commitment; Individual: Smallholder farmers whose livelihoods are improved; Environmental and Societal: The environment referenced via 'reducing our environmental impact',"[Organizational, Individual, Environmental and Societal] The organization commits to improve smallholder farmers’ livelihoods and to reduce environmental impact via sustainable sourcing.","The text explicitly ties an organizational commitment to improving individuals’ livelihoods and to reducing environmental impact. No inter-organizational actor is named, so sector-level links are excluded.",Yes,0.9,"Individual, Organizational, Environmental and Societal",Individual -> Organizational | Organizational -> Environmental and Societal,Organizational -> Environmental and Societal,Individual: Smallholder farmers are specific people.; Organizational: USLP is a goal of a specific organization.; Environmental and Societal: Reducing environmental impact is a societal-level goal.,"[Individual, Organizational, Environmental and Societal] Improving farmers' livelihoods links to organizational goals and societal impact.","The paragraph describes how improving individual farmers' livelihoods is part of an organizational goal, which in turn aims to achieve a societal impact. These are clear cross-scale interactions.",Yes,0.9,"Individual, Organizational, Environmental and Societal",Organizational -> Individual | Organizational -> Environmental and Societal,Organizational -> Environmental and Societal,Individual: Refers to 'smallholder farmers'.; Organizational: Implied company making the 'commitment' and having the 'USLP goal'.; Environmental and Societal: Refers to 'environmental impact' on the broader environment.,"[Individual, Organizational, Environmental and Societal] An organizational commitment aims to improve individual livelihoods and reduce environmental impact.","The paragraph explicitly describes an organizational commitment influencing individual smallholder farmers and an organizational goal impacting the environmental and societal scale. Two distinct cross-scale causal links were identified, involving three unique scales: Individual, Organizational, and Environmental and Societal."
