100,Mixed,,No,Split Yes/No,Nestle_Annual_Report_2014_page_32.pdf,"Nestlé Health Science is supported in its work by the Nestlé Institute of Health Sciences (NIHS) which under takes fundamental scientific research into how nutrition can be used to empower people to improve and maintain their health. NIHS research teams are providing greater insight into how our environment, diet and lifestyle intersect with our genetic make-up, gut microorganisms, metabolism and nutritional status to determine our health.",Yes,0.8,"Organizational, Individual",Organizational -> Individual,Organizational -> Individual,Organizational: Nestlé Health Science and NIHS are specific organizations conducting research; Individual: People who improve and maintain their health through nutrition,"[Organizational, Individual] NIHS research empowers people to improve health through nutrition","The text explicitly states NIHS research is designed to empower people to improve their health, showing clear organizational influence on individuals. The research provides insights that directly benefit individual health outcomes.",Yes,0.58,"Environmental and Societal, Individual",Environmental and Societal -> Individual,Environmental and Societal -> Individual,Environmental and Societal: “our environment” denotes societal-level context affecting people; Individual: “people” and their “health” are individual-level,"[Environmental and Societal, Individual] The environment is explicitly cited as determining people’s health.","Only explicit cross-scale causality is environment affecting individual health. Organizational mentions (NIHS supporting Nestlé Health Science; teams providing insight) are same-scale or non-causal to individuals, so excluded.",No,0.9,N/A,N/A,N/A,N/A,N/A,The paragraph describes research activities but does not explicitly state any cross-scale causal interactions between defined scales.,Yes,0.9,"Individual, Organizational, Environmental and Societal",Environmental and Societal -> Individual,Environmental and Societal -> Individual,Individual: Refers to 'people' and 'our health' as specific individuals.; Organizational: Includes 'Nestlé Health Science' and 'Nestlé Institute of Health Sciences' as single companies/units.; Environmental and Societal: Refers to 'our environment' as a societal-level system.,"[Individual, Environmental and Societal] The environment explicitly determines individual health.","Only one explicit hierarchical cross-scale causal link was identified. The interaction between 'our environment' (Environmental and Societal) and 'our health' (Individual) is directly stated as causal. Other potential links, such as Organizational to Individual, were deemed too indirect or conditional ('can be used to empower') to meet the strict 'explicitly and causally influences' criterion."
101,Yes,,Yes,Unanimous,Nestle_Annual_Report_2014_page_32.pdf,"NIHS has established the first complete essential nutrient profiling platform for accurate analysis of nutrient status. Thanks to the development of digital applications that capture dietary intake, the institute can now combine the information about the nutritional content of diet with measurements in people’s blood. This research offers the prospect of developing personalised nutrition products, including dietary recommendations.",Yes,0.8,"Organizational, Individual",Organizational -> Individual,Organizational -> Individual,Organizational: NIHS as an institute developing platforms and research capabilities; Individual: People providing blood measurements and receiving personalized nutrition products/recommendations,"[Organizational, Individual] NIHS develops personalized nutrition products for individuals using their blood data",The text explicitly describes NIHS (organizational level) taking measurements from people and developing personalized products for them (individual level). This represents clear cross-scale causality from organization to individual through data collection and product development.,Yes,0.72,"Individual, Organizational",Individual -> Organizational,Individual -> Organizational,Individual: People providing blood measurements and dietary intake data.; Organizational: NIHS (the institute) conducting research and combining data.,"[Individual, Organizational] People’s blood and diet data enable the institute to combine and analyze nutrient status.","Explicit wording shows individuals’ measurements enabling the institute’s data combination. No clear sector/societal actor is named; future products are speculative, so excluded.",Yes,0.9,"Organizational, Individual",Organizational -> Individual,Organizational -> Individual,Organizational: NIHS is an organization developing the nutrient profiling platform.; Individual: People whose dietary intake and blood measurements are analyzed.,"[Organizational, Individual] NIHS's platform integrates individual dietary and blood data for personalized nutrition.",N/A,Yes,1.0,"Individual, Organizational",Individual -> Organizational | Organizational -> Individual,Organizational -> Individual,Individual: Refers to 'people's blood' and 'dietary intake' from 'people'.; Organizational: Refers to 'NIHS' and 'the institute' as a single entity.,"[Individual, Organizational] The institute combines individual data to develop personalized nutrition products for people.","The paragraph describes how the Organizational scale (NIHS) collects data from the Individual scale (people) via digital applications and blood measurements. This information then enables the Organizational scale to develop products and recommendations that benefit the Individual scale, demonstrating a two-way hierarchical interaction. Only two distinct scales were identified, fitting the protocol."
102,Mixed,,No,Split Yes/No,Nestle_Annual_Report_2014_page_32.pdf,It has also built a natural products screening platform to discover compounds that may already exist in diets around the world and which can be used to improve metabolic and ageing health.,No,0.9,N/A,N/A,N/A,N/A,N/A,The paragraph describes a platform and its capabilities but lacks explicit actors and causal relationships between different scales. No cross-scale interactions are present.,No,0.62,N/A,N/A,N/A,N/A,N/A,"No explicit cross-scale causality is stated. An organization built a platform and the compounds ‘can be used’ to improve individual health, but compounds aren’t a defined actor and no direct org-to-individual effect is explicitly claimed.",No,0.9,N/A,N/A,N/A,N/A,N/A,The paragraph describes a platform but does not specify any cross-scale causal interactions between defined scales.,Yes,0.9,"Individual, Organizational",Individual -> Organizational | Organizational -> Individual,Organizational -> Individual,Individual: Refers to people consuming 'diets around the world' and whose 'metabolic and ageing health' is improved.; Organizational: Refers to 'It' (the entity) which built the platform and discovers compounds.,"[Individual, Organizational] An organization discovers compounds from individual diets to improve individual health.","Two distinct scales, Individual and Organizational, were identified. The Individual scale influences the Organizational scale as compounds from individual diets are the source material for the organization's discovery process. Conversely, the Organizational scale influences the Individual scale as the discovered compounds are intended to improve individual health. No other scales or explicit cross-scale causal links were present."
103,Yes,,Yes,Unanimous,Nestle_Annual_Report_2014_page_32.pdf,"Nestlé’s Jian Xin Double Care, a specially designed milk to enhance heart and bone health for middle-aged and senior adults, was launched in China in December 2013. The product contains phytosterols, which lower LDL (‘bad’) cholesterol, as well as calcium and vitamin D. The brand raises awareness of heart health with in-store health checks and offers toll-free phone contact with doctors to discuss cardiovascular health.",Yes,0.85,"Organizational, Individual",Organizational -> Individual,Organizational -> Individual,Organizational: Nestlé as a company launching products and implementing brand strategies; Individual: Middle-aged and senior adults as target consumers receiving health services,"[Organizational, Individual] Nestlé provides health awareness and services to individual consumers","Clear hierarchical interaction where Nestlé (organizational) explicitly influences individuals through awareness campaigns and health services. Only two scales present, making analysis straightforward.",Yes,0.78,"Organizational, Individual",Organizational -> Individual | Organizational -> Individual | Organizational -> Individual,Organizational -> Individual,Organizational: Nestlé’s Jian Xin Double Care brand acts via product and services.; Individual: Middle-aged/senior adults and doctors are specific people affected/involved.,"[Organizational->Individual] The brand’s product and services lower LDL, raise awareness, and enable health discussions for individuals.",All described actions are by a brand (organization) affecting people (individuals). No inter-organizational or societal actors causally influence or are influenced here; China is only a location.,Yes,0.9,"Individual, Organizational",Organizational -> Individual,Organizational -> Individual,Individual: Middle-aged and senior adults as consumers.; Organizational: Nestlé as the company launching the product.,"[Organizational, Individual] Nestlé's product launch directly targets individual health needs, influencing consumer behavior.",The paragraph describes Nestlé (Organizational) launching a product to influence the health of individuals. No other scales are explicitly involved in a causal relationship.,Yes,1.0,"Organizational, Individual",Organizational -> Individual,Organizational -> Individual,"Organizational: Nestlé is a single company.; Individual: Middle-aged and senior adults, and doctors are specific people.","[Organizational, Individual] Nestlé (Organizational) influences individuals by launching products, raising awareness, and providing access to doctors.","The paragraph explicitly describes Nestlé (Organizational) launching a product, raising awareness, and offering doctor consultations for middle-aged and senior adults (Individual). These actions represent a clear causal influence from the organizational scale to the individual scale. Only two distinct scales were identified as interacting."
104,No,,Yes,Unanimous,Nestle_Annual_Report_2014_page_32.pdf,"Nestlé Fitness biscuits are wholegrain cereal-based snacks low in fat and calories. After just three years, Nestlé Fitness biscuits hold the number one position in Brazil’s healthy biscuit segment. The biscuits are sold across South America and in Israel.",No,0.9,N/A,N/A,N/A,N/A,N/A,The paragraph describes product characteristics and market performance but contains no explicit causal interactions between different scales. It presents factual information about Nestlé Fitness biscuits without describing how actors at different hierarchical levels influence each other.,No,0.67,N/A,N/A,N/A,N/A,N/A,"Text describes product attributes, market presence, and rank but no explicit cross-scale causal influence between actors at different scales.",No,0.9,N/A,N/A,N/A,N/A,N/A,The paragraph describes the success of a product but does not explicitly mention any cross-scale causal interactions between defined scales.,No,1.0,N/A,N/A,N/A,N/A,N/A,"The paragraph describes Nestlé (Organizational) and its product's market position. While 'Brazil’s healthy biscuit segment' could be mapped to Environmental and Societal, the text only states Nestlé 'holds the number one position' within it, which is an outcome for the organization, not an explicit causal interaction between Nestlé and the market system itself. No other actors or explicit cross-scale causal links are present."
105,Mixed,,No,Split Yes/No,Nestle_Annual_Report_2014_page_32.pdf,"Golden Morn is a ready-to-eat breakfast cereal sold in Nigeria, made of maize or millet, and fortified with micronutrients vitamin A and iron.",No,0.9,N/A,N/A,N/A,N/A,N/A,The paragraph only provides descriptive information about Golden Morn cereal's composition and market location. No actors or causal interactions between different scales are described.,No,0.83,N/A,N/A,N/A,N/A,N/A,"The sentence describes a product, ingredients, and market location without explicit causal influence between different scales.",No,0.9,N/A,N/A,N/A,N/A,N/A,The paragraph describes a product and its characteristics without indicating any cross-scale causal interactions.,Yes,1.0,"Organizational, Environmental and Societal",Organizational -> Environmental and Societal,Organizational -> Environmental and Societal,"Organizational: Golden Morn is a brand/product, representing an organization's offering.; Environmental and Societal: Nigeria represents a national market/country.","[Organizational, Environmental and Societal] An organizational brand is sold within a national market.","The paragraph describes a product (Organizational scale) being sold in a specific country (Environmental and Societal scale), indicating a direct causal influence of the organization's market activity on the societal context. Only two distinct scales were identified."
106,Yes,,Yes,Unanimous,Nestle_Annual_Report_2014_page_33.pdf,"In 2014, we transformed a dairy factory in Mexico into the company’s first ‘zero water’ manufacturing site in the world. Cow’s milk is 88% water, so by extracting some of it to use in the factory’s systems, we are saving enough water to meet the average daily consumption of 6400 people in the surrounding area.",Yes,0.85,"Organizational, Environmental and Societal",Organizational -> Environmental and Societal,Organizational -> Environmental and Societal,Organizational: The company and its dairy factory implementing zero water manufacturing; Environmental and Societal: The surrounding area community of 6400 people and water resource conservation,"[Organizational, Environmental and Societal] Company factory water extraction benefits surrounding community water availability","The text explicitly states the company's factory transformation saves water meeting consumption needs of 6400 people in the surrounding area, showing clear organizational action impacting societal water resources.",Yes,0.77,"Organizational, Individual",Organizational -> Individual,Organizational -> Individual,Organizational: The company transformed the factory and extracts water for its systems.; Individual: ‘6400 people in the surrounding area’ whose daily water consumption is referenced.,"[Organizational, Individual] Company’s zero-water factory process saves water quantified as meeting daily consumption of 6400 local people.","The organization’s factory change causes water savings explicitly measured against local people’s daily use, forming an org-to-individual impact. No inter-organizational or societal actors are explicitly involved.",Yes,0.9,"Organizational, Environmental and Societal",Organizational -> Environmental and Societal,Organizational -> Environmental and Societal,"Organizational: The dairy factory is part of a company, making it an organizational scale.; Environmental and Societal: The water savings impact the daily consumption of people in the surrounding area, a societal scale.","[Organizational, Environmental and Societal] The factory's water-saving measures impact local water availability for 6400 people.","The paragraph describes how the factory's actions (organizational) save water, affecting the local population's water consumption (societal). No other scales are involved.",Yes,1.0,"Organizational, Individual",Organizational -> Individual,Organizational -> Individual,Organizational: Refers to 'the company' and its 'dairy factory' as a single entity.; Individual: Refers to '6400 people in the surrounding area' as specific people/households.,"[Organizational, Individual] The company's water-saving initiative directly benefits the water consumption of local individuals.","The paragraph explicitly describes how the Organizational actor (the company) through its water-saving actions causally influences the Individual actors (6400 people) by meeting their water consumption needs. Only two distinct scales were identified, fitting the protocol."
107,Yes,,Yes,Unanimous,Nestle_Annual_Report_2014_page_33.pdf,"The new technology used at the factory in Jalisco, Mexico, heats milk at low pressure to remove some of the water. The resulting steam is then condensed and treated and used to clean machines. It is then recycled and used again. The process reduces by 15% the total amount of water used by Nestlé Mexico. Work is now underway to deploy similar tech nology in five other manufacturing sites in water stressed are as around the world. It is just one of a number of water-saving initiatives we have introduced in recent years, allowing us to reduce total water withdrawal in absolute terms by almost one third in the last decade.",Yes,0.85,"Organizational, Inter-Organizational / Sector",Organizational -> Inter-Organizational / Sector,Organizational -> Inter-Organizational / Sector,Organizational: Nestlé Mexico as one company and the specific factory in Jalisco; Inter-Organizational / Sector: Five other manufacturing sites around the world representing multi-organizational deployment,"[Organizational, Inter-Organizational] Nestlé Mexico's water-saving technology scales to multiple global manufacturing sites","The text explicitly states that technology developed at one organizational unit (Nestlé Mexico factory) is being deployed across multiple manufacturing sites globally, representing clear organizational-to-inter-organizational scaling. Only two distinct scales are present in the causal chain described.",Yes,0.72,"Organizational, Environmental and Societal",Organizational -> Environmental and Societal,Organizational -> Environmental and Societal,"Organizational: Nestlé Mexico and its factory are formal organizational units.; Environmental and Societal: Water resources/community water systems (water-stressed areas, water withdrawal).","[Organizational, Environmental and Societal] Nestlé Mexico cut water withdrawal, directly reducing extraction from environmental water sources.","The text explicitly states the organization reduced total water withdrawal, an action affecting environmental water systems. Factory-to-company effects are same-scale, and targeting water-stressed areas lacks explicit causal wording.",Yes,0.9,"Organizational, Inter-Organizational / Sector",Organizational -> Inter-Organizational / Sector,Organizational -> Inter-Organizational / Sector,Organizational: Nestlé Mexico is a specific organization.; Inter-Organizational / Sector: The deployment of technology across multiple manufacturing sites indicates a sector-level initiative.,"[Organizational, Inter-Organizational / Sector] Nestlé Mexico's water-saving technology is being deployed sector-wide, impacting water use in multiple sites.","The paragraph describes how Nestlé Mexico's technology is being expanded to other sites, indicating a cross-scale influence from an organizational level to a sector level. No other scales are explicitly involved.",Yes,0.9,"Organizational, Environmental and Societal",Environmental and Societal -> Organizational,Environmental and Societal -> Organizational,"Organizational: Nestlé, Nestlé Mexico, and its manufacturing sites are specific companies or parts of a company.; Environmental and Societal: Water stressed areas represent a condition of an ecosystem or community at a societal level.","[Organizational, Environmental and Societal] Water stressed areas influence Nestlé's organizational decisions to deploy water-saving technology.",The paragraph describes Nestlé (Organizational) deploying technology in response to the condition of 'water stressed areas' (Environmental and Societal). This establishes a clear causal link where the environmental context influences organizational action. Only two distinct scales were identified.
108,Yes,,Yes,Unanimous,Nestle_Annual_Report_2014_page_33.pdf,"Today our people are carrying out 170 water-saving projects in Nestlé factories, which will save around 3.6 million cubic metres of water.",Yes,0.85,"Individual, Organizational",Individual -> Organizational,Individual -> Organizational,Individual: People (workers) carrying out specific projects; Organizational: Nestlé factories as organizational units,"[Individual, Organizational] Workers implement water-saving projects affecting factory operations",Clear causal link where individual workers' actions (carrying out projects) directly influence organizational outcomes (factory water savings). Only two scales present with explicit cross-scale causality.,Yes,0.84,"Individual, Organizational, Environmental and Societal",Individual -> Organizational | Organizational -> Environmental and Societal,Organizational -> Environmental and Societal,Individual: 'our people' executing projects; Organizational: Nestlé factories where projects occur; Environmental and Societal: water resources affected (savings),[Individual | Organizational | Environmental] Employees run factory projects that cut water use by ~3.6 million m³.,"Individuals implement projects within the organization, explicitly linking people to factory actions. Those organizational actions are stated to cause water savings, an environmental effect. Three clear scales suffice.",Yes,0.9,"Individual, Organizational",Individual -> Organizational,Individual -> Organizational,Individual: Refers to 'our people' who are specific workers or groups.; Organizational: Refers to 'Nestlé factories' as part of the organization.,"[Individual, Organizational] Workers are executing water-saving projects in Nestlé factories.","The paragraph describes workers (Individual) executing projects in Nestlé factories (Organizational), showing a clear cross-scale interaction. No other scales are present.",Yes,1.0,"Individual, Organizational",Individual -> Organizational,Individual -> Organizational,"Individual: Refers to 'our people', specific individuals working for Nestlé.; Organizational: Refers to 'Nestlé factories' and 'Nestlé' implicitly, representing a single company.","[Individual, Organizational] Individuals' actions directly implement organizational projects.","The paragraph explicitly describes 'our people' (Individual) 'carrying out' projects within 'Nestlé factories' (Organizational), establishing a direct causal link from individual actions to organizational initiatives. Only two distinct scales were identified."
