193,Yes,,Yes,Unanimous,Unilever_Annual_Report_and_Accounts_2014_Strategic_Report_page_13.pdf,"Unilever’s portfolio has four categories: Personal Care, Foods, Refreshment and Home Care. We have 13 brands with sales of more than €1 billion. Brands are our biggest asset but also present a risk if they do not maintain value and relevance to consumers. That’s why innovation and remaining competitive are crucial. We launched new brands in 2014, backed by marketing and customer insight, for example Regenerate, a dental care product. In addition to the Qinyuan and Talenti Gelato & Sorbetto acquisitions, we are also in the process of acquiring the Camay and Zest brands, to expand categories and boost growth. To sharpen our portfolio in 2014 we disposed of Slim. Fast, Ragu and Bertolli in North America, and other non-core Foods brands.",Yes,0.8,"Organizational, Individual",Individual -> Organizational,Individual -> Organizational,"Organizational: Unilever as a company with its brands, innovation activities, and strategic decisions; Individual: Consumers who determine brand value and relevance through their preferences and behaviors","[Individual, Organizational] Consumer preferences drive Unilever's brand strategy and portfolio decisions","The text explicitly states that brands present risk 'if they do not maintain value and relevance to consumers,' showing clear causal influence from consumer behavior to organizational strategy. Only two scales are present in this internal corporate discussion.",Yes,0.73,"Individual, Organizational",Individual -> Organizational,Individual -> Organizational,Individual: Consumers/customers are specific people influencing decisions and value.; Organizational: Unilever and its brands/portfolio are organizational units.,"[Individual, Organizational] Consumer relevance determines brand value/risk within Unilever’s portfolio.","The text explicitly ties brand risk to consumer relevance, a cross-scale causal link from individuals to the organization. Other statements (marketing/customer insight) also imply consumer-driven organizational action but are redundant in scale.",Yes,0.9,"Organizational, Individual",Organizational -> Individual,Organizational -> Individual,Organizational: Unilever and its brands are organizations.; Individual: Consumers are individuals influenced by brand value and relevance.,"[Organizational, Individual] Unilever's brand strategies aim to maintain consumer relevance, showing cross-scale influence.","Unilever's actions (Organizational) directly aim to influence consumer perceptions and behaviors (Individual). The text explicitly states the need for brands to maintain value and relevance to consumers, indicating a clear cross-scale interaction.",Yes,1.0,"Individual, Organizational",Individual -> Organizational | Individual -> Organizational,Individual -> Organizational,"Individual: Consumers/Customers are specific people whose perceptions and data are referenced.; Organizational: Unilever and its specific brands (e.g., Regenerate) are single organizations as per the provided definition.","[Individual, Organizational] Consumers' perceptions and data directly influence the value, risk, and strategic development of Unilever's brands.","The analysis identified two distinct causal links between Individual actors (consumers/customers) and Organizational actors (brands, customer insight). Consumers' perceptions directly determine brand value and risk, while individual customer data forms the basis for organizational customer insight. The definition of 'brand' as an 'Organizational' actor meant that interactions between Unilever and its brands were considered same-scale and excluded."
194,Yes,,Yes,Unanimous,Unilever_Annual_Report_and_Accounts_2014_Strategic_Report_page_13.pdf,"Unilever’s products sell in more than 190 countries and are used by 2 billion consumers every day. Our business is organised across three geographies: the Americas; Europe; and markets comprising Asia, Australasia, Africa, Middle East, Turkey, Russia, Ukraine and Belarus. We also analyse operations by developed and emerging markets. This wide spread exposes us to economic and political risks beyond our control. However, the diversity of our portfolio and geographic reach help mitigate our exposure to any specific risk.",Yes,0.8,"Organizational, Individual, Environmental and Societal",Organizational -> Individual | Environmental and Societal -> Organizational,Environmental and Societal -> Organizational,"Organizational: Unilever as a company with products and business operations; Individual: 2 billion consumers using Unilever's products daily; Environmental and Societal: Economic and political risks, developed/emerging markets across 190 countries",[Organizational-Individual-Environmental] Unilever serves 2B consumers while facing economic/political risks across 190 countries,"Two clear cross-scale interactions: Unilever (organizational) directly serves consumers (individual), while broader economic/political systems (environmental/societal) expose the company to risks. The geographic diversity helps mitigate but doesn't eliminate these systemic exposures.",Yes,0.62,"Organizational, Environmental and Societal",Environmental and Societal -> Organizational,Environmental and Societal -> Organizational,"Organizational: Unilever is a single company ('our business', 'our portfolio').; Environmental and Societal: Economic and political risks are macro-level societal systems.","[Organizational, Environmental and Societal] Unilever’s global spread leaves it subject to economic and political risks beyond its control.","The text explicitly links macro economic/political risks to Unilever’s exposure, a cross-scale effect. Consumer usage and diversification benefits are not framed as explicit cross-scale causality here.",Yes,0.9,"Individual, Organizational, Environmental and Societal",Organizational -> Environmental and Societal | Environmental and Societal -> Organizational,Organizational -> Environmental and Societal,Individual: Consumers using Unilever's products.; Organizational: Unilever as a company.; Environmental and Societal: Economic and political risks.,"[Organizational, Environmental and Societal] Unilever's global operations expose it to economic and political risks, which are mitigated by its diverse portfolio.",The paragraph describes Unilever's exposure to economic and political risks (Environmental and Societal) due to its global operations (Organizational). This is a clear cross-scale interaction.,Yes,1.0,"Individual, Organizational, Environmental and Societal",Organizational -> Individual | Environmental and Societal -> Organizational,Environmental and Societal -> Organizational,Individual: Refers to '2 billion consumers' as specific people.; Organizational: Refers to 'Unilever' and 'Our business' as a single company.; Environmental and Societal: Refers to 'economic and political risks' as societal-level systems/forces.,"[Individual, Organizational, Environmental and Societal] Unilever's organizational actions reach individual consumers, while environmental and societal risks impact the organization.","The paragraph explicitly describes Unilever (Organizational) selling products used by consumers (Individual), establishing an Organizational -> Individual link. It also states that economic and political risks (Environmental and Societal) expose Unilever (Organizational), creating an Environmental and Societal -> Organizational link. All three identified scales are clearly supported by the text."
195,Yes,,Yes,Unanimous,Unilever_Annual_Report_and_Accounts_2014_Strategic_Report_page_14.pdf,"We cannot achieve our Vision to double our size unless we find new ways to operate that decouple growth from our environmental impact, while using growth as an enabler for positive social impact. Launched in 2010, the Unilever Sustainable Living Plan (USLP) is our blueprint for sustainable growth. It is helping to drive profitable growth for our brands, save costs and fuel innovation.",Yes,0.8,"Organizational, Environmental and Societal",Organizational -> Environmental and Societal,Organizational -> Environmental and Societal,"Organizational: Unilever as a company with its Vision, USLP, brands, and growth strategy; Environmental and Societal: Environmental impact and positive social impact as societal-level outcomes","[Organizational, Environmental and Societal] Unilever's sustainable growth plan targets environmental and social outcomes",The text describes Unilever (organizational) implementing strategies that explicitly aim to influence environmental and social outcomes (environmental and societal scale). Only one clear cross-scale causal link is present.,Yes,0.78,"Organizational, Environmental and Societal",Organizational -> Environmental and Societal,Organizational -> Environmental and Societal,"Organizational: Unilever, its brands, and the USLP are organizational actors.; Environmental and Societal: “Environmental impact” and “positive social impact” are societal-scale outcomes.","[Organizational, Environmental and Societal] Unilever links its growth to shaping social benefits and reducing environmental impact.","The text explicitly connects organizational growth to societal outcomes (“enabler for positive social impact”) and to environmental effects (“decouple growth from our environmental impact”). No individual or inter-organizational actors are mentioned, so only these two scales are included.",Yes,0.9,"Organizational, Environmental and Societal",Organizational -> Environmental and Societal,Organizational -> Environmental and Societal,Organizational: Unilever is a specific organization implementing the USLP.; Environmental and Societal: The plan aims to decouple growth from environmental impact and enable positive social impact.,"[Organizational, Environmental and Societal] Unilever's USLP aims to decouple growth from environmental impact and enable positive social impact.",The paragraph describes Unilever's organizational actions (USLP) affecting environmental and societal scales by aiming to decouple growth from environmental impact and enable social impact. No other scales are explicitly involved.,Yes,0.9,"Organizational, Environmental and Societal",Organizational -> Environmental and Societal,Organizational -> Environmental and Societal,"Organizational: Unilever, its brands, and its internal plan (USLP) are single organizations or their components.; Environmental and Societal: Environmental impact and social impact represent broader societal or ecological systems.","[Organizational, Environmental and Societal] Unilever's growth strategy aims to influence environmental and social outcomes by decoupling growth from negative environmental impact and enabling positive social impact.","The paragraph explicitly states Unilever's (Organizational) intent to influence environmental and social impacts (Environmental and Societal) through its growth strategy. The USLP is an internal mechanism for this, but its direct cross-scale effects are not detailed beyond the initial statement of intent. Only two distinct scales were identified with clear causal links."
196,No,,Yes,Unanimous,Unilever_Annual_Report_and_Accounts_2014_Strategic_Report_page_14.pdf,"The USLP sets out three big, ambitious goals. Underpinning these goals are nine commitments supported by targets spanning our social and environmental performance.",No,0.9,N/A,N/A,N/A,N/A,N/A,"The paragraph describes the USLP's structure (goals, commitments, targets) but contains no actors or causal relationships between different scales. It's purely descriptive of a framework without showing cross-scale interactions.",No,0.86,N/A,N/A,N/A,N/A,N/A,"Only an organization (USLP/its owner) is described setting internal goals and targets; no explicit cross-scale causal influence with individuals, inter-organizational sectors, or societal/environmental actors.",No,0.9,N/A,N/A,N/A,N/A,N/A,The paragraph describes goals and commitments but lacks explicit cross-scale causal interactions between defined actors.,No,1.0,"Organizational, Environmental and Societal",N/A,N/A,Organizational: The USLP represents an organization's strategic plan and actions.; Environmental and Societal: Refers to 'social and environmental performance' which impacts these broader systems.,N/A,"The text identifies actors at the Organizational (USLP) and Environmental and Societal (social and environmental performance) scales. However, it only describes the scope of the USLP's targets ('spanning our social and environmental performance') rather than an explicit causal influence or interaction between these scales. No direct 'X causes Y' or 'Y influences X' statement is present."
197,Yes,,Yes,Unanimous,Unilever_Annual_Report_and_Accounts_2014_Strategic_Report_page_14.pdf,"We are making good progress with our first goal: to help more than a billion people improve their health and well-being by 2020, reaching 397 million by the end of 2014. The progress on our second goal is more mixed. We have achieved zero non-hazardous waste to landfill from our factories, and continue to make significant reductions in the greenhouse gas (GHG) and water impacts of our manufacturing. But the consumer element of our target to halve the water and GHG impacts of our products remains a challenge. On waste reduction, new technology such as the roll-out of compressed deodorant sprays and our new Dove Body Wash bottles has enabled reductions. On our third goal, we are also making good progress. We are now sourcing more than half our agricultural raw materials sustainably and have reached around 800,000 smallholder farmers with help and training. We have created 70,000 women micro-entrepreneurs distributing our products in India while making progress on our new commitments to enhance livelihoods across the value chain.",Yes,0.85,"Individual, Organizational, Inter-Organizational / Sector",Organizational -> Individual | Organizational -> Inter-Organizational / Sector,Organizational -> Individual,"Individual: Billion people improving health, consumers, smallholder farmers, women micro-entrepreneurs; Organizational: The company (implied 'we') with factories, manufacturing operations, and product development; Inter-Organizational / Sector: Value chain operations and agricultural sourcing systems","[Organizational, Individual, Inter-Organizational] Company directly impacts individuals through health programs and farmer training while managing value chain operations","The company operates across multiple scales, directly helping individuals (health goals, farmer training) and managing inter-organizational systems (sustainable sourcing, value chain). Links are explicit through stated achievements and targets.",Yes,0.73,"Organizational, Individual, Environmental and Societal",Organizational -> Environmental and Societal | Organizational -> Individual | Individual -> Organizational,Organizational -> Individual,"Organizational: A single company reporting goals and actions.; Individual: Consumers, smallholder farmers, and women micro-entrepreneurs.; Environmental and Societal: Landfill, greenhouse gases, and water impacts.","[Organizational, Individual, Environmental and Societal] The company’s actions cut landfill/GHG/water impacts, aid hundreds of millions of people, while consumer behavior challenges company targets.","Organizational actions explicitly change environmental metrics and directly affect individuals (people reached). The text also states consumers make the company’s target challenging, implying upward influence. Inter-organizational supply chain claims lacked explicit cross-scale causality, so excluded.",Yes,0.9,"Individual, Organizational, Environmental and Societal",Organizational -> Individual | Organizational -> Environmental and Societal,Organizational -> Environmental and Societal,"Individual: Smallholder farmers and women micro-entrepreneurs are specific people.; Organizational: The organization is implied through actions like sourcing materials and product distribution.; Environmental and Societal: Goals related to health, waste, and GHG impacts affect societal systems.","[Individual, Organizational, Environmental and Societal] The organization aids farmers and reduces environmental impacts, linking individual and societal scales.","The organization directly influences individuals (farmers) and societal systems (environmental impacts). These interactions are explicitly described, justifying the detected scales and links.",Yes,0.9,"Individual, Organizational, Environmental and Societal",Organizational -> Individual | Organizational -> Environmental and Societal | Individual -> Environmental and Societal,Organizational -> Individual,"Individual: Refers to specific people like 'billion people', 'consumers', 'smallholder farmers', and 'women micro-entrepreneurs'.; Organizational: Represents 'We' (the company) and its internal operations like 'factories' and 'new technology'.; Environmental and Societal: Encompasses 'landfill', 'greenhouse gas (GHG)', and 'water impacts' as elements of the environment.","[Individual, Organizational, Environmental and Societal] The organization directly influences individuals and the environment, while individual consumer actions also impact the environment.","The paragraph explicitly describes how the 'Organizational' actor (the company) influences 'Individual' actors (people, farmers, entrepreneurs) and the 'Environmental and Societal' system (waste, GHG, water). It also highlights how 'Individual' consumers' actions impact the 'Environmental and Societal' system. The 'Inter-Organizational / Sector' scale was excluded to adhere to the three-scale limit, as its interaction was less frequent compared to the others."
198,Mixed,,No,Split Yes/No,Unilever_Annual_Report_and_Accounts_2014_Strategic_Report_page_14.pdf,By 2020 we will help more than a billion people take action to improve their health and well-being.,No,0.9,N/A,N/A,N/A,N/A,N/A,"This is a goal statement without explicit actors or causal mechanisms. While it mentions 'we' (unidentified actor) and 'billion people' (Individual scale), there is no explicit description of how one scale influences another - only an intended outcome.",No,0.78,N/A,N/A,N/A,N/A,N/A,The actor “we” is unspecified and cannot be mapped to a defined scale; only “people” (individuals) are identified. No explicit cross-scale causal link can be established per protocol.,No,0.9,N/A,N/A,N/A,N/A,N/A,The statement lacks explicit cross-scale causality. It mentions a goal but does not specify how different scales interact to achieve it.,Yes,1.0,"Organizational, Individual",Organizational -> Individual,Organizational -> Individual,Organizational: 'we' refers to a single organization making a commitment.; Individual: 'more than a billion people' refers to specific individuals.,"[Organizational, Individual] An organization will help individuals take action to improve their health and well-being.","The paragraph explicitly states that an organizational actor ('we') will causally influence individuals ('people') to take action. This establishes a clear hierarchical cross-scale interaction from Organizational to Individual. Only two distinct scales were identified, adhering to the protocol."
199,Mixed,,No,Split Yes/No,Unilever_Annual_Report_and_Accounts_2014_Strategic_Report_page_14.pdf,By 2020 our goal is to halve the environmental footprint of the making and use of our products as we grow our business.,No,0.9,N/A,N/A,N/A,N/A,N/A,The text states a goal but contains no explicit causal interactions between actors at different scales. It describes an intended outcome without specifying the mechanisms or cross-scale relationships that would achieve it.,Yes,0.66,"Organizational, Environmental and Societal",Organizational -> Environmental and Societal,Organizational -> Environmental and Societal,Organizational: “Our products/our business” indicates a single company setting a goal.; Environmental and Societal: “Environmental footprint” is an ecological impact at societal/environmental scale.,"[Organizational, Environmental and Societal] A company commits to halve its products’ environmental footprint.","The organization explicitly aims to change an environmental outcome, establishing cross-scale causality. No other distinct actors (e.g., individuals or sector systems) are named, so only these two scales are used.",No,0.9,N/A,N/A,N/A,N/A,N/A,The statement outlines a goal but does not specify any cross-scale causal interactions between defined actors. It lacks explicit causal links between different scales.,Yes,1.0,"Organizational, Environmental and Societal",Organizational -> Environmental and Societal,Organizational -> Environmental and Societal,"Organizational: Refers to 'our business', which is a single company or organization.; Environmental and Societal: Refers to 'environmental footprint', an aspect of the broader environment.","[Organizational, Environmental and Societal] An organization aims to reduce its environmental footprint.","The paragraph explicitly states an organizational actor's goal to causally influence the environmental footprint, representing an interaction between the Organizational and Environmental and Societal scales. Only two distinct scales were identified."
200,Mixed,,No,Split Yes/No,Unilever_Annual_Report_and_Accounts_2014_Strategic_Report_page_14.pdf,By 2020 we will enhance the livelihoods of millions of people as we grow our business.,No,0.8,N/A,N/A,N/A,N/A,N/A,"The statement expresses a goal or intention but lacks explicit causal mechanisms. While 'we' (organizational) and 'millions of people' (individual) are mentioned, no concrete actions or causal pathways are described that would demonstrate how business growth will enhance livelihoods.",Yes,0.78,"Organizational, Individual",Organizational -> Individual,Organizational -> Individual,"Organizational: ""we"" implies a single company/organization growing its business; Individual: ""millions of people"" whose livelihoods are enhanced","[Organizational, Individual] The company commits to enhancing millions of people’s livelihoods while growing its business.",The text explicitly ties an organizational action (“we will enhance”) to an effect on individuals (“livelihoods of millions of people”). No other scales are specified; “as we grow our business” does not add a new scale.,No,0.9,N/A,N/A,N/A,N/A,N/A,The statement is a future projection without explicit cross-scale causality. It lacks concrete actors and actions linking different scales.,Yes,1.0,"Organizational, Individual",Organizational -> Individual,Organizational -> Individual,Organizational: 'we' and 'our business' refer to a single company or organization.; Individual: 'millions of people' refers to specific individuals or households.,"[Organizational, Individual] An organization's business growth is stated to enhance the livelihoods of individuals.","The paragraph explicitly states that the growth of 'our business' (Organizational scale) will lead to the enhancement of 'livelihoods of millions of people' (Individual scale), establishing a clear causal link. Only two distinct scales were identified."
201,Mixed,,No,Split Yes/No,Unilever_Annual_Report_and_Accounts_2014_Strategic_Report_page_14.pdf,By 2020 we will help more than a billion people to improve their health and hygiene. This will help reduce the incidence of life-threatening diseases like diarrhoea.,No,0.9,N/A,N/A,N/A,N/A,N/A,"The text describes a goal and expected outcome but lacks explicit actors and causal mechanisms. No concrete entity is identified as performing the helping action, and no cross-scale causality is demonstrated.",Yes,0.67,"Organizational, Individual",Organizational -> Individual,Organizational -> Individual,Organizational: 'We' denotes a specific entity committing to action.; Individual: More than a billion people are targeted beneficiaries.,"[Organizational, Individual] An organization will help people improve their health and hygiene.","The text explicitly states an organization will help individuals improve health/hygiene. The disease incidence outcome is not an actor at any defined scale, so no additional cross-scale link is included.",No,0.9,N/A,N/A,N/A,N/A,N/A,"The paragraph describes a goal to help individuals improve health, but lacks explicit cross-scale causality between defined scales. No concrete actors or causal links are specified.",Yes,1.0,"Organizational, Individual, Environmental and Societal",Organizational -> Individual | Individual -> Environmental and Societal,Organizational -> Individual,"Organizational: ""we"" implies a company or organization making a commitment.; Individual: ""a billion people"" refers to specific individuals.; Environmental and Societal: ""reduce the incidence of life-threatening diseases"" for a large population impacts public health, a societal-level system.","[Organizational, Individual, Environmental and Societal] An organization helps individuals improve health, which then reduces societal disease incidence.","The paragraph explicitly describes an organization's action to help individuals. This individual-level improvement then causally leads to a reduction in disease incidence, which is an impact at the environmental and societal scale. Three distinct scales are clearly identified and linked in a causal chain."
