170,Yes,,Yes,Unanimous,Unilever_Annual_Report_and_Accounts_2014_Strategic_Report_page_8.pdf,"Even though we have made significant strides over recent years in improving our organisational agility and our ability to respond quickly to events, there is still room for improvement. I would like to have seen us react a little quicker, for example, to the slowdown in a number of markets, particularly China, where frankly we were caught off-guard by the speed and scale of weakening consumer demand. In terms of our categories, all of them contributed – albeit in different ways – to the overall performance of the Group and I have confidence in the strength and long-term growth potential of our portfolio.",Yes,0.75,"Short-Term, Medium-Term, Long-Term",Medium-Term -> Short-Term,Medium-Term -> Short-Term,Short-Term: Quick reactions to market events and consumer demand changes; Medium-Term: Organizational agility improvements over recent years; Long-Term: Long-term growth potential of portfolio categories,"[Medium-Term, Short-Term] Organizational agility built over years enables faster market response capabilities.",The paragraph explicitly connects multi-year organizational improvements to enhanced short-term responsiveness. The long-term growth potential represents a separate temporal dimension without clear causal links to the other scales in this context.,Yes,0.69,"Medium-Term, Short-Term",Medium-Term -> Short-Term,Medium-Term -> Short-Term,Medium-Term: “over recent years” improving organisational agility/ability.; Short-Term: “respond quickly to events” and reacting to market slowdowns.,"[Medium-Term, Short-Term] Multi-year agility improvements are stated to enhance the ability to respond quickly to events.",The text explicitly ties multi-year improvements to quicker event response. No explicit causal link connects current performance or events to long-term growth potential.,Yes,0.8,"Short-Term, Long-Term",Short-Term -> Long-Term,Short-Term -> Long-Term,"Short-Term: The reaction to the slowdown in markets, particularly China, is a short-term event.; Long-Term: The long-term growth potential of the portfolio is mentioned.","[Short-Term, Long-Term] The short-term reaction to market changes impacts the long-term growth potential of the portfolio.","The paragraph discusses short-term reactions to market slowdowns and links them to the long-term growth potential of the portfolio. The short-term agility and response to market changes are crucial for sustaining long-term growth, establishing a clear cross-scale interaction.",Yes,0.9,"Medium-Term, Short-Term",Medium-Term -> Short-Term,Medium-Term -> Short-Term,"Medium-Term: Refers to 'significant strides over recent years', indicating multi-year transitions.; Short-Term: Refers to 'respond quickly to events' and 'react a little quicker', indicating effects over days to a year.","[Medium-Term, Short-Term] Significant multi-year efforts have enhanced the organization's short-term responsiveness to market events.","The paragraph explicitly states that 'significant strides over recent years' (Medium-Term) led to 'improving our organisational agility and our ability to respond quickly to events' (Short-Term). This establishes a clear causal link where a Medium-Term process influences a Short-Term outcome. No other explicit cross-scale causal interactions were identified, as the mention of 'long-term growth potential' was a statement of confidence, not a direct causal consequence of short-term performance."
176,No,,Yes,Unanimous,Unilever_Annual_Report_and_Accounts_2014_Strategic_Report_page_8.pdf,"We also made progress in our commitment to serve a wider group of stakeholders through the USLP and our Vision of growing the business while reducing our environmental footprint and increasing our positive social impact, not only in that part of the business under our direct control but throughout the whole value chain. This manifests itself in many different ways – everything from playing our part in putting an end to deforestation to ensuring we embrace and advance human rights principles throughout the length of our supply chain. You can see a number of examples set out in other parts of this report.",No,0.8,N/A,N/A,N/A,N/A,N/A,"The paragraph describes ongoing commitments and strategic vision without explicit temporal durations or causal relationships between different time scales. While it mentions long-term goals like ending deforestation, there are no explicit cross-scale causal interactions described.",No,0.34,N/A,N/A,N/A,N/A,N/A,The paragraph presents goals and principles without explicit durations or causal links between different time horizons; no concrete cross-scale interactions are stated.,No,0.9,N/A,N/A,N/A,N/A,N/A,"The paragraph discusses broad commitments and goals without specifying concrete events or timeframes that map to distinct temporal scales, thus no cross-scale link exists.",No,1.0,N/A,N/A,N/A,N/A,N/A,"The paragraph describes a company's overarching long-term vision and commitments, such as reducing environmental footprint, increasing social impact, ending deforestation, and advancing human rights. All these elements fall under the 'Long-Term' scale. There are no explicit causal links or interactions identified between different temporal scales (Short-Term, Medium-Term, or Long-Term) within the provided text."
178,Yes,,Yes,Unanimous,Unilever_Annual_Report_and_Accounts_2014_Strategic_Report_page_11.pdf,A fundamental requirement at Unilever is to understand our consumers. We use focus groups and quantitative studies and spend time with consumers in stores and in their homes to find out what is important to them – as citizens as well as consumers – so we can create products they need and want. Unilever carelines are also a rich source of information. Digital communications and social media mean we can engage with large numbers of people consistently over long periods of time so we can immerse ourselves in their day-to-day lives. We can use online search data to identify and anticipate future consumer trends and gain a competitive edge.,Yes,0.8,"Short-Term, Long-Term",Short-Term -> Long-Term,Short-Term -> Long-Term,Short-Term: Day-to-day consumer lives and immediate engagement activities; Long-Term: Consistent engagement over long periods of time and anticipating future consumer trends,"[Short-Term, Long-Term] Daily consumer engagement builds long-term insights for future trend anticipation.",The text shows how short-term daily consumer interactions through digital communications feed into long-term strategic capabilities for trend identification and competitive advantage. The causal link is explicit in how day-to-day engagement enables long-period consistency and future anticipation.,Yes,0.72,"Long-Term, Short-Term",Long-Term -> Short-Term,Long-Term -> Short-Term,Long-Term: “engage with large numbers of people consistently over long periods of time.”; Short-Term: “immerse ourselves in their day-to-day lives.”,"[Long-Term, Short-Term] Prolonged digital engagement enables immersion in consumers’ day-to-day lives.",The text explicitly links long-term engagement to short-term daily-life immersion via “so we can.” No other explicit cross-scale causal links are stated.,Yes,0.9,"Short-Term, Long-Term",Short-Term -> Long-Term,Short-Term -> Long-Term,Short-Term: Engaging with consumers through focus groups and social media.; Long-Term: Using digital communications to engage consistently over long periods.,"[Short-Term, Long-Term] Short-term consumer engagement through digital means leads to long-term immersion in consumer lives.","The paragraph describes how short-term activities like focus groups and social media engagement allow Unilever to maintain long-term consumer relationships. This interaction is explicit in the text, as short-term actions are used to achieve long-term goals.",Yes,0.9,"Short-Term, Medium-Term, Long-Term",Long-Term -> Short-Term | Short-Term -> Medium-Term | Short-Term -> Long-Term,"Long-Term -> Short-Term, Short-Term -> Medium-Term, Short-Term -> Long-Term",Short-Term: Refers to 'day-to-day lives' and the immediate analysis of 'online search data'.; Medium-Term: Refers to 'future consumer trends' which represent multi-year transitions.; Long-Term: Refers to 'consistently over long periods of time' for engagement and 'gain a competitive edge' as a strategic outcome.,"[Short-Term, Medium-Term, Long-Term] Long-term digital engagement enables short-term consumer immersion; short-term data analysis anticipates medium-term trends and secures long-term competitive advantage.","The paragraph explicitly details how long-term digital engagement facilitates short-term understanding of daily consumer lives. Additionally, short-term analysis of online search data is shown to influence both medium-term anticipation of consumer trends and the achievement of a long-term competitive edge. All three temporal scales are necessary to capture these distinct, explicit causal interactions."
180,No,,Yes,Unanimous,Unilever_Annual_Report_and_Accounts_2014_Strategic_Report_page_11.pdf,"To meet our Vision we know we must work in partnership with others, such as suppliers, agencies, universities, governments and NGOs.",No,0.9,N/A,N/A,N/A,N/A,N/A,"The paragraph describes a general strategic approach to partnerships but contains no temporal elements, timeframes, or causal relationships between different time scales. It's a static statement about collaboration methods.",No,0.95,N/A,N/A,N/A,N/A,N/A,No explicit timeframes or causal links across different temporal scales are stated; 'Vision' lacks a defined duration.,No,0.9,N/A,N/A,N/A,N/A,N/A,The paragraph does not mention any specific events or processes with explicit temporal scales or causal interactions between different scales.,No,1.0,N/A,N/A,N/A,N/A,N/A,"The paragraph mentions a 'Vision' which implies a Long-Term goal. However, the action 'work in partnership' is not assigned an explicit temporal scale (Short-Term, Medium-Term, or Long-Term) that is distinct from the Vision. Without a clear temporal scale for the influencing action, no explicit cross-scale causal link can be established."
181,Yes,,Yes,Unanimous,Unilever_Annual_Report_and_Accounts_2014_Strategic_Report_page_11.pdf,"The big development for 2014 has been the launch of our Partner To Win 2020 programme to create a supplier ecosystem where partners work with us and each other to create breakthroughs in products or packaging to deliver the capacity, innovation and sustainable solutions to meet our growth ambition. A great example is the new Dove Body Wash bottle using 15% less plastic (see inside front cover).",Yes,0.85,"Short-Term, Long-Term",Short-Term -> Long-Term,Short-Term -> Long-Term,Short-Term: 2014 launch of Partner To Win 2020 programme and new Dove Body Wash bottle development; Long-Term: Partner To Win 2020 programme spanning multiple years to create sustainable solutions and meet growth ambition,"[Short-Term, Long-Term] 2014 programme launch initiates multi-year strategy for sustainable innovation and growth.",The 2014 launch of Partner To Win 2020 represents a short-term action that explicitly initiates a long-term strategic programme. The text clearly states this launch was designed to create long-term outcomes including sustainable solutions and growth capacity.,Yes,0.72,"Short-Term, Long-Term",Short-Term -> Long-Term | Long-Term -> Short-Term,"Short-Term -> Long-Term, Long-Term -> Short-Term",Short-Term: The 'big development for 2014' is a launch within a single year.; Long-Term: The 'Partner To Win 2020' programme spans 2014–2020 (>5 years).,"[Short-Term, Long-Term] The 2014 launch creates a 2020 programme, which in turn yields a specific product change (Dove bottle uses 15% less plastic).","The text explicitly ties the 2014 launch to establishing a programme running to 2020, and cites a concrete product example as a result. No medium-term duration is specified, so only two scales are used.",Yes,0.9,"Short-Term, Long-Term",Short-Term -> Long-Term,Short-Term -> Long-Term,Short-Term: The launch of the Partner To Win 2020 programme in 2014.; Long-Term: The programme aims to create a supplier ecosystem by 2020.,"[Short-Term, Long-Term] The 2014 launch of the Partner To Win 2020 programme aims to influence a supplier ecosystem by 2020.","The launch in 2014 is a short-term event that sets the stage for long-term goals by 2020. The text explicitly links the launch to future outcomes, justifying the cross-scale interaction.",Yes,1.0,"Short-Term, Long-Term",Short-Term -> Long-Term | Long-Term -> Short-Term,"Short-Term -> Long-Term, Long-Term -> Short-Term","Short-Term: The 'launch' in 2014 is a specific event (within 1 year); the 'new Dove Body Wash bottle' is a concrete, short-term breakthrough.; Long-Term: The 'Partner To Win 2020 programme' spans 6 years (2014-2020), fitting the >5 years definition.","[Short-Term, Long-Term] A short-term program launch initiated a long-term strategic program, which in turn aims to deliver short-term product breakthroughs.","The 2014 launch is a short-term event that established the Partner To Win 2020 programme, a long-term initiative spanning six years. This long-term program then causally influences the creation of specific, short-term product breakthroughs, exemplified by the new Dove bottle. These explicit causal connections across different temporal scales form the identified links."
182,No,,Yes,Unanimous,Unilever_Annual_Report_and_Accounts_2014_Strategic_Report_page_12.pdf,"Unilever’s value chain – the process by which we create brands, products and ultimately shareholder value – begins with acquiring insight into consumers’ needs, which vary considerably between developed and emerging markets.",No,0.9,N/A,N/A,N/A,N/A,N/A,"The paragraph describes Unilever's value chain process and consumer insights but contains no temporal references or timeframes. Without explicit temporal elements, no cross-scale interactions can be identified.",No,0.9,N/A,N/A,N/A,N/A,N/A,The text describes a value-chain step and market differences without any timeframes or explicit cross-scale causal effects.,No,0.9,N/A,N/A,N/A,N/A,N/A,The paragraph describes a process but does not specify any temporal scales or cross-scale causal interactions.,No,1.0,N/A,N/A,N/A,N/A,N/A,"The paragraph describes Unilever's value chain as a continuous, integrated process involving ongoing activities like acquiring insights and creating products. It does not present distinct events or processes at different temporal scales that explicitly and causally influence one another."
184,Yes,,Yes,Unanimous,Unilever_Annual_Report_and_Accounts_2014_Strategic_Report_page_12.pdf,"That knowledge helps us to target our subsequent R&D activities and our investments in innovation. Unilever has filed more than 200 new patent applications in 2014 and our Partner To Win 2020 programme, also launched in 2014, creates a new platform for us to work with our suppliers in the development of product and packaging innovations that capture consumers’ interest and attention.",Yes,0.85,"Short-Term, Medium-Term",Short-Term -> Medium-Term,Short-Term -> Medium-Term,Short-Term: 200 new patent applications filed in 2014 represents a specific annual activity; Medium-Term: Partner To Win 2020 programme launched in 2014 represents a multi-year strategic initiative spanning 6 years,"[Short-Term, Medium-Term] Annual patent knowledge informs multi-year R&D targeting and innovation platform development.",The paragraph shows how short-term patent filing activities in 2014 provide knowledge that helps target subsequent multi-year R&D activities and the Partner To Win 2020 programme. This creates a clear causal link from annual activities to medium-term strategic planning.,Yes,0.64,"Short-Term, Medium-Term",Short-Term -> Medium-Term,Short-Term -> Medium-Term,Short-Term: The programme was launched in 2014 (and 2014 patent filings).; Medium-Term: The '2020 programme' indicates a multi-year initiative running beyond 2014.,"[Short-Term, Medium-Term] The 2014 launch kick-starts the multi-year 2020 programme platform for supplier collaboration.","The text explicitly ties a 2014 launch (short-term) to the ongoing 2020 programme (multi-year). No explicit causal link connects the 2014 patent filings to longer horizons, so only one cross-scale link is valid.",Yes,0.9,"Short-Term, Medium-Term",Short-Term -> Medium-Term,Short-Term -> Medium-Term,Short-Term: Filing of more than 200 new patent applications in 2014.; Medium-Term: Partner To Win 2020 programme launched in 2014.,"[Short-Term, Medium-Term] Filing patents in 2014 supports the Partner To Win 2020 programme, linking short-term actions to medium-term strategies.",The filing of patents in 2014 is a short-term action that supports the medium-term Partner To Win 2020 programme. This demonstrates a clear causal link between short-term R&D activities and medium-term strategic goals.,Yes,0.9,"Short-Term, Long-Term",Short-Term -> Long-Term,Short-Term -> Long-Term,"Short-Term: The 'launched in 2014' refers to a specific event occurring within a single year.; Long-Term: The 'Partner To Win 2020 programme' implies a duration from 2014 to 2020 (6 years), which exceeds 5 years.","[Short-Term, Long-Term] A short-term program launch in 2014 initiated a long-term strategic program extending to 2020.","The paragraph explicitly states the 'Partner To Win 2020 programme' was 'launched in 2014'. The launch itself is a short-term event, while the program's duration from 2014 to 2020 (6 years) classifies it as long-term. This establishes a direct causal link where a short-term action initiates a long-term process."
185,No,,Yes,Unanimous,Unilever_Annual_Report_and_Accounts_2014_Strategic_Report_page_12.pdf,"Bringing these innovations to market as physical products is a core function of Unilever’s supply chain, which employs about 110,000 of our 172,000 people. It also involves working with suppliers around the world.",No,0.9,N/A,N/A,N/A,N/A,N/A,The paragraph describes current operational structure and employment figures without any temporal progression or causal relationships between different time scales. It presents a static snapshot of Unilever's supply chain operations.,No,0.9,N/A,N/A,N/A,N/A,N/A,No explicit timeframes or cross-scale causal links are stated; the text is a static description of functions and workforce.,No,0.9,N/A,N/A,N/A,N/A,N/A,The paragraph describes current operations without explicit cross-scale causal interactions between different temporal scales.,No,1.0,N/A,N/A,N/A,N/A,N/A,"The paragraph describes current operational functions and structures, such as the supply chain's role and workforce. It lacks explicit causal statements where an event or process at one temporal scale influences or is influenced by another distinct temporal scale."
189,Yes,,Yes,Unanimous,Unilever_Annual_Report_and_Accounts_2014_Strategic_Report_page_12.pdf,"We make the majority of what we sell through a network of more than 240 manufacturing sites around the world. We have invested significantly in our factories in recent years to create an efficient, reliable and more sustainable network. We are now able to maximise the global scale of our operations, while having the agility to meet local demands. More eco-efficient production is helping us meet the USLP targets, so by the end of January 2015, for instance, all our factories had achieved zero non-hazardous waste to landfill, producing 140,000 tonnes less waste. Since 2008, we estimate that eco-production has avoided costs in excess of €400 million.",Yes,0.85,"Short-Term, Long-Term",Long-Term -> Short-Term,Long-Term -> Short-Term,Short-Term: Zero waste achievement by end of January 2015 represents a specific annual milestone; Long-Term: Investments in recent years and cost avoidance since 2008 represent multi-year processes spanning decades,"[Long-Term, Short-Term] Multi-year sustainability investments enabled specific 2015 zero waste achievement milestone.",The paragraph shows how long-term investments in eco-efficient production (spanning years since 2008) directly enabled the achievement of specific short-term targets like the January 2015 zero waste milestone. This represents a clear causal flow from sustained long-term efforts to concrete short-term outcomes.,Yes,0.72,"Medium-Term, Short-Term",Medium-Term -> Short-Term,Medium-Term -> Short-Term,Medium-Term: “Invested significantly… in recent years.”; Short-Term: “We are now able to maximise… and meet local demands.”,"[Medium-Term, Short-Term] Recent multi-year factory investments enabled current capability to maximize operations and meet local demand.","The text explicitly links recent multi-year investments to present operational agility. Other timeframes (e.g., since 2008) lack an explicit cross-scale causal tie to a different-scale event.",Yes,0.9,"Short-Term, Medium-Term, Long-Term",Medium-Term -> Short-Term | Medium-Term -> Long-Term,"Medium-Term -> Short-Term, Medium-Term -> Long-Term","Short-Term: By the end of January 2015, all factories achieved zero non-hazardous waste to landfill.; Medium-Term: Investments in factories in recent years to create a sustainable network.; Long-Term: Since 2008, eco-production has avoided costs in excess of €400 million.","[Short-Term, Medium-Term, Long-Term] Investments in recent years led to short-term waste reduction and long-term cost savings.",The paragraph describes how medium-term investments in factory efficiency led to short-term achievements in waste reduction and long-term cost savings. The explicit causal links between these scales are clear in the text.,Yes,1.0,"Short-Term, Medium-Term, Long-Term",Medium-Term -> Short-Term | Medium-Term -> Long-Term | Short-Term -> Medium-Term,"Medium-Term -> Short-Term, Medium-Term -> Long-Term, Short-Term -> Medium-Term",Short-Term: Achievement of zero non-hazardous waste to landfill by a specific date (January 2015) falls within a 1-year timeframe.; Medium-Term: Investments made 'in recent years' and 'USLP targets' represent multi-year strategies or transitions.; Long-Term: Avoided costs 'Since 2008' indicates a cumulative benefit over a period exceeding 5 years.,"[Short-Term, Medium-Term, Long-Term] Medium-term investments drove short-term waste reduction and long-term cost savings, with short-term achievements contributing to medium-term sustainability goals.","The paragraph explicitly details how multi-year investments (Medium-Term) enabled eco-efficient production. This production directly resulted in a specific short-term achievement (zero waste by Jan 2015) and cumulative long-term financial benefits (avoided costs since 2008). Furthermore, the short-term waste achievement is presented as contributing to the broader multi-year sustainability targets (Medium-Term), establishing a clear feedback loop."
