271,Yes,,Yes,Unanimous,Unilever_Annual_Report_and_Accounts_2014_Strategic_Report_page_25.pdf,"Later in this section we have highlighted new, related areas of Unilever activity under way in 2014 that are of broad benefit to society, including our work on behalf of women, which will continue to develop in the next few years.",Yes,0.8,"Short-Term, Medium-Term",Short-Term -> Medium-Term,Short-Term -> Medium-Term,Short-Term: Activities under way in 2014 represent current-year initiatives; Medium-Term: Work that will continue to develop in the next few years indicates multi-year progression,"[Short-Term, Medium-Term] Current 2014 initiatives will continue developing over multiple years ahead.","The text explicitly connects current 2014 activities with their continuation and development over the next few years, creating a clear causal progression from short-term to medium-term scales.",Yes,0.78,"Short-Term, Medium-Term",Short-Term -> Medium-Term,Short-Term -> Medium-Term,Short-Term: Activity under way in 2014.; Medium-Term: Will continue to develop in the next few years.,"[Short-Term, Medium-Term] 2014 activities will continue to develop over the next few years.","The text ties current 2014 work to development over the next few years, creating a short-to-medium-term causal continuation. No long-term timeline is specified.",Yes,0.8,"Short-Term, Medium-Term",Short-Term -> Medium-Term,Short-Term -> Medium-Term,Short-Term: Activities under way in 2014.; Medium-Term: Development continuing in the next few years.,"[Short-Term, Medium-Term] Activities in 2014 will influence developments in the next few years.","The paragraph describes activities in 2014 that will continue to develop over the next few years, indicating a causal link from Short-Term to Medium-Term. No Long-Term scale is explicitly mentioned.",Yes,1.0,"Short-Term, Medium-Term",Short-Term -> Medium-Term,Short-Term -> Medium-Term,Short-Term: Activity 'under way in 2014' refers to events within a single year.; Medium-Term: 'Continue to develop in the next few years' explicitly indicates a multi-year timeframe (>1 up to 5 years).,"[Short-Term, Medium-Term] Unilever's 2014 activities are set to develop over the next few years, linking immediate actions to multi-year strategies.",The paragraph explicitly states that activities 'under way in 2014' (Short-Term) will 'continue to develop in the next few years' (Medium-Term). This establishes a direct causal link where current year's actions influence future multi-year development. Only two scales are needed to capture this interaction.
273,No,,Yes,Unanimous,Unilever_Annual_Report_and_Accounts_2014_Strategic_Report_page_25.pdf,"Alleviating social problems, such as the lack of effective sanitation, safe drinking water and related hygiene issues, helps communities while increasing sales of brands like Domestos, Pureit and Lifebuoy.",No,0.8,N/A,N/A,N/A,N/A,N/A,"The paragraph describes a general relationship between alleviating social problems and increasing brand sales, but provides no temporal framing or timeframes for these activities. Without explicit temporal context, no cross-scale interactions can be identified.",No,0.58,N/A,N/A,N/A,N/A,N/A,"No explicit timeframes are given for either alleviating social problems or increasing sales, so no cross-scale causal link can be mapped.",No,0.9,N/A,N/A,N/A,N/A,N/A,The paragraph does not provide explicit causal links between events or processes at different temporal scales. It describes a general relationship without specifying timeframes.,No,1.0,N/A,N/A,N/A,N/A,N/A,"The paragraph describes a causal relationship where alleviating long-term social problems leads to long-term community benefits and long-term sales increases. All identified events and their consequences operate within the Long-Term temporal scale, thus no explicit cross-scale interactions are present."
277,Yes,,Yes,Unanimous,Unilever_Annual_Report_and_Accounts_2014_Strategic_Report_page_25.pdf,"In June 2014 Unilever, along with fellow members of the Consumer Goods Forum, called on heads of state for a binding global climate change deal. In September 2014 we helped facilitate the New York Declaration on Forests at the UN Climate Summit where more than 170 governments, companies and NGOs pledged to cut forest loss by half by 2020, end it by 2030 and restore 350 million hectares of degraded land.",Yes,0.85,"Short-Term, Medium-Term",Short-Term -> Medium-Term,Short-Term -> Medium-Term,Short-Term: June and September 2014 advocacy actions and UN Climate Summit participation; Medium-Term: Forest loss reduction by 2020 and ending by 2030 (6-16 year timeframes),"[Short-Term, Medium-Term] 2014 advocacy efforts enabled multi-year forest conservation commitments with 2020-2030 targets.","The 2014 advocacy actions by Unilever and facilitation of the UN Climate Summit directly resulted in concrete pledges with medium-term targets (2020, 2030). The short-term activities causally enabled the medium-term commitments.",Yes,0.72,"Short-Term, Long-Term",Short-Term -> Long-Term,Short-Term -> Long-Term,"Short-Term: 2014 actions: calling on heads of state; facilitating the UN forest declaration.; Long-Term: Pledges to halve forest loss by 2020, end by 2030, and restore 350M ha.","[Short-Term, Long-Term] 2014 facilitation of the UN forest declaration produced pledges with 2020/2030 goals and large-scale restoration.","The text links a 2014 facilitation to explicit pledges with 2020/2030 timelines, a cross-scale causal step. The June 2014 call lacks an explicit downstream effect, so no additional link is drawn.",Yes,0.9,"Short-Term, Long-Term",Short-Term -> Long-Term,Short-Term -> Long-Term,Short-Term: The pledge to cut forest loss by half by 2020 is a short-term goal.; Long-Term: The goal to end forest loss by 2030 and restore land is a long-term objective.,"[Short-Term, Long-Term] The short-term goal of reducing forest loss by 2020 supports the long-term goal of ending it by 2030 and restoring land.",The text outlines a short-term goal (cutting forest loss by 2020) that is explicitly linked to a long-term goal (ending forest loss by 2030). This demonstrates a clear cross-scale interaction.,Yes,1.0,"Short-Term, Long-Term",Short-Term -> Long-Term | Short-Term -> Long-Term,Short-Term -> Long-Term,"Short-Term: The 'June 2014 call' and 'September 2014 facilitation' are specific events unfolding over days to months.; Long-Term: Pledges for 'by 2020' (6 years), 'by 2030' (16 years), and 'restore 350 million hectares' imply processes unfolding over decades.","[Short-Term, Long-Term] Short-term actions in 2014 directly led to the establishment of long-term global climate and forest protection goals and pledges.","The paragraph explicitly details two distinct short-term events in 2014 (a call for a deal and facilitation of a declaration). Both events directly resulted in or aimed at establishing long-term commitments and goals, such as a binding global climate change deal and pledges to reduce forest loss by 2020 and 2030. No medium-term interactions were identified as the specified timeframes (2020, 2030) fall under the long-term scale definition."
279,Yes,,Yes,Unanimous,Unilever_Annual_Report_and_Accounts_2014_Strategic_Report_page_25.pdf,"Unilever’s work in moving from commitment to action in combating deforestation has been recognised. In November, we were ranked joint first for corporate action on tackling deforestation in our sector by CDP, formerly the Carbon Disclosure Project. The CDP report was produced on behalf of 240 investors, who together represent US $15 trillion in assets, and analysed the disclosures of 152 companies from around the world. It said: “Companies that regularly respond to CDP’s forests program are now identifying many more opportunities available to them, including securing their supply chain against the risks associated with deforestation and commodity sourcing. This in turn is helping to secure shareholder value.”",Yes,0.8,"Short-Term, Long-Term",Short-Term -> Long-Term,Short-Term -> Long-Term,Short-Term: CDP ranking in November and regular CDP responses represent immediate recognition and reporting activities; Long-Term: Securing supply chain against deforestation risks and protecting shareholder value represent ongoing strategic outcomes,"[Short-Term, Long-Term] Regular CDP reporting activities enable long-term supply chain security and shareholder value protection.",The text explicitly states that regular CDP responses help companies identify opportunities that secure supply chains and shareholder value over time. This creates a clear causal link from short-term reporting actions to long-term strategic outcomes.,Yes,0.63,"Short-Term, Medium-Term, Long-Term",Short-Term -> Medium-Term | Medium-Term -> Long-Term,"Short-Term -> Medium-Term, Medium-Term -> Long-Term",Short-Term: “are now identifying many more opportunities” indicates immediate effects.; Medium-Term: “securing their supply chain against the risks” implies multi-year actions.; Long-Term: “helping to secure shareholder value” implies enduring outcomes.,"[Short-Term, Medium-Term, Long-Term] Immediate opportunity identification leads to supply-chain security, which in turn helps secure shareholder value.","The quote states that companies now identify opportunities, including securing the supply chain, and that this in turn helps secure shareholder value. This creates a short-to-medium-to-long causal chain. Other mentions (e.g., the November ranking) lack explicit cross-scale effects.",Yes,0.9,"Short-Term, Long-Term",Short-Term -> Long-Term,Short-Term -> Long-Term,Short-Term: Unilever's recent ranking in November for corporate action.; Long-Term: Securing shareholder value through sustainable practices.,"[Short-Term, Long-Term] Unilever's short-term actions in deforestation reporting are linked to long-term shareholder value security.","The paragraph describes how Unilever's short-term actions, like responding to CDP's program, lead to long-term benefits such as securing shareholder value. This establishes a clear cross-scale interaction.",Yes,0.9,"Short-Term, Medium-Term",Medium-Term -> Short-Term,Medium-Term -> Short-Term,"Short-Term: The 'November' ranking is a specific, one-time event.; Medium-Term: Unilever's 'work in moving from commitment to action' and 'corporate action on tackling deforestation' represent multi-year strategic efforts.","[Short-Term, Medium-Term] Unilever's multi-year strategic efforts in combating deforestation resulted in a short-term recognition through a November ranking.","The paragraph explicitly links Unilever's ongoing 'work in moving from commitment to action' (Medium-Term strategy) to its 'ranked joint first in November' (Short-Term event). No other explicit cross-scale causal links were identified, as other processes described within the CDP quote appear to operate within the Medium-Term scale."
280,No,,Yes,Unanimous,Unilever_Annual_Report_and_Accounts_2014_Strategic_Report_page_25.pdf,In 2014 we were able to announce a significant achievement that by the end of the year all palm oil directly sourced for Unilever’s European Foods business was close to 100% traceable and certified sustainable (over 98% in December 2014 and on track to be 100% by the end of March 2015).,No,0.8,N/A,N/A,N/A,N/A,N/A,The paragraph describes a single achievement occurring within a short timeframe (2014-2015) without any causal connections to different temporal scales. All events are contained within the same short-term period.,No,0.95,N/A,N/A,N/A,N/A,N/A,"All events are within months (2014 to March 2015), i.e., short-term only, with no explicit causal link to medium- or long-term processes.",No,0.9,N/A,N/A,N/A,N/A,N/A,The paragraph describes a short-term achievement within a single year (2014) without any explicit causal link to another temporal scale.,No,1.0,N/A,N/A,N/A,N/A,N/A,"All events described, such as the announcement in 2014 and the achievement of traceability by end of 2014 and March 2015, fall within the 'Short-Term' temporal scale (within one year). There are no explicit causal links or interactions identified between different temporal scales in the provided text."
284,Yes,,Yes,Unanimous,Unilever_Annual_Report_and_Accounts_2014_Strategic_Report_page_26.pdf,"In 2014 Unilever enhanced its Unilever Sustainable Living Plan (USLP) by introducing new pillars to its goal of enhancing livelihoods. These were: fairness in the workplace, where we will advance human rights across our operations and extended supply chain; opportunities for women, where we will empower 5 million women by 2020; and inclusive business, where we will have a positive impact on the lives of 5.5 million people by 2020.",Yes,0.85,"Short-Term, Medium-Term",Short-Term -> Medium-Term,Short-Term -> Medium-Term,Short-Term: Enhancement of USLP in 2014 with new pillars introduction; Medium-Term: Goals to empower 5 million women and impact 5.5 million people by 2020 (6-year timeframe),"[Short-Term, Medium-Term] 2014 USLP enhancement enables multi-year empowerment and impact goals by 2020.",The 2014 enhancement of USLP with new pillars (short-term action) explicitly enables the achievement of specific targets by 2020 (medium-term goals). The causal link is clear as the new pillars provide the framework for reaching these multi-year objectives.,Yes,0.78,"Short-Term, Long-Term",Short-Term -> Long-Term,Short-Term -> Long-Term,"Short-Term: In 2014, Unilever introduced new USLP pillars.; Long-Term: Targets to empower women and impact lives are set 'by 2020' (≈6 years).","[Short-Term, Long-Term] The 2014 creation of USLP pillars causally sets goals to be met by 2020.","The 2014 action creates pillars that include explicit 'by 2020' targets, linking a short-term decision to long-term outcomes. No other dated processes are specified to form additional cross-scale links.",Yes,0.9,"Short-Term, Medium-Term",Short-Term -> Medium-Term,Short-Term -> Medium-Term,"Short-Term: The introduction of new pillars in 2014 is a short-term action.; Medium-Term: The goals set for 2020, such as empowering women and impacting lives, are medium-term objectives.","[Short-Term, Medium-Term] Unilever's 2014 actions aim to achieve 2020 goals, linking short-term initiatives to medium-term outcomes.",The 2014 introduction of new pillars is a short-term action that sets the stage for achieving medium-term goals by 2020. This creates a clear causal link between the two scales.,Yes,0.9,"Short-Term, Long-Term",Short-Term -> Long-Term,Short-Term -> Long-Term,Short-Term: The 2014 enhancement of the USLP is a specific action occurring within a single year.; Long-Term: Goals like empowering women by 2020 (6 years from 2014) and advancing human rights are processes unfolding over decades (>5 years).,"[Short-Term, Long-Term] A short-term enhancement in 2014 established new long-term goals for Unilever's Sustainable Living Plan.","The paragraph describes a specific action in 2014 (Short-Term) that directly introduced new strategic pillars and goals. These goals, such as empowering women by 2020 and advancing human rights, represent commitments and processes extending beyond five years, thus falling into the Long-Term scale. This establishes a clear causal link from a short-term decision to long-term objectives."
287,No,,Yes,Unanimous,Unilever_Annual_Report_and_Accounts_2014_Strategic_Report_page_26.pdf,Smallholder farmers produce 70% of the world’s food and make up 85% of the world’s farmers. Most grow their crops on less than two hectares and are often cut off from training so lack knowledge of how to maximise incomes by improving their agricultural practices. Many of our smallholder farmers are women.,No,0.9,N/A,N/A,N/A,N/A,N/A,"The paragraph presents static facts about smallholder farmers' current situation without describing any temporal processes or causal relationships between different time scales. No events, changes, or temporal dynamics are mentioned.",No,0.86,N/A,N/A,N/A,N/A,N/A,"The paragraph provides statistics and general conditions but no explicit temporal durations or cross-scale causal relationships linking short-, medium-, or long-term effects.",No,0.9,N/A,N/A,N/A,N/A,N/A,The paragraph describes the current state of smallholder farmers without indicating any explicit cross-scale causal interactions.,No,1.0,N/A,N/A,N/A,N/A,N/A,"The paragraph describes ongoing, systemic conditions and characteristics of smallholder farmers, such as producing food, growing crops, being cut off from training, and lacking knowledge. All these elements represent persistent states or processes unfolding over decades, thus falling under the 'Long-Term' scale. No explicit causal links between different temporal scales (Short-Term, Medium-Term, Long-Term) are present."
290,Yes,,Yes,Unanimous,Unilever_Annual_Report_and_Accounts_2014_Strategic_Report_page_26.pdf,"In February 2014 we signed a five-year partnership with the International Fund for Agricultural Development (IFAD) to improve the livelihoods of smallholder farmers. Signed by IFAD President Kanayo F Nwanze and our CEO, Paul Polman, the partnership aims to help improve food security, by raising agricultural productivity and linking farmers to markets.",Yes,0.85,"Short-Term, Medium-Term",Short-Term -> Medium-Term,Short-Term -> Medium-Term,Short-Term: Partnership signing event in February 2014; Medium-Term: Five-year partnership duration and multi-year goals of improving livelihoods and food security,"[Short-Term, Medium-Term] Partnership signing triggers multi-year agricultural development program.",The February 2014 signing is a discrete short-term event that explicitly launches a five-year partnership with medium-term objectives. The signing causally enables the sustained agricultural improvement activities over the partnership duration.,Yes,0.73,"Short-Term, Medium-Term, Long-Term",Short-Term -> Medium-Term | Medium-Term -> Long-Term,"Short-Term -> Medium-Term, Medium-Term -> Long-Term",Short-Term: “In February 2014 we signed” is a dated event.; Medium-Term: “a five-year partnership” specifies a multi-year period.; Long-Term: “aims to help improve food security” implies enduring societal outcomes.,"[Short-Term, Medium-Term, Long-Term] The 2014 signing triggers a five-year partnership, which aims to improve long-run food security.","A dated signing (short-term) explicitly establishes the five-year partnership (medium-term). The partnership is stated to aim at improving food security, an enduring outcome (long-term). No other scales are explicit.",Yes,0.9,"Short-Term, Medium-Term",Short-Term -> Medium-Term,Short-Term -> Medium-Term,Short-Term: The signing of the partnership in February 2014 is a specific event.; Medium-Term: The five-year partnership duration indicates a multi-year strategy.,"[Short-Term, Medium-Term] The signing of a partnership in 2014 initiates a five-year strategy to improve farmer livelihoods.","The signing event in 2014 is a short-term action that initiates a medium-term strategy. The text explicitly links the signing to the five-year partnership, establishing a causal relationship.",Yes,1.0,"Medium-Term, Long-Term",Medium-Term -> Long-Term,Medium-Term -> Long-Term,"Medium-Term: The paragraph explicitly mentions a 'five-year partnership'.; Long-Term: The partnership aims 'to improve the livelihoods of smallholder farmers' and 'improve food security', which are long-term societal goals.","[Medium-Term, Long-Term] A five-year partnership (Medium-Term) was initiated to achieve long-term improvements in smallholder farmer livelihoods and food security (Long-Term).","The paragraph explicitly states a 'five-year partnership' (Medium-Term) was signed 'to improve the livelihoods of smallholder farmers' and 'improve food security'. These outcomes represent sustained, multi-decade goals, thus falling under the Long-Term scale. This establishes a direct causal link from a medium-term action to long-term societal impacts."
295,Yes,,Yes,Unanimous,Unilever_Annual_Report_and_Accounts_2014_Strategic_Report_page_27.pdf,"In his first Independence Day address in 2014, Narendra Modi, India’s new Prime Minister, made a commitment that by 2019 every Indian would have access to a toilet. The promise highlights that about 2.5 billion people globally are without access to adequate sanitation, good hygiene and safe drinking water. There are still 46 countries in the world where less than half the population has access to adequate sanitation facilities. 800,000 children die every year from diarrhoea caused by unsafe water, and poor sanitation and hygiene.",Yes,0.85,"Short-Term, Medium-Term",Short-Term -> Medium-Term,Short-Term -> Medium-Term,Short-Term: Modi's 2014 Independence Day address making the commitment; Medium-Term: The 5-year timeline from 2014 to 2019 for achieving universal toilet access,"[Short-Term, Medium-Term] Modi's 2014 commitment established a 5-year implementation timeline for universal toilet access.",The paragraph shows a clear causal link where Modi's specific 2014 address (short-term event) directly established a multi-year policy timeline extending to 2019 (medium-term strategy). The remaining content describes ongoing global sanitation challenges but lacks explicit temporal causality.,Yes,0.72,"Short-Term, Medium-Term",Short-Term -> Medium-Term,Short-Term -> Medium-Term,Short-Term: The 2014 Independence Day address is a single event.; Medium-Term: The pledge targets completion 'by 2019' (about five years).,"[Short-Term, Medium-Term] The 2014 speech directly produced a pledge to achieve nationwide toilet access by 2019.","The short, dated speech act generated a policy commitment spanning to 2019, linking a momentary event to a multi-year plan. Other figures provide context but lack explicit cross-scale causality.",Yes,0.8,"Short-Term, Medium-Term",Medium-Term -> Short-Term,Medium-Term -> Short-Term,"Short-Term: The annual death of 800,000 children from diarrhoea is a short-term effect.; Medium-Term: The 5-year commitment from 2014 to 2019 to provide toilets is a medium-term goal.","[Medium-Term, Short-Term] The 5-year plan to provide toilets aims to reduce annual diarrhoea deaths.",N/A,Yes,1.0,"Short-Term, Medium-Term, Long-Term",Long-Term -> Medium-Term | Long-Term -> Short-Term,"Long-Term -> Medium-Term, Long-Term -> Short-Term","Short-Term: The '800,000 children die every year' represents an annual, recurring event.; Medium-Term: Modi's commitment 'by 2019' from 2014 is a 5-year plan.; Long-Term: The '2.5 billion people globally are without access' and '46 countries' describe persistent, systemic issues over decades.","[Short-Term, Medium-Term, Long-Term] A Medium-Term commitment responds to a Long-Term global sanitation crisis, which also causes annual Short-Term child mortality.","The Long-Term issue of inadequate global sanitation (affecting 2.5 billion people) prompted the Medium-Term commitment by Modi (2014-2019). Furthermore, these persistent Long-Term problems of unsafe water and poor hygiene directly cause the Short-Term annual deaths of 800,000 children. All three scales are necessary to capture these explicit causal interactions."
299,No,,Yes,Unanimous,Unilever_Annual_Report_and_Accounts_2014_Strategic_Report_page_27.pdf,Women are the majority of our consumer base and their purchasing decisions are pivotal to our growth. They are strongly represented in our agricultural supply chains and in the distribution of our brands to market. At the same time we are a large employer and need the best available talent to succeed in our business goals.,No,0.9,N/A,N/A,N/A,N/A,N/A,"The paragraph describes current business conditions and ongoing relationships with women as consumers, supply chain participants, and employees. No temporal progression or cross-scale causal relationships are indicated - all statements refer to present-day business realities without explicit timeframes or causal connections between different temporal scales.",No,0.9,N/A,N/A,N/A,N/A,N/A,"No explicit durations or cross-scale causality are stated; claims about growth, supply chains, and talent lack timeframes and inter-temporal effects.",No,0.9,N/A,N/A,N/A,N/A,N/A,The paragraph does not provide explicit causal links between events or processes at different temporal scales. It describes the current state of consumer demographics and employment needs without indicating temporal interactions.,No,1.0,N/A,N/A,N/A,N/A,N/A,"The paragraph describes current states and ongoing influences (e.g., 'purchasing decisions are pivotal to our growth', 'need the best available talent'). However, it does not explicitly link an event or process at one defined temporal scale to an event or process at a *different* temporal scale. All statements imply continuous, undifferentiated timeframes without specific cross-scale causality."
