58,No,,Yes,Unanimous,Nestle_Annual_Report_2014_page_22.pdf,"We also provide a range of complementary foods, such as infant cereals and meals and drinks. These baby foods contain carefully selected high-quality ingredients and are fortified with nutrients to meet the specific needs of infants in this important phase of life.",No,0.9,N/A,N/A,N/A,N/A,N/A,"The paragraph describes product characteristics and nutritional benefits but contains no temporal elements or timeframes that would establish events at different scales, let alone causal relationships between them.",No,0.9,N/A,N/A,N/A,N/A,N/A,No explicit timeframes or cross-scale causal effects are stated; only a general product description for infants.,No,0.9,N/A,N/A,N/A,N/A,N/A,The paragraph describes the provision of baby foods but does not establish any explicit cross-scale causal interactions between different temporal scales.,No,1.0,N/A,N/A,N/A,N/A,N/A,"The paragraph describes an ongoing product offering and its immediate purpose (meeting short-term infant needs). While the 'important phase of life' for infants is clearly Short-Term, the temporal scale of the product's provision or fortification strategy is not explicitly stated or implied to be at a different scale (e.g., Medium-Term or Long-Term), preventing the identification of a cross-scale causal link."
61,No,,Yes,Unanimous,Nestle_Annual_Report_2014_page_22.pdf,Illuma is a premium brand containing a unique ingredient blend designed to enhance infants’ absorption of key nutrients.,No,0.9,N/A,N/A,N/A,N/A,N/A,"The paragraph only describes a product's features and purpose without mentioning any temporal processes, timeframes, or causal relationships across different time scales.",No,0.98,N/A,N/A,N/A,N/A,N/A,The sentence lacks explicit timeframes and provides no causal link between different temporal scales.,No,0.9,N/A,N/A,N/A,N/A,N/A,The paragraph describes a product feature without any explicit temporal scale or cross-scale interaction.,No,1.0,N/A,N/A,N/A,N/A,N/A,The paragraph describes a product's current attributes and its intended function. It does not contain any explicit causal links or influences between events or processes occurring at different temporal scales.
62,No,,Yes,Unanimous,Nestle_Annual_Report_2014_page_22.pdf,"BabyNes is the first advanced nutrition system for infants and toddlers that offers age-specific, single serve formulas for children up to the age of three years old.",No,0.9,N/A,N/A,N/A,N/A,N/A,The paragraph describes a product feature (age-specific formulas for children up to 3 years) but contains no causal relationships between different temporal scales - only a static description of the system's capabilities.,No,0.9,N/A,N/A,N/A,N/A,N/A,"Only one timeframe is implied (up to three years), and no explicit causal link between different temporal scales is stated.",No,0.9,N/A,N/A,N/A,N/A,N/A,The paragraph describes a product feature without indicating any causal interaction between different temporal scales.,No,1.0,N/A,N/A,N/A,N/A,N/A,"The paragraph describes a product and its target age range (up to three years), which falls under a single temporal scale (Medium-Term). There are no explicit causal influences or interactions between different temporal scales mentioned in the text."
67,No,,Yes,Unanimous,Nestle_Annual_Report_2014_page_23.pdf,Purina Pro Plan Bright Mind helps support cognitive function in pets.,No,0.9,N/A,N/A,N/A,N/A,N/A,The statement describes a product's general function without specifying timeframes or causal relationships between different temporal scales. No temporal processes or cross-scale interactions are mentioned.,No,0.96,N/A,N/A,N/A,N/A,N/A,No explicit timeframes or causal links across different temporal scales are stated; it's a general claim without duration or multiscale effects.,No,0.9,N/A,N/A,N/A,N/A,N/A,The sentence does not provide any explicit temporal scales or cross-scale causal interactions.,No,1.0,N/A,N/A,N/A,N/A,N/A,The paragraph describes a product's function but does not contain any explicit events or processes that causally link different temporal scales. No specific timeframes or multi-scale interactions are mentioned.
68,No,,Yes,Unanimous,Nestle_Annual_Report_2014_page_23.pdf,"Nestlé Purina PetCare hosted its second ‘Better with Pets’ summit in New York as a forum for discussing a range of pet care issues. The one-day event brought together opinion leaders from across the pet world, including retailers, bloggers, veterinary practitioners, leading animal welfare groups, and, of course, pet-lovers and owners.",No,0.9,N/A,N/A,N/A,N/A,N/A,The paragraph describes a single one-day event without any explicit causal connections to different temporal scales. No cross-scale interactions are present.,No,0.88,N/A,N/A,N/A,N/A,N/A,"Only a one-day event is mentioned with no explicit causal effects on multi-year or long-term processes; thus, no cross-scale link can be established.",No,0.9,N/A,N/A,N/A,N/A,N/A,The paragraph describes a one-day event without any explicit cross-scale causal interactions between different temporal scales.,No,1.0,N/A,N/A,N/A,N/A,N/A,"The paragraph describes a single, one-day event (Short-Term) focused on discussion. It does not explicitly state any causal influence from this event to, or from, processes at Medium-Term or Long-Term scales, thus no cross-scale interaction is present."
76,No,,Yes,Unanimous,Nestle_Annual_Report_2014_page_26.pdf,"Global companies like Nestlé have a role to play and can make a valuable contribution to the efforts to address some of the critical issues the world faces, such as food security, nutrition and health, water, sustainability and human rights.",No,0.8,N/A,N/A,N/A,N/A,N/A,The paragraph describes global companies' potential role in addressing critical issues but provides no temporal framing or timeframes for when these contributions occur or how they unfold across different time scales.,No,0.9,N/A,N/A,N/A,N/A,N/A,No explicit timeframes or cross-scale causal relations are stated; the text is a general statement about contributions to broad issues.,No,0.9,N/A,N/A,N/A,N/A,N/A,The paragraph does not provide explicit causal links between events or processes at different temporal scales.,No,1.0,N/A,N/A,N/A,N/A,N/A,"The paragraph identifies critical global issues as Long-Term processes. However, it describes companies' 'contribution' as a general capability rather than a concrete event or process with a defined temporal scale (Short-Term or Medium-Term). Consequently, no explicit cross-scale causal link between distinct temporal events can be established."
77,No,,Yes,Unanimous,Nestle_Annual_Report_2014_page_26.pdf,"Our Creating Shared Value approach focuses the business on the long term, where the success of society and economic activity are intertwined and mutually reinforcing.",No,0.8,N/A,N/A,N/A,N/A,N/A,The paragraph describes a long-term business approach but lacks explicit causal connections between different temporal scales. It presents a single temporal perspective without cross-scale interactions.,No,0.86,N/A,N/A,N/A,N/A,N/A,The text only references a long-term focus and intertwined outcomes without linking different time scales causally.,No,0.9,N/A,N/A,N/A,N/A,N/A,The paragraph discusses a long-term focus but does not explicitly link it to any short-term or medium-term events or processes.,No,1.0,N/A,N/A,N/A,N/A,N/A,"The paragraph describes a business approach focused on the 'long term' and the 'long-term' intertwining of society and economy. All elements discussed pertain to a single temporal scale (Long-Term), and there are no explicit causal connections or influences between different temporal scales."
80,No,,Yes,Unanimous,Nestle_Annual_Report_2014_page_26.pdf,"Then-President of the Swiss Confederation, Didier Burkhalter, is greeted by Peter Brabeck-Letmathe, Nestlé Chairman, at the 2014 Creating Shared Value Forum in Switzerland.",No,0.9,N/A,N/A,N/A,N/A,N/A,The paragraph describes a single event (a greeting at a 2014 forum) with no causal relationships between different temporal scales. It's purely descriptive of one moment in time without any cross-scale interactions.,No,0.95,N/A,N/A,N/A,N/A,N/A,Only a single short-term event (a greeting at a 2014 forum) is described; no explicit cross-scale causal relationship.,No,0.9,N/A,N/A,N/A,N/A,N/A,The paragraph describes a specific event without any explicit causal interaction between different temporal scales.,No,1.0,N/A,N/A,N/A,N/A,N/A,"The paragraph describes a single, discrete event (a greeting at a forum in 2014). There is no explicit mention of any causal influence or interaction between this short-term event and processes or events at other temporal scales (Medium-Term or Long-Term). No cross-scale links can be inferred from the provided text."
82,No,,Yes,Unanimous,Nestle_Annual_Report_2014_page_27.pdf,"Nestlé Nespresso’s revolutionary system – VertuoLine – was launched in 2014 in the US and Canada. It brews long cups, matching North American preferences, as well as authentic espresso.",No,0.9,N/A,N/A,N/A,N/A,N/A,The paragraph describes a single product launch event in 2014 without any causal relationships between different temporal scales. No cross-scale interactions are present.,No,0.9,N/A,N/A,N/A,N/A,N/A,"Only a one-time product launch is dated; no explicit multi-year or long-term process is mentioned, and no cross-scale causal link is stated.",No,0.9,N/A,N/A,N/A,N/A,N/A,"The paragraph describes a product launch in 2014, which is a short-term event. There is no explicit causal link to another temporal scale, such as medium-term or long-term effects or strategies.",No,1.0,N/A,N/A,N/A,N/A,N/A,"The paragraph describes a single event, the launch of VertuoLine in 2014 (Short-Term), and its features. There are no explicit causal links or influences between this event and any other event or process occurring at a different temporal scale."
85,No,,Yes,Unanimous,Nestle_Annual_Report_2014_page_27.pdf,"VertuoLine features a new line of 12 Grands Crus, eight large-cup coffees and four espresso blends. The machine is sold directly to consumers through the network of Nespresso boutiques, over the phone and online and at selected North American retailers.",No,0.9,N/A,N/A,N/A,N/A,N/A,"The paragraph describes product features and distribution channels but contains no temporal elements or timeframes that would establish events at different temporal scales, let alone causal relationships between them.",No,0.9,N/A,N/A,N/A,N/A,N/A,No explicit timeframes or cross-scale causal effects are stated; only product features and sales channels are described.,No,0.95,N/A,N/A,N/A,N/A,N/A,The paragraph describes a product launch and distribution strategy without any explicit cross-scale temporal interactions.,No,1.0,N/A,N/A,N/A,N/A,N/A,"The paragraph describes a new product line and its distribution channels. While the product launch could be considered Short-Term, there are no explicit causal links or interactions described between events or processes occurring at different temporal scales."
86,No,,Yes,Unanimous,Nestle_Annual_Report_2014_page_27.pdf,An intelligent extraction system allows the new Nespresso VertuoLine machine to recognise the different Grand Cru coffee capsules and brew each blend in the optimal way.,No,0.9,N/A,N/A,N/A,N/A,N/A,"The paragraph describes a technical feature of a coffee machine without any temporal processes or cross-scale interactions. It focuses on the machine's capability to recognize capsules and optimize brewing, but contains no time-based causal relationships.",No,0.9,N/A,N/A,N/A,N/A,N/A,The sentence describes a product feature without any explicit timeframes or cross-scale causal effects.,No,0.9,N/A,N/A,N/A,N/A,N/A,The paragraph describes a feature of a coffee machine without any explicit cross-scale temporal interactions.,No,1.0,N/A,N/A,N/A,N/A,N/A,"The paragraph describes the immediate functionality of a new product and its system, all of which fall within the Short-Term temporal scale. No explicit causal links or influences between different temporal scales are present in the text."
88,No,,Yes,Unanimous,Nestle_Annual_Report_2014_page_27.pdf,"A researcher at the Nestlé System Technology Centre in Orbe, Switzerland, where many Nestlé technology systems have originated, including Nespresso VertuoLine.",No,0.9,N/A,N/A,N/A,N/A,N/A,The paragraph only describes a static location and past technology origins without specifying timeframes or causal relationships between different temporal scales.,No,0.94,N/A,N/A,N/A,N/A,N/A,No explicit timeframes or cross-scale causal effects are stated; the sentence only notes origin location of technology systems.,No,0.9,N/A,N/A,N/A,N/A,N/A,The paragraph does not describe any events or processes with explicit temporal scales or causal interactions between different scales.,No,1.0,N/A,N/A,N/A,N/A,N/A,"The paragraph describes a research center and its output, mentioning a long-term history of originating systems and providing a specific product (Nespresso VertuoLine) as an example. However, it does not explicitly state a causal influence between an event or process at one temporal scale and another. The relationship is descriptive, not causal across scales."
90,Yes,,Yes,Unanimous,Nestle_Annual_Report_2014_page_29.pdf,"For the Nestlé Needs YOUth programme in Europe, where one in four people under the age of 25 is unemployed, we pledged to offer 20000 jobs, apprenticeships and traineeships over three years, and establish readiness for work activities across our operations. We are well on schedule to achieve this with 11832 job and training opportunities created by the end of 2014 and around 1600 readiness for work events completed.",Yes,0.85,"Short-Term, Medium-Term",Medium-Term -> Short-Term,Medium-Term -> Short-Term,"Short-Term: Progress by end of 2014 with 11832 opportunities created and 1600 events completed; Medium-Term: Three-year pledge to offer 20000 jobs, apprenticeships and traineeships","[Medium-Term, Short-Term] Three-year employment pledge generates measurable annual progress milestones.","The three-year strategic commitment explicitly drives short-term implementation and measurement. The 2014 progress report directly results from executing the medium-term pledge, showing clear causal flow from strategic planning to operational delivery.",Yes,0.78,"Short-Term, Medium-Term",Short-Term -> Medium-Term,Short-Term -> Medium-Term,Short-Term: 11832 opportunities by end of 2014 and ~1600 events completed.; Medium-Term: Pledge to deliver 20000 roles and work-readiness over three years.,"[Short-Term, Medium-Term] Immediate job/events completions are cited as keeping the company on track to meet the three-year pledge.","The text links near-term completions to being on schedule for a three-year target. No explicit long-term effects are stated, so only Short-Term -> Medium-Term is included.",Yes,0.9,"Short-Term, Medium-Term",Short-Term -> Medium-Term,Short-Term -> Medium-Term,"Short-Term: 11832 job and training opportunities created by the end of 2014.; Medium-Term: Pledged to offer 20000 jobs, apprenticeships, and traineeships over three years.","[Short-Term, Medium-Term] Short-term job creation supports the medium-term goal of 20000 opportunities over three years.",The short-term achievement of 11832 opportunities by 2014 is a step towards the medium-term goal of 20000 over three years. This shows a clear causal link between short-term actions and medium-term objectives.,Yes,0.9,"Long-Term, Medium-Term, Short-Term",Long-Term -> Medium-Term | Medium-Term -> Short-Term,"Long-Term -> Medium-Term, Medium-Term -> Short-Term","Long-Term: The persistent issue of 'one in four people under the age of 25 is unemployed' represents a structural, long-standing societal problem.; Medium-Term: The 'pledged to offer 20000 jobs... over three years' explicitly defines a multi-year program duration.; Short-Term: The '11832 job and training opportunities created by the end of 2014' are specific, measurable outputs achieved within a shorter period as part of the larger program.","[Long-Term, Medium-Term, Short-Term] A long-term societal problem of youth unemployment drives a medium-term program, which in turn generates short-term job and training opportunities.",The persistent issue of youth unemployment (Long-Term) explicitly motivates the creation of the three-year Nestlé Needs YOUth programme (Medium-Term). This multi-year program then directly results in the creation of specific job and training opportunities and events by a given date (Short-Term progress). The links demonstrate a clear causal chain across these distinct temporal scales.
97,No,,Yes,Unanimous,Nestle_Annual_Report_2014_page_31.pdf,"Nestlé Health Science has a range of nutrition solutions, diagnostics, devices and drugs that target health areas, such as paediatric and acute care, metabolic and obesity care, healthy ageing, and gastrointestinal and brain health.",No,0.9,N/A,N/A,N/A,N/A,N/A,"The paragraph describes Nestlé Health Science's current product portfolio and target health areas but contains no temporal elements, timeframes, or causal relationships between different time scales.",No,0.9,N/A,N/A,N/A,N/A,N/A,No explicit timeframes or cross-scale causal links are stated; the text only lists product areas.,No,0.9,N/A,N/A,N/A,N/A,N/A,The paragraph describes various health areas targeted by Nestlé Health Science but does not provide explicit causal links between events or processes at different temporal scales.,No,1.0,N/A,N/A,N/A,N/A,N/A,"The paragraph describes Nestlé Health Science's current portfolio and target health areas. It does not contain any explicit events or processes at different temporal scales that causally influence each other, thus no cross-scale interactions are present."
98,No,,Yes,Unanimous,Nestle_Annual_Report_2014_page_31.pdf,"The Product Technology Centre in Konolfingen, Switzerland, develops and manufactures a range of products for Nestlé Health Science.",No,0.9,N/A,N/A,N/A,N/A,N/A,"The paragraph only describes a static organizational fact about a facility's location and function. No temporal processes, events, or timeframes are mentioned that would create cross-scale interactions.",No,0.93,N/A,N/A,N/A,N/A,N/A,No explicit timeframes or cross-scale causal effects are stated; it's a general description of activities without temporal interaction.,No,0.9,N/A,N/A,N/A,N/A,N/A,The paragraph describes a location and its function without any explicit temporal cross-scale interactions or timeframes mentioned.,No,1.0,N/A,N/A,N/A,N/A,N/A,"The paragraph describes an ongoing operational function of a centre, 'develops and manufactures'. It does not specify distinct events or processes that can be mapped to the provided temporal scales, nor does it imply any causal interactions between different scales."
100,No,,Yes,Unanimous,Nestle_Annual_Report_2014_page_32.pdf,"Nestlé Health Science is supported in its work by the Nestlé Institute of Health Sciences (NIHS) which under takes fundamental scientific research into how nutrition can be used to empower people to improve and maintain their health. NIHS research teams are providing greater insight into how our environment, diet and lifestyle intersect with our genetic make-up, gut microorganisms, metabolism and nutritional status to determine our health.",No,0.8,N/A,N/A,N/A,N/A,N/A,"The paragraph describes ongoing research activities and scientific understanding without specifying timeframes or causal relationships between different temporal scales. While the research may have implications across time scales, no explicit cross-scale interactions are stated.",No,0.86,N/A,N/A,N/A,N/A,N/A,No explicit durations or cross-scale causal effects are stated; the text describes research support and insights without timeframes.,No,0.9,N/A,N/A,N/A,N/A,N/A,The paragraph describes ongoing research without specifying any temporal scales or explicit cross-scale causal interactions.,No,1.0,N/A,N/A,N/A,N/A,N/A,"The paragraph exclusively describes ongoing fundamental scientific research and its long-term goals related to health improvement and understanding. All identified activities and their impacts fall under the 'Long-Term' temporal scale. There are no explicit mentions of events or processes at 'Short-Term' or 'Medium-Term' scales, nor any causal links between different temporal scales."
104,No,,Yes,Unanimous,Nestle_Annual_Report_2014_page_32.pdf,"Nestlé Fitness biscuits are wholegrain cereal-based snacks low in fat and calories. After just three years, Nestlé Fitness biscuits hold the number one position in Brazil’s healthy biscuit segment. The biscuits are sold across South America and in Israel.",No,0.9,N/A,N/A,N/A,N/A,N/A,"The paragraph describes a product's market success after three years, but lacks explicit causal connections between different temporal scales. The three-year timeframe and current market position are presented as factual outcomes rather than causally linked processes across different time horizons.",No,0.9,N/A,N/A,N/A,N/A,N/A,"Only one timeframe is mentioned (three years), with no explicit causal link to another temporal scale.",No,0.9,N/A,N/A,N/A,N/A,N/A,"The paragraph describes the success of Nestlé Fitness biscuits over a three-year period, but does not explicitly link this to any long-term or short-term processes or events.",No,1.0,N/A,N/A,N/A,N/A,N/A,"The paragraph describes a single event (achieving market leadership) over a single, defined temporal scale (Medium-Term: 'After just three years'). There are no explicit causal links or influences stated between different temporal scales."
105,No,,Yes,Unanimous,Nestle_Annual_Report_2014_page_32.pdf,"Golden Morn is a ready-to-eat breakfast cereal sold in Nigeria, made of maize or millet, and fortified with micronutrients vitamin A and iron.",No,0.9,N/A,N/A,N/A,N/A,N/A,"The paragraph provides only static product description without any temporal processes, events, or causal relationships across different time scales.",No,0.98,N/A,N/A,N/A,N/A,N/A,"The sentence is purely descriptive with no events, durations, or causal effects across time scales.",No,0.9,N/A,N/A,N/A,N/A,N/A,The paragraph describes a product and its composition without any explicit temporal cross-scale interactions.,No,1.0,N/A,N/A,N/A,N/A,N/A,"The paragraph describes the characteristics of a product (Golden Morn) but does not contain any events or processes that unfold over time, nor does it describe any causal interactions between different temporal scales. No explicit temporal elements or causal links are present."
