Source,Full Paragraph Text,Interaction Present Disagreement,Scale Disagreement,claude3.7: Interaction Present,claude3.7: Confidence,claude3.7: Scales,claude3.7: Causal Type,claude3.7: Causal Pathway,claude3.7: Scale Explanations,claude3.7: Summary,4o: Interaction Present,4o: Confidence,4o: Scales,4o: Causal Type,4o: Causal Pathway,4o: Scale Explanations,4o: Summary,o4_mini: Interaction Present,o4_mini: Confidence,o4_mini: Scales,o4_mini: Causal Type,o4_mini: Causal Pathway,o4_mini: Scale Explanations,o4_mini: Summary,gemini2.5: Interaction Present,gemini2.5: Confidence,gemini2.5: Scales,gemini2.5: Causal Type,gemini2.5: Causal Pathway,gemini2.5: Scale Explanations,gemini2.5: Summary
Unilever_Annual_Report_and_Accounts_2014_Strategic_Report_page_12.pdf,"We make the majority of what we sell through a network of more than 240 manufacturing sites around the world. We have invested significantly in our factories in recent years to create an efficient, reliable and more sustainable network. We are now able to maximise the global scale of our operations, while having the agility to meet local demands. More eco-efficient production is helping us meet the USLP targets, so by the end of January 2015, for instance, all our factories had achieved zero non-hazardous waste to landfill, producing 140,000 tonnes less waste. Since 2008, we estimate that eco-production has avoided costs in excess of €400 million.",Yes,None,No,1.0,N/A,N/A,N/A,,N/A,Yes,1.0,"Environmental and Societal, Organizational",Direct Causal Link,Organizational -> Environmental and Societal,Organizational: The company and its network of manufacturing sites represent an organizational scale.; Environmental and Societal: The eco-efficient production and waste reduction impact societal-level environmental systems.,[Organizational -> Environmental and Societal] The company's investment in eco-efficient production led to significant waste reduction and cost savings.,Yes,0.9,"Environmental and Societal, Organizational",Direct Causal Link,Organizational -> Environmental and Societal,"Organizational: The text discusses a company and its manufacturing sites, which are part of an organization.; Environmental and Societal: The mention of eco-efficient production and waste reduction relates to environmental impacts and societal goals.",[Organizational -> Environmental and Societal] The company's eco-efficient production practices contribute to environmental sustainability and waste reduction.,Yes,1.0,"Environmental and Societal, Organizational",Direct Causal Link,Organizational -> Environmental and Societal,"Organizational: The text refers to 'We' (the company), 'our factories', and 'eco-efficient production' as internal processes and units of a single organization.; Environmental and Societal: The outcome of 'zero non-hazardous waste to landfill' and 'producing 140,000 tonnes less waste' directly describes an impact on natural systems, which falls under the Environmental and Societal scale.","[Organizational -> Environmental and Societal] The organization's eco-efficient production and factory investments led to zero non-hazardous waste to landfill, reducing its impact on natural systems."
Unilever_Annual_Report_and_Accounts_2014_Strategic_Report_page_12.pdf,"How we move products from factories to customers is the role of our logistics operation. We are now rolling out our global network of logistics centres that organise movement of goods centrally and more efficiently, delivering savings, reduced stocks, reduced carbon emissions and improved customer service. These operational hubs now allow us to centralise other services too, including monitoring orders from customers through to payment.",Yes,"Environmental and Societal, Inter-Organizational / Sector",Yes,0.9,"Individual, Inter-Organizational / Sector, Organizational",Causal Chain,Organizational -> Inter-Organizational / Sector -> Individual,Organizational: The 'we' refers to a single company implementing the logistics strategy; Inter-Organizational / Sector: The 'global network of logistics centres' represents a supply chain system spanning multiple organizations; Individual: The 'customers' receiving improved service are individuals or households,"[Organizational -> Inter-Organizational / Sector -> Individual] A company implements a global logistics network that reorganizes supply chain operations, ultimately delivering improved service to customers.",No,1.0,N/A,N/A,N/A,,N/A,No,0.0,N/A,N/A,N/A,,N/A,Yes,1.0,"Environmental and Societal, Individual, Organizational",Mixed/Complex Pattern,"Organizational -> [Environmental and Societal, Individual]","Organizational: The entities 'We' (the company), 'our logistics operation', and 'global network of logistics centres' refer to a single organization and its internal units/initiatives.; Environmental and Societal: 'carbon emissions' explicitly refers to an impact on natural systems.; Individual: 'customers' refers to specific individuals who receive service.","[Organizational -> [Environmental and Societal, Individual]] A company's new logistics centres reduce carbon emissions and improve service for customers."
Unilever_Annual_Report_and_Accounts_2014_Strategic_Report_page_12.pdf,"We work closely with retailers to win in the market place and make sure that our brands are always available, properly displayed and in the right price bracket. Our go-to-market capability ensures that we become the supplier of choice for our customers and trade partners, through strong joint business planning and in-store execution via Perfect Store programmes, to help deliver sustainable sales growth. This is essential for us to be able to add premium brand extensions to our product ranges, land product innovations on the shelves, enter new geographies and markets, and build our distribution strength to reach new consumers.",Yes,"Individual, Inter-Organizational / Sector",Yes,1.0,"Inter-Organizational / Sector, Organizational",Bidirectional Link,Organizational <-> Inter-Organizational / Sector,Organizational: The company ('we') is a single organization making strategic decisions about its brands and go-to-market approach.; Inter-Organizational / Sector: Retailers and trade partners represent multiple organizations that form a supply chain relationship with the company.,"[Organizational <-> Inter-Organizational / Sector] The company works with retailers through joint business planning and in-store execution, which enables the company to expand its product range and reach.",No,1.0,N/A,N/A,N/A,,N/A,No,0.0,N/A,N/A,N/A,,N/A,Yes,1.0,"Individual, Organizational",Causal Chain,Organizational -> Organizational -> Individual,"Organizational: The entities 'We' (the company), 'retailers', 'customers and trade partners' represent single organizations or formal groups. Actions like 'go-to-market capability', 'joint business planning', 'in-store execution', 'sustainable sales growth', and 'building distribution strength' are attributes, activities, or outcomes related to an organization.; Individual:  'New consumers' explicitly refers to specific individual people who are the target of the organization's efforts.",[Organizational -> Organizational -> Individual] A company's go-to-market capability and resulting sustainable sales growth are essential for it to build distribution strength and reach new consumers.
Unilever_Annual_Report_and_Accounts_2014_Strategic_Report_page_12.pdf,"We spend about €7 billion annually on marketing, making us one of the world’s biggest advertisers. This ensures that our brands and products are consumers’ first choice. We use multiple media to achieve cut-through in a highly competitive and busy world. Traditional media channels continue to play a big part but digital communications have revolutionised the way marketing engages with people, creating entirely new sales and marketing opportunities. We create our own entertainment content, including Unilever brand advertising, and this is distributed, for example, by mobile devices in emerging markets.",Yes,Inter-Organizational / Sector,Yes,1.0,"Environmental and Societal, Individual, Inter-Organizational / Sector, Organizational",Mixed/Complex Pattern,"Organizational -> Individual, Inter-Organizational / Sector -> Organizational -> Individual",Organizational: Unilever ('we') as a single company making marketing decisions; Individual: Consumers who are influenced to make Unilever brands their 'first choice'; Inter-Organizational / Sector: Digital communications systems that have revolutionized marketing engagement; Environmental and Societal: Emerging markets where mobile distribution occurs,"[Organizational -> Individual, Inter-Organizational / Sector -> Organizational -> Individual] Unilever's marketing spending influences consumer choices, while digital communications reshape how Unilever engages with individuals.",No,1.0,N/A,N/A,N/A,,N/A,No,0.0,N/A,N/A,N/A,,N/A,Yes,1.0,"Environmental and Societal, Individual, Organizational",Causal Chain,Environmental and Societal -> Organizational -> Individual,"Environmental and Societal: Refers to 'digital communications' as a broader technological and societal phenomenon that has system-level impacts.; Organizational: Refers to 'marketing' as an internal function and strategy of 'We' (Unilever), a single organization.; Individual: Refers to 'people' who are specific individuals engaged by marketing efforts.","[Environmental and Societal -> Organizational -> Individual] Digital communications, as a societal force, have revolutionized Unilever's organizational marketing engagement with individual people."
Unilever_Annual_Report_and_Accounts_2014_Strategic_Report_page_13.pdf,"Unilever’s portfolio has four categories: Personal Care, Foods, Refreshment and Home Care. We have 13 brands with sales of more than €1 billion. Brands are our biggest asset but also present a risk if they do not maintain value and relevance to consumers. That’s why innovation and remaining competitive are crucial. We launched new brands in 2014, backed by marketing and customer insight, for example Regenerate, a dental care product. In addition to the Qinyuan and Talenti Gelato & Sorbetto acquisitions, we are also in the process of acquiring the Camay and Zest brands, to expand categories and boost growth. To sharpen our portfolio in 2014 we disposed of Slim. Fast, Ragu and Bertolli in North America, and other non-core Foods brands.",Yes,None,Yes,0.9,"Individual, Organizational",Direct Causal Link,Individual -> Organizational,Individual: Consumers who determine brand value and relevance through their preferences; Organizational: Unilever as a single company managing its brand portfolio,"[Individual -> Organizational] Consumer preferences and relevance perceptions directly impact Unilever's brand value, driving the company's portfolio management decisions.",No,1.0,N/A,N/A,N/A,,N/A,No,0.0,N/A,N/A,N/A,,N/A,Yes,1.0,"Individual, Organizational",Direct Causal Link,Individual -> Organizational,"Individual: Consumers are specific individuals whose perception of a brand's value and relevance is described as having a direct impact.; Organizational: Unilever and its brands represent a single organization and its assets, which face risk based on the perceptions of consumers.",[Individual -> Organizational] Consumers' failure to perceive value and relevance in brands directly presents a risk to the organizational entity.
Unilever_Annual_Report_and_Accounts_2014_Strategic_Report_page_13.pdf,"Unilever’s products sell in more than 190 countries and are used by 2 billion consumers every day. Our business is organised across three geographies: the Americas; Europe; and markets comprising Asia, Australasia, Africa, Middle East, Turkey, Russia, Ukraine and Belarus. We also analyse operations by developed and emerging markets. This wide spread exposes us to economic and political risks beyond our control. However, the diversity of our portfolio and geographic reach help mitigate our exposure to any specific risk.",Yes,N/A,No,0.9,N/A,N/A,N/A,,N/A,No,1.0,N/A,N/A,N/A,,N/A,No,0.0,N/A,N/A,N/A,,N/A,Yes,1.0,"Environmental and Societal, Organizational",Bidirectional Link,Organizational <-> Environmental and Societal,"Organizational: Unilever, referred to as 'Our business' and its internal characteristics like 'wide spread', 'portfolio', and 'geographic reach', represents a single organization.; Environmental and Societal: 'Economic and political risks' are described as external, societal-level systems that can influence entities at other scales.","[Organizational <-> Environmental and Societal] Unilever's widespread operations expose it to external economic and political risks, which its diverse portfolio and geographic reach help mitigate."
Unilever_Annual_Report_and_Accounts_2014_Strategic_Report_page_14.pdf,"We cannot achieve our Vision to double our size unless we find new ways to operate that decouple growth from our environmental impact, while using growth as an enabler for positive social impact. Launched in 2010, the Unilever Sustainable Living Plan (USLP) is our blueprint for sustainable growth. It is helping to drive profitable growth for our brands, save costs and fuel innovation.",Yes,N/A,No,1.0,N/A,N/A,N/A,,N/A,Yes,1.0,"Environmental and Societal, Organizational",Direct Causal Link,Organizational -> Environmental and Societal,Organizational: Unilever is a single organization implementing the USLP.; Environmental and Societal: The USLP aims to decouple growth from environmental impact and enable positive social impact.,[Organizational -> Environmental and Societal] Unilever's USLP aims to decouple growth from environmental impact and enable positive social impact.,No,0.0,N/A,N/A,N/A,,N/A,No,1.0,N/A,N/A,N/A,,N/A
Unilever_Annual_Report_and_Accounts_2014_Strategic_Report_page_14.pdf,"We are making good progress with our first goal: to help more than a billion people improve their health and well-being by 2020, reaching 397 million by the end of 2014. The progress on our second goal is more mixed. We have achieved zero non-hazardous waste to landfill from our factories, and continue to make significant reductions in the greenhouse gas (GHG) and water impacts of our manufacturing. But the consumer element of our target to halve the water and GHG impacts of our products remains a challenge. On waste reduction, new technology such as the roll-out of compressed deodorant sprays and our new Dove Body Wash bottles has enabled reductions. On our third goal, we are also making good progress. We are now sourcing more than half our agricultural raw materials sustainably and have reached around 800,000 smallholder farmers with help and training. We have created 70,000 women micro-entrepreneurs distributing our products in India while making progress on our new commitments to enhance livelihoods across the value chain.",Yes,"Environmental and Societal, Inter-Organizational / Sector",Yes,1.0,"Individual, Organizational",Direct Causal Link,Organizational -> Individual,Organizational: Unilever ('we') is a single company implementing sustainability initiatives.; Individual: Smallholder farmers and women micro-entrepreneurs are specific people or informal groups being affected by Unilever's actions.,"[Organizational -> Individual] Unilever provides training to smallholder farmers and creates micro-entrepreneurship opportunities for women in India, directly affecting individual livelihoods.",Yes,1.0,"Environmental and Societal, Individual, Organizational",Causal Chain,Organizational -> Environmental and Societal -> Individual,"Organizational: The organization is implementing goals related to waste reduction and sustainable sourcing.; Environmental and Societal: The goals include reducing GHG and water impacts, which affect societal-level systems.; Individual: The organization is impacting individuals such as smallholder farmers and women micro-entrepreneurs.",[Organizational -> Environmental and Societal -> Individual] The organization's sustainability efforts reduce environmental impacts and improve livelihoods for farmers and entrepreneurs.,No,0.0,N/A,N/A,N/A,,N/A,Yes,1.0,"Environmental and Societal, Individual, Inter-Organizational / Sector, Organizational",Direct Causal Link,Organizational -> Individual,"Organizational: Refers to 'We,' representing the company, a single organization that initiates various actions and achieves goals.; Individual: Includes 'people,' 'smallholder farmers,' and 'women micro-entrepreneurs,' specific individuals or informal groups influenced by the company's actions.; Inter-Organizational / Sector: 'Value chain' refers to groups of organizations within a supply or distribution network, which the company influences to enhance livelihoods.; Environmental and Societal: Mentions 'landfill,' 'greenhouse gas (GHG),' and 'water impacts,' which are components of societal-level or natural systems affected by the company's operations.","[Organizational -> Individual] The company created 70,000 women micro-entrepreneurs who distribute products, directly impacting individuals."
Unilever_Annual_Report_and_Accounts_2014_Strategic_Report_page_14.pdf,By 2020 our goal is to halve the environmental footprint of the making and use of our products as we grow our business.,Yes,N/A,No,0.0,N/A,N/A,N/A,,N/A,No,1.0,N/A,N/A,N/A,,N/A,No,0.0,N/A,N/A,N/A,,N/A,Yes,1.0,"Environmental and Societal, Organizational",Direct Causal Link,Organizational -> Environmental and Societal,"Organizational: 'Our' refers to a single company or organization with an internal goal to manage its business and products.; Environmental and Societal: The 'environmental footprint' explicitly refers to the impact on natural systems, classifying it at the environmental and societal level.",[Organizational -> Environmental and Societal] An organization sets a goal to halve the environmental footprint of its products.
Unilever_Annual_Report_and_Accounts_2014_Strategic_Report_page_14.pdf,By 2020 we will enhance the livelihoods of millions of people as we grow our business.,Yes,N/A,No,0.0,N/A,N/A,N/A,,N/A,No,1.0,N/A,N/A,N/A,,N/A,No,0.0,N/A,N/A,N/A,,N/A,Yes,1.0,"Individual, Organizational",Direct Causal Link,Organizational -> Individual,Organizational: The actor 'we' and the action 'grow our business' refer to the operations and expansion of a single organization.; Individual: The outcome 'livelihoods of millions of people' explicitly refers to the well-being and economic status of numerous specific individuals.,[Organizational -> Individual] A business's growth is stated to directly enhance the livelihoods of millions of people.
Unilever_Annual_Report_and_Accounts_2014_Strategic_Report_page_14.pdf,By 2020 we will help more than a billion people to improve their health and hygiene. This will help reduce the incidence of life-threatening diseases like diarrhoea.,Yes,"Environmental and Societal, Organizational",Yes,1.0,"Individual, Organizational",Direct Causal Link,Organizational -> Individual,Organizational: The 'we' making the commitment to help appears to be an organization with the capacity to impact over a billion people.; Individual: The 'more than a billion people' who will receive help with health and hygiene represent the individual scale.,"[Organizational -> Individual] An organization commits to helping over a billion people improve their health and hygiene, which will reduce the incidence of life-threatening diseases like diarrhea.",Yes,1.0,"Environmental and Societal, Individual",Direct Causal Link,Individual -> Environmental and Societal,Individual: The statement refers to 'more than a billion people' which are specific individuals.; Environmental and Societal: The reduction in life-threatening diseases like diarrhoea affects societal-level health systems.,[Individual -> Environmental and Societal] Helping individuals improve health and hygiene reduces societal incidence of diseases like diarrhoea.,No,0.0,N/A,N/A,N/A,,N/A,Yes,1.0,"Environmental and Societal, Individual, Organizational",Causal Chain,Organizational -> Individual -> Environmental and Societal,"Organizational: 'we' refers to a single organization undertaking a specific initiative.; Individual: 'more than a billion people' refers to specific individuals whose health and hygiene are improved.; Environmental and Societal: 'reduce the incidence of life-threatening diseases' describes an impact on public health, which is a societal-level system.",[Organizational -> Individual -> Environmental and Societal] An organization's initiative to improve individuals' health and hygiene will help reduce the societal incidence of life-threatening diseases.
Unilever_Annual_Report_and_Accounts_2014_Strategic_Report_page_14.pdf,By 2020 we will empower 5 million women.,Yes,N/A,No,1.0,N/A,N/A,N/A,,N/A,No,1.0,N/A,N/A,N/A,,N/A,No,0.0,N/A,N/A,N/A,,N/A,Yes,1.0,"Individual, Organizational",Direct Causal Link,Organizational -> Individual,Organizational: 'we' refers to a specific organization or entity undertaking a large-scale initiative.; Individual: '5 million women' represents a large group of specific individuals who are the recipients of the action.,[Organizational -> Individual] An organization plans to empower 5 million women by 2020.
Unilever_Annual_Report_and_Accounts_2014_Strategic_Report_page_14.pdf,By 2020 we will advance human rights across our operations and extended supply chain.,Yes,N/A,No,1.0,N/A,N/A,N/A,,N/A,No,1.0,N/A,N/A,N/A,,N/A,No,0.0,N/A,N/A,N/A,,N/A,Yes,0.9,"Environmental and Societal, Inter-Organizational / Sector, Organizational",Mixed/Complex Pattern,Organizational -> Inter-Organizational / Sector; Organizational -> Environmental and Societal,"Organizational: ""we"" refers to the specific organization making the commitment, and ""our operations"" refers to its internal activities.; Inter-Organizational / Sector: ""extended supply chain"" represents a network of distinct organizations connected through business relationships.; Environmental and Societal: ""human rights"" is a broad societal concept, indicating an impact on the societal level.","[Organizational -> Inter-Organizational / Sector, Environmental and Societal] The organization commits to advancing human rights across its extended supply chain, contributing to broader societal well-being."
Unilever_Annual_Report_and_Accounts_2014_Strategic_Report_page_16.pdf,"Of growing influence in the FMCG markets are discount stores which are providing fierce competition to the incumbent supermarket chains, most notably in the US and Europe.",Yes,N/A,No,0.0,N/A,N/A,N/A,,N/A,No,1.0,N/A,N/A,N/A,,N/A,No,0.0,N/A,N/A,N/A,,N/A,Yes,1.0,"Inter-Organizational / Sector, Organizational",Direct Causal Link,Organizational -> Inter-Organizational / Sector,"Organizational: Refers to 'discount stores' and 'incumbent supermarket chains', which are specific types of single organizations.; Inter-Organizational / Sector: Refers to 'FMCG markets', which represents an entire industry sector or market where multiple organizations operate.",[Organizational -> Inter-Organizational / Sector] Discount stores are exerting growing influence in the FMCG markets by providing fierce competition to incumbent supermarket chains.
Unilever_Annual_Report_and_Accounts_2014_Strategic_Report_page_16.pdf,"World population is expected to rise to 8 billion by 2025 and, by then, more than 4 billion will be part of the ‘consuming class’. For the first time the number of people with discretionary income will exceed the number struggling to meet basic needs – a trend described by management consultancy McKinsey as possibly the biggest opportunity in the history of capitalism.",Yes,N/A,No,1.0,N/A,N/A,N/A,,N/A,No,1.0,N/A,N/A,N/A,,N/A,No,0.0,N/A,N/A,N/A,,N/A,Yes,1.0,"Environmental and Societal, Individual",Direct Causal Link,Environmental and Societal -> Individual,Environmental and Societal: The 'World population' represents a global demographic system or trend.; Individual: The 'consuming class' refers to a large aggregation of individuals with shared economic characteristics.,[Environmental and Societal -> Individual] The rise in world population is expected to directly increase the number of individuals in the ‘consuming class’.
