Source,Full Paragraph Text,Interaction Present Disagreement,Scale Disagreement,claude3.7: Interaction Present,claude3.7: Confidence,claude3.7: Scales,claude3.7: Causal Type,claude3.7: Causal Pathway,claude3.7: Scale Explanations,claude3.7: Summary,4o: Interaction Present,4o: Confidence,4o: Scales,4o: Causal Type,4o: Causal Pathway,4o: Scale Explanations,4o: Summary,o4_mini: Interaction Present,o4_mini: Confidence,o4_mini: Scales,o4_mini: Causal Type,o4_mini: Causal Pathway,o4_mini: Scale Explanations,o4_mini: Summary,gemini2.5: Interaction Present,gemini2.5: Confidence,gemini2.5: Scales,gemini2.5: Causal Type,gemini2.5: Causal Pathway,gemini2.5: Scale Explanations,gemini2.5: Summary
Nestle_Annual_Report_2014_page_4.pdf,"We remain the only infant formula manufacturer included in FTSE’s responsible investment index, based on our performance in human rights, labour rights, responsible marketing of breast-milk substitutes and more.",Yes,N/A,No,N/A,N/A,N/A,N/A,,N/A,No,1.0,N/A,N/A,N/A,,N/A,No,0.0,N/A,N/A,N/A,,N/A,Yes,1.0,"Environmental and Societal, Organizational",Direct Causal Link,Organizational -> Environmental and Societal,"Organizational: Refers to 'We', the specific infant formula manufacturer, a single organization.; Environmental and Societal: Refers to 'FTSE’s responsible investment index', which represents a system within capital markets that evaluates and ranks companies based on societal criteria.","[Organizational -> Environmental and Societal] The manufacturer's performance in human rights, labour rights, and responsible marketing serves as the basis for its inclusion in FTSE’s responsible investment index."
Nestle_Annual_Report_2014_page_6.pdf,"The business environment was again marked by great uncertainty in 2014. Disruptive socio-economic and political change continued to affect growth in many parts of the world. In the emerging markets, economic volatility worsened as growth rates slowed and currencies weakened. In the developed markets, deflationary pressures and soft consumer demand resulted in a continued challenging trading environment. In the face of such uncertainty it was more important than ever to stay the course and remain loyal to our strategy, driving short-term performance while ensuring we made the right decisions to deliver our long-term goals. We took decisive steps to further our ambition to be the world’s recognised leading Nutrition, Health and Wellness company, trusted by all stakeholders, while again delivering financial results in 2014 that outperformed the market.",Yes,Inter-Organizational / Sector,Yes,0.9,"Environmental and Societal, Organizational",Bidirectional Link,Environmental and Societal <-> Organizational,"Environmental and Societal: Includes business environment, socio-economic and political change, economic volatility, deflationary pressures, and market conditions that create context for organizational action.; Organizational: The company ('we') that took decisive steps and delivered financial results in response to environmental conditions.","[Environmental and Societal <-> Organizational] Macro-level economic volatility and market challenges affected the company, which responded with strategic actions that outperformed the market.",No,1.0,N/A,N/A,N/A,,N/A,No,0.0,N/A,N/A,N/A,,N/A,Yes,0.9,"Environmental and Societal, Inter-Organizational / Sector, Organizational",Causal Chain,Environmental and Societal -> Organizational -> Inter-Organizational / Sector,"Environmental and Societal: Refers to macro-level conditions such as 'disruptive socio-economic and political change', 'economic volatility', 'deflationary pressures', 'soft consumer demand', and the 'challenging trading environment' which represent societal and economic systems.; Organizational: Refers to the specific company ('we') and its internal actions and strategies, such as 'staying the course', 'taking decisive steps', and 'delivering financial results'.; Inter-Organizational / Sector: Refers to 'the market' which the company 'outperformed', indicating its performance relative to or within a group of other organizations or the industry sector.","[Environmental and Societal -> Organizational -> Inter-Organizational / Sector] Facing socio-economic uncertainty and challenging market conditions, the company maintained its strategy and took decisive steps, resulting in outperforming the market."
Nestle_Annual_Report_2014_page_6.pdf,"Through continuous innovation and renovation of our food and beverages portfolio we are able to offer people healthier and tastier choices at every stage of their life, at any time of the day. Science-based innovation enables us to enhance the quality of people’s diets, using our knowledge and our research and development capability to make a positive contribution to society. Wherever you are in the world, we have safe, nutritious products to help you care for yourself and your family. A few years ago, we expanded the boundaries of Nutrition, Health and Wellness with the creation of Nestlé Health Science, motivated by the opportunity to forge a major therapeutic role for nutrition in the management of health. In line with this broadened strategy, in 2014 the Board approved the sale of 48.5 million L’Oréal shares to L’Oréal for cancellation. Part of the proceeds were used for the acquisition of the 50% stake in our joint venture Galderma from L’Oréal, bringing our ownership of Galderma to 100%. Galderma formed the foundation of a new Nestlé subsidiary, Nestlé Skin Health. Its goal is to be recognised as the leading company in skin health, offering science-based solutions to protect, nourish and enhance skin, and where needed to treat, correct and restore damaged skin over the course of people’s lives. Nestlé Skin Health provides prescription drugs, self-medication, therapeutic skin care and aesthetic and corrective medicine, allowing us to compete in the growing and promising multi-billion global skincare market. Nestlé Skin Health was further strengthened by the acquisition of the full rights to commercialise several key aesthetic dermatology products in the United States and Canada.",Yes,"Environmental and Societal, Individual, Inter-Organizational / Sector",Yes,1.0,"Individual, Organizational",Direct Causal Link,Organizational -> Individual,"Organizational: Nestlé, Nestlé Health Science, Nestlé Skin Health, and Galderma are all specific companies or subsidiaries.; Individual: The text refers to 'people', 'yourself and your family' as the beneficiaries of Nestlé's products and innovations.",[Organizational -> Individual] Nestlé's science-based innovation and portfolio expansion directly impacts individuals' health and wellness by providing nutritious products and skin health solutions across their lifespans.,Yes,1.0,"Environmental and Societal, Inter-Organizational / Sector, Organizational",Causal Chain,Organizational -> Inter-Organizational / Sector -> Environmental and Societal,"Organizational: Nestlé and its subsidiaries like Nestlé Health Science and Nestlé Skin Health are specific organizations.; Inter-Organizational / Sector: The joint venture with L’Oréal and the acquisition of Galderma involve multiple organizations.; Environmental and Societal: The focus on Nutrition, Health, and Wellness aims to make a positive contribution to society.",[Organizational -> Inter-Organizational / Sector -> Environmental and Societal] Nestlé's strategic acquisitions and innovations aim to enhance societal health and wellness through improved nutrition and skincare.,No,0.0,N/A,N/A,N/A,,N/A,Yes,1.0,"Environmental and Societal, Individual, Organizational",Mixed/Complex Pattern,"Organizational -> Individual, Organizational -> Environmental and Societal","Organizational: Nestlé, Nestlé Health Science, Nestlé Skin Health, and the Nestlé Board are specific organizations or their internal units.; Individual: References to 'people' and 'people’s lives' represent specific individuals or consumers affected by Nestlé's actions.; Environmental and Societal: 'Society' and the 'global skincare market' are broad societal systems or capital markets influenced by the company's activities.","[Organizational -> Individual, Organizational -> Environmental and Societal] Nestlé's continuous innovation and strategic business developments lead to healthier choices for individuals and enable competition in the global market, contributing to society."
Nestle_Annual_Report_2014_page_6.pdf,"These developments ensure that, building on the strong foundations of our food and beverages business and guided increasingly by science, we can further expand our portfolio to provide promising platforms for future growth in line with our strategy of Nutrition, Health and Wellness. At the same time, we continue the drive to ensure our company is organised efficiently and effectively to deliver continuous profitable growth over the long term. With this objective in mind we made some key decisions, adapting our organisational structure to better prepare ourselves today to meet the challenges of tomorrow.",Yes,N/A,No,1.0,N/A,N/A,N/A,,N/A,No,1.0,N/A,N/A,N/A,,N/A,No,0.0,N/A,N/A,N/A,,N/A,Yes,1.0,"Environmental and Societal, Organizational",Direct Causal Link,Environmental and Societal -> Organizational,"Organizational: Refers to 'our company' and its internal 'organisational structure', 'key decisions', and 'food and beverages business'.; Environmental and Societal: Refers to 'challenges of tomorrow', representing future external conditions or systems that influence the company.",[Environmental and Societal -> Organizational] The company adapts its organizational structure to prepare for the challenges of tomorrow.
Nestle_Annual_Report_2014_page_6.pdf,"While our company continues to benefit from its decentralised structure, allowing key decisions to be made as close as possible to consumers, there is still an important opportunity to better leverage our scale. That is why in 2014 we set up Nestlé Business Excellence at Executive Board Level, combining GLOBE (Nestlé’s Global Business Excellence function) with Nestlé Business Services (our shared operation for transactional services around the world) and Nestlé Con tinuous Excellence (our continuous improvement and LEAN programme). Through a focus on three areas: Simplifying, Standardising and Sharing, Nestlé Business Excellence will allow us to decrease structural costs and operational expenses, freeing up resources to support growth. This will also allow our markets to keep a sharp focus on generating demand.",Yes,"Individual, Inter-Organizational / Sector",No,1.0,N/A,N/A,N/A,,N/A,Yes,1.0,"Inter-Organizational / Sector, Organizational",Direct Causal Link,Organizational -> Inter-Organizational / Sector,"Organizational: Nestlé and its internal units like GLOBE and Nestlé Business Services are part of a single organization.; Inter-Organizational / Sector: The text refers to leveraging scale and shared operations across global services, indicating a sector-level interaction.",[Organizational -> Inter-Organizational / Sector] Nestlé's organizational changes aim to leverage scale for cost reduction and resource optimization.,No,0.0,N/A,N/A,N/A,,N/A,Yes,1.0,"Individual, Organizational",Direct Causal Link,Organizational -> Individual,"Organizational: Refers to 'our company' (Nestlé) and its internal units or functions such as 'Nestlé Business Excellence' and 'markets'.; Individual: Refers to 'consumers', who are specific individuals interacting with the company.",[Organizational -> Individual] A company's decentralized structure allows key decisions to be made closer to consumers.
Nestle_Annual_Report_2014_page_6.pdf,"We have integrated the Maghreb, the Middle East, the North East Africa region, Turkey and Israel into Zone Europe to form Zone EMENA (Europe, Middle East and North Africa). This balances the different consumer dynamics and opportunities in each geography. Additionally it allows a sharper focus in Zone Asia, Oceania and Africa, a fast-growing part",Yes,N/A,No,1.0,N/A,N/A,N/A,,N/A,No,1.0,N/A,N/A,N/A,,N/A,No,0.0,N/A,N/A,N/A,,N/A,Yes,1.0,"Environmental and Societal, Organizational",Direct Causal Link,Organizational -> Environmental and Societal,"Organizational: The pronoun 'We' refers to a single organization undertaking an internal restructuring (integrating regions into new zones like EMENA and refining focus in other zones).; Environmental and Societal: 'Consumer dynamics and opportunities' refer to societal-level market conditions and behaviors within different geographies, which the organization's actions aim to balance.","[Organizational -> Environmental and Societal] An organization's internal restructuring, forming new zones, aims to balance regional consumer dynamics and opportunities."
Nestle_Annual_Report_2014_page_8.pdf,"We also announced new investments and research collaborations, which will enhance our ability to deliver sci ence-based solutions to improve the quality of people’s lives. A newly-announced research partnership with the EpiGen consortium will help us to better develop our understanding of the influence of nutrition and genetics at the beginning of life and continue to build our knowledge in this important area. The Nestlé Institute of Health Sciences began a collab oration on a groundbreaking project, which could one day lead to the development of made-to-measure vitamin com binations tailored to individual needs. Our company was founded almost 150 years ago on the product Henri Nestlé invented, farine lactée. It saved the life of a child. Today we continue to invest in science-based innovation to ensure we can answer current and future needs.",Yes,"Environmental and Societal, Inter-Organizational / Sector",No,N/A,N/A,N/A,N/A,,N/A,Yes,1.0,"Individual, Inter-Organizational / Sector, Organizational",Causal Chain,Organizational -> Inter-Organizational / Sector -> Individual,Organizational: Nestlé and the Nestlé Institute of Health Sciences are specific organizations.; Inter-Organizational / Sector: The EpiGen consortium represents a group of organizations.; Individual: The focus on tailored vitamin combinations and improving the quality of people's lives pertains to individuals.,[Organizational -> Inter-Organizational / Sector -> Individual] Nestlé's collaborations with EpiGen aim to develop personalized nutrition solutions for individuals.,Yes,0.9,"Environmental and Societal, Individual, Organizational",Causal Chain,Organizational -> Environmental and Societal -> Individual,Organizational: The text discusses Nestlé as a company and its research collaborations.; Environmental and Societal: The focus on improving the quality of people's lives indicates a societal impact.; Individual: The mention of tailored vitamin combinations suggests a direct impact on individual health.,[Organizational -> Environmental and Societal -> Individual] Nestlé's research partnerships aim to enhance health solutions that improve individual quality of life.,Yes,1.0,"Individual, Organizational",Causal Chain,Organizational -> Organizational -> Individual,Organizational: Refers to 'We' (the company) making investments and developing science-based solutions.; Individual: Refers to 'people' whose lives are directly improved by the solutions delivered.,"[Organizational -> Organizational -> Individual] Company investments and collaborations enhance its ability to deliver solutions, which improve the quality of people’s lives."
Nestle_Annual_Report_2014_page_8.pdf,"It is our fundamental belief that to be successful over time we need to create value for our shareholders while at the same time creating value for society. We call this Creating Shared Value. To prosper we have to take a long-term view, framed in a robust set of principles and values that are based on respect: respect for people, respect for the environment, and respect for the world we live in. What we do and the effects of what we do are highly visible. It is our responsibility to connect with different stakeholders, to show transparency and build trust. We have therefore again in 2014 reported on our social performance and our compliance in our Nestlé in society report, and our progress towards meeting the tough targets we set ourselves.",Yes,N/A,No,0.9,N/A,N/A,N/A,,N/A,No,1.0,N/A,N/A,N/A,,N/A,No,0.0,N/A,N/A,N/A,,N/A,Yes,1.0,"Environmental and Societal, Individual, Organizational",Mixed/Complex Pattern,Organizational -> Individual and Organizational -> Environmental and Societal,"Organizational: The entity 'we' refers to Nestlé, a single organization, describing its values, strategy, actions, and reporting on social performance.; Individual: 'Shareholders' are specific individuals or an informal group for whom the organization explicitly aims to create value.; Environmental and Societal: 'Society', 'environment', and 'stakeholders' represent societal-level systems, natural systems, and broader communities with which the organization interacts and aims to create value or build trust.","[Organizational -> Individual, Environmental and Societal] Nestlé's organizational strategy creates shared value by aiming to benefit shareholders and society through respect and stakeholder engagement."
Nestle_Annual_Report_2014_page_8.pdf,"In 2014 we held another successful Creating Shared Value forum, this time at the Nestlé Research Center in Lausanne, co-organised for the first time with a United Nations body, the UN Conference on Trade and Development (UNCTAD). The President of the Swiss Confederation used his address to the event to plead for water to become a self-standing goal of the future global development agenda. At the event we renewed our long-standing partnership with the International Federation of Red Cross and Red Crescent Societies. Since 2006 this collaboration has focused on the improvement of rural communities’ access to clean water and sanitation.",No,"Inter-Organizational / Sector, Organizational",Yes,0.9,"Environmental and Societal, Organizational",Direct Causal Link,Organizational -> Environmental and Societal,Organizational: Nestlé and the International Federation of Red Cross and Red Crescent Societies are formal organizations with defined structures.; Environmental and Societal: Rural communities represent societal groups at a macro level.,[Organizational -> Environmental and Societal] Nestlé's partnership with the Red Cross focuses on improving rural communities' access to clean water and sanitation.,Yes,1.0,"Environmental and Societal, Organizational",Direct Causal Link,Organizational -> Environmental and Societal,Organizational: Nestlé and the International Federation of Red Cross and Red Crescent Societies are organizations.; Environmental and Societal: The global development agenda and rural communities' access to clean water and sanitation are societal-level concerns.,[Organizational -> Environmental and Societal] Nestlé's partnership with the Red Cross aims to improve rural communities' access to clean water and sanitation.,Yes,0.9,"Environmental and Societal, Organizational",Convergent Influence,Organizational -> Environmental and Societal,"Organizational: The event was co-organized by Nestlé and UNCTAD, both of which are organizations.; Environmental and Societal: The focus of the event and partnership is on global development goals related to water access and sanitation, impacting societal systems.",[Organizational -> Environmental and Societal] The partnership between Nestlé and UNCTAD aims to enhance global access to clean water and sanitation.,Yes,1.0,"Environmental and Societal, Inter-Organizational / Sector",Direct Causal Link,Inter-Organizational / Sector -> Environmental and Societal,Inter-Organizational / Sector: The 'long-standing partnership' and 'collaboration' between Nestlé (an Organizational entity) and the International Federation of Red Cross and Red Crescent Societies (another Organizational entity) explicitly describes a group of organizations working together towards a common goal.; Environmental and Societal: 'rural communities’ access to clean water and sanitation' directly refers to the well-being and systems impacting 'communities' which is explicitly part of this scale.,[Inter-Organizational / Sector -> Environmental and Societal] A collaboration between organizations focused on improving rural communities' access to clean water and sanitation.
Nestle_Annual_Report_2014_page_8.pdf,"Currently, at the United Nations there are intense discussions about the global development goals for the period after 2015. At the same time, governments and international organ isations are increasingly reliant on the expertise, experience and resources of the private sector to help address some of the world’s most pressing problems. This offers an opportunity for global companies such as Nestlé to make a valu able contribution, in partnership with governments and civil society. We are participating actively in the policy dialogue in areas which will deeply influence our future business, such as food security, nutrition and health, water, sustainability, and human rights.",No,Inter-Organizational / Sector,Yes,0.9,"Environmental and Societal, Inter-Organizational / Sector, Organizational",Bidirectional Link,Environmental and Societal <-> Inter-Organizational / Sector,Organizational: United Nations as a single body and Nestlé as a specific company; Inter-Organizational / Sector: Private sector and international organizations representing multiple organizations working together; Environmental and Societal: Governments and civil society representing macro-level societal structures,[Environmental and Societal <-> Inter-Organizational / Sector] Governments rely on private sector expertise while companies like Nestlé participate in policy dialogues that will influence their future business.,Yes,1.0,"Environmental and Societal, Organizational",Convergent Influence,"[Organizational, Environmental and Societal] -> Environmental and Societal","Organizational: Global companies like Nestlé are mentioned as actors.; Environmental and Societal: Governments, international organizations, and global development goals are mentioned.","[Organizational, Environmental and Societal] -> Environmental and Societal] Global companies and international bodies collaborate to address global issues like food security and sustainability.",Yes,0.9,"Environmental and Societal, Inter-Organizational / Sector, Organizational",Convergent Influence,"Organizational, Inter-Organizational / Sector -> Environmental and Societal","Organizational: The United Nations and Nestlé are specific organizations involved in discussions and policy dialogues.; Inter-Organizational / Sector: Governments and international organizations are collaborating with the private sector, indicating a group of organizations working together.; Environmental and Societal: The discussions focus on global development goals that address societal issues like food security and human rights.","[Organizational, Inter-Organizational / Sector -> Environmental and Societal] The UN and private sector collaboration aims to address global development goals impacting society.",Yes,1.0,"Environmental and Societal, Inter-Organizational / Sector, Organizational",Feedback Loop,Organizational -> Environmental and Societal -> Organizational,"Organizational: Includes specific entities like 'United Nations' and 'global companies such as Nestlé', and their internal operations ('future business').; Inter-Organizational / Sector: Refers to 'the private sector' as a collective grouping of organizations.; Environmental and Societal: Encompasses 'governments', 'international organisations' (acting broadly), 'civil society', 'global development goals', and societal issues like 'food security, nutrition and health, water, sustainability, and human rights'.",[Organizational -> Environmental and Societal -> Organizational] Global companies participating in policy dialogue on societal issues will deeply influence their future business.
Nestle_Annual_Report_2014_page_9.pdf,"We would like to thank our 339000 employees, whose com mitment to Nestlé, hard work and disciplined alignment behind our strategy ensured that we achieved our common goals. Their talent, their creativity, their discipline and entrepreneurship are key to delivering our results. We would also like to thank you, our shareholders, for your investment and your confidence, which have enabled us to deliver good returns for investors over the long term.",Yes,Environmental and Societal,Yes,1.0,"Individual, Organizational",Direct Causal Link,Individual -> Organizational,"Individual: The 339,000 employees are individual workers whose collective actions are being acknowledged.; Organizational: Nestlé is clearly identified as the organization that benefits from the employees' actions.","[Individual -> Organizational] Nestlé employees' commitment, hard work, and disciplined alignment with company strategy directly enabled the organization to achieve its goals and deliver good returns for investors.",No,1.0,N/A,N/A,N/A,,N/A,No,0.0,N/A,N/A,N/A,,N/A,Yes,1.0,"Environmental and Societal, Individual, Organizational",Convergent Influence,"[Individual, Environmental and Societal] -> Organizational","Individual: The '339000 employees' are specific individuals whose actions are described.; Organizational: 'Nestlé' (implied by 'we', 'our common goals', 'our results') is a single company achieving its goals and delivering results.; Environmental and Societal: 'Shareholders' and 'investors' represent the capital markets, providing investment and confidence.","[Individual, Environmental and Societal] -> Organizational] The commitment and talent of employees, along with the investment and confidence of shareholders, collectively enable Nestlé to achieve its goals and deliver results."
