Source,Full Paragraph Text,Interaction Present Disagreement,Scale Disagreement,claude3.7: Interaction Present,claude3.7: Confidence,claude3.7: Scales,claude3.7: Causal Type,claude3.7: Causal Pathway,claude3.7: Scale Explanations,claude3.7: Summary,4o: Interaction Present,4o: Confidence,4o: Scales,4o: Causal Type,4o: Causal Pathway,4o: Scale Explanations,4o: Summary,o4_mini: Interaction Present,o4_mini: Confidence,o4_mini: Scales,o4_mini: Causal Type,o4_mini: Causal Pathway,o4_mini: Scale Explanations,o4_mini: Summary,gemini2.5: Interaction Present,gemini2.5: Confidence,gemini2.5: Scales,gemini2.5: Causal Type,gemini2.5: Causal Pathway,gemini2.5: Scale Explanations,gemini2.5: Summary
Unilever_Annual_Report_and_Accounts_2014_Strategic_Report_page_26.pdf,"In February 2014 we signed a five-year partnership with the International Fund for Agricultural Development (IFAD) to improve the livelihoods of smallholder farmers. Signed by IFAD President Kanayo F Nwanze and our CEO, Paul Polman, the partnership aims to help improve food security, by raising agricultural productivity and linking farmers to markets.",No,"Environmental and Societal, Individual, Inter-Organizational / Sector",Yes,1.0,"Individual, Organizational",Convergent Influence,"[Organizational, Organizational] -> Individual","Organizational: Unilever and IFAD are both formal organizations, with Unilever being a company and IFAD being an international fund/agency.; Individual: Smallholder farmers are individuals or informal household groups who are the target beneficiaries of the partnership.","[[Organizational, Organizational] -> Individual] Unilever and IFAD formed a partnership explicitly aimed at improving the livelihoods of smallholder farmers through increased productivity and market access.",Yes,1.0,"Individual, Inter-Organizational / Sector, Organizational",Causal Chain,Inter-Organizational / Sector -> Organizational -> Individual,Organizational: The partnership involves specific organizations: IFAD and the company led by CEO Paul Polman.; Inter-Organizational / Sector: The partnership itself represents a collaboration between multiple organizations.; Individual: The smallholder farmers are individuals whose livelihoods are targeted for improvement.,[Inter-Organizational / Sector -> Organizational -> Individual] A partnership between organizations aims to improve smallholder farmers' livelihoods by enhancing productivity and market access.,Yes,1.0,"Environmental and Societal, Organizational",Direct Causal Link,Organizational -> Environmental and Societal,"Organizational: IFAD and the organization represented by CEO Paul Polman are both formal entities involved in the partnership.; Environmental and Societal: The partnership aims to improve food security and livelihoods, which are societal-level outcomes.",[Organizational -> Environmental and Societal] The partnership between IFAD and our organization aims to enhance food security for smallholder farmers.,Yes,1.0,"Environmental and Societal, Individual, Inter-Organizational / Sector, Organizational",Mixed/Complex Pattern,"[Organizational, Organizational] -> Inter-Organizational -> [Individual, Environmental and Societal, Inter-Organizational / Sector]","Individual: Smallholder farmers are specific individuals or informal groups targeted by the partnership.; Organizational: The company ('we') and the International Fund for Agricultural Development (IFAD) are single organizations.; Inter-Organizational / Sector: The 'partnership' is an agreement between two organizations, and 'markets' represent a system where multiple organizations interact.; Environmental and Societal: 'Food security' and 'agricultural productivity' are societal-level systems or outcomes.","[Organizational, Organizational] -> Inter-Organizational -> [Individual, Environmental and Societal, Inter-Organizational / Sector] A partnership between organizations aims to improve individual livelihoods, food security, and market linkages."
Unilever_Annual_Report_and_Accounts_2014_Strategic_Report_page_26.pdf,"In January 2014, we signed a partnership with our supplier, Symrise, and overseas development agency GIZ to source vanilla from Madagascar. The programme is set to benefit 4,000 farmers in 32 villages.",No,"Environmental and Societal, Organizational",Yes,1.0,"Individual, Inter-Organizational / Sector",Direct Causal Link,Inter-Organizational / Sector -> Individual,"Inter-Organizational / Sector: The partnership between multiple organizations (unnamed company, Symrise, and GIZ) constitutes an inter-organizational collaboration.; Individual: The 4,000 farmers who will benefit from the program represent individuals.","[Inter-Organizational / Sector -> Individual] A partnership between multiple organizations (company, Symrise, and GIZ) is set to benefit 4,000 individual farmers in Madagascar.",Yes,1.0,"Individual, Inter-Organizational / Sector, Organizational",Causal Chain,Inter-Organizational / Sector -> Organizational -> Individual,"Organizational: The company and its supplier, Symrise, are specific organizations.; Inter-Organizational / Sector: The partnership with GIZ, an overseas development agency, represents a collaboration across organizations.; Individual: The 4,000 farmers in 32 villages are specific individuals.","[Inter-Organizational / Sector -> Organizational -> Individual] A partnership between organizations aims to benefit 4,000 farmers in Madagascar.",Yes,1.0,"Environmental and Societal, Individual, Inter-Organizational / Sector, Organizational",Causal Chain,Organizational -> Inter-Organizational / Sector -> Individual -> Environmental and Societal,Organizational: The company signed a partnership with Symrise and GIZ.; Inter-Organizational / Sector: The partnership involves multiple organizations (supplier and development agency).; Individual: The farmers are specific individuals benefiting from the program.; Environmental and Societal: The program aims to impact the societal level by benefiting farmers in villages.,[Organizational -> Inter-Organizational / Sector -> Individual -> Environmental and Societal] A partnership aims to benefit farmers through sustainable vanilla sourcing.,Yes,1.0,"Individual, Inter-Organizational / Sector, Organizational",Causal Chain,Organizational -> Inter-Organizational / Sector -> Individual,"Organizational: 'we', 'Symrise', and 'GIZ' are specific single organizations initiating the partnership.; Inter-Organizational / Sector: The 'partnership' or 'programme' is a collaboration among multiple organizations, aligning with the definition of a group of organizations.; Individual: '4,000 farmers' are specific individuals who are the direct beneficiaries of the programme.","[Organizational -> Inter-Organizational / Sector -> Individual] Specific organizations signing a partnership created a programme set to benefit 4,000 farmers."
Unilever_Annual_Report_and_Accounts_2014_Strategic_Report_page_26.pdf,"In 2014 we published our Responsible Sourcing Policy (RSP). The RSP embodies our commitment to conduct business with integrity, openness, and respect for universal human rights and core labour principles. The RSP breaks new ground by defining a ‘continuous improvement ladder’ to help our suppliers move from a base level of ‘do no harm’ to ‘good practice’ and ultimately up to ‘best practice’ and as such is intended progressively to replace our Supplier Code in our dealings with key suppliers. The new code has been introduced to the supply base through communications and engagement from Procurement, and also through targeted events in critical markets such as Brazil, China and Vietnam.",No,Environmental and Societal,Yes,1.0,"Environmental and Societal, Inter-Organizational / Sector, Organizational",Direct Causal Link,Organizational -> Inter-Organizational / Sector,"Organizational: The company ('we') that published the RSP and its Procurement department; Inter-Organizational / Sector: The suppliers and supply base that are being influenced by the RSP; Environmental and Societal: Critical markets (Brazil, China, Vietnam) where targeted events are being held",[Organizational -> Inter-Organizational / Sector] A company's Responsible Sourcing Policy establishes a 'continuous improvement ladder' to influence supplier behavior and practices across its supply base.,Yes,1.0,"Inter-Organizational / Sector, Organizational",Direct Causal Link,Organizational -> Inter-Organizational / Sector,Organizational: The company publishing the Responsible Sourcing Policy and engaging with suppliers.; Inter-Organizational / Sector: The supply base and key suppliers affected by the new policy.,[Organizational -> Inter-Organizational / Sector] The company's Responsible Sourcing Policy influences suppliers to adopt better practices.,Yes,0.9,"Environmental and Societal, Inter-Organizational / Sector, Organizational",Causal Chain,Organizational -> Inter-Organizational / Sector -> Environmental and Societal,"Organizational: The company is implementing its Responsible Sourcing Policy (RSP) as part of its internal operations.; Inter-Organizational / Sector: The RSP affects suppliers, indicating interactions between the company and its supply chain.; Environmental and Societal: The RSP emphasizes human rights and labor principles, impacting societal norms and practices.",[Organizational -> Inter-Organizational / Sector -> Environmental and Societal] The company's Responsible Sourcing Policy influences suppliers and promotes societal labor standards.,Yes,1.0,"Inter-Organizational / Sector, Organizational",Direct Causal Link,Organizational -> Inter-Organizational / Sector,"Organizational: The entity that published the Responsible Sourcing Policy (RSP) and its internal 'Procurement' unit represent a single organization.; Inter-Organizational / Sector: The 'supply base' and 'our suppliers' refer to a group of organizations forming a supply chain, falling under groups of organizations.",[Organizational -> Inter-Organizational / Sector] A company's Procurement department introduces a new sourcing policy to its supply base.
Unilever_Annual_Report_and_Accounts_2014_Strategic_Report_page_26.pdf,"Unilever is one of the world’s biggest tea suppliers with brands such as Lipton, PG tips and Brooke Bond. We are helping to safeguard the world’s tea supply through an R&D programme to cultivate sustainable varieties.",Yes,None,Yes,0.9,"Environmental and Societal, Organizational",Direct Causal Link,Organizational -> Environmental and Societal,Organizational: Unilever is a single company with multiple brands.; Environmental and Societal: The 'world's tea supply' represents a global agricultural resource system.,[Organizational -> Environmental and Societal] Unilever's R&D programme to cultivate sustainable tea varieties is helping to safeguard the world's tea supply.,No,1.0,N/A,N/A,N/A,,N/A,No,0.0,N/A,N/A,N/A,,N/A,Yes,1.0,"Environmental and Societal, Organizational",Direct Causal Link,Organizational -> Environmental and Societal,Organizational: Unilever is identified as a single organization undertaking an R&D program.; Environmental and Societal: The 'world’s tea supply' refers to a global resource system that Unilever aims to safeguard.,[Organizational -> Environmental and Societal] Unilever's R&D program cultivates sustainable tea varieties to safeguard the world's tea supply.
Unilever_Annual_Report_and_Accounts_2014_Strategic_Report_page_26.pdf,"Our partnership with Nature Source Genetics uses plant breeding to meet global demand while supporting communities that rely on the crop for income. The aim is to enhance productivity, quality and overall sustainability, and help stem any decline in crop diversity that could limit its ability to withstand drought, disease and pests.",Yes,None,No,N/A,N/A,N/A,N/A,,N/A,Yes,1.0,"Environmental and Societal, Inter-Organizational / Sector",Direct Causal Link,Inter-Organizational / Sector -> Environmental and Societal,"Inter-Organizational / Sector: The partnership between organizations is an inter-organizational collaboration.; Environmental and Societal: The focus on global demand, community support, and sustainability pertains to societal-level systems.","[Inter-Organizational / Sector -> Environmental and Societal] A partnership aims to enhance crop sustainability and support communities, impacting global demand and environmental resilience.",Yes,0.8,"Environmental and Societal, Inter-Organizational / Sector",Convergent Influence,Inter-Organizational / Sector -> Environmental and Societal,Inter-Organizational / Sector: The partnership with Nature Source Genetics involves multiple organizations working together.; Environmental and Societal: The focus on crop diversity and sustainability impacts societal systems and environmental health.,"[Inter-Organizational / Sector -> Environmental and Societal] The partnership enhances crop sustainability, benefiting communities and the environment.",Yes,1.0,"Environmental and Societal, Inter-Organizational / Sector",Direct Causal Link,Inter-Organizational / Sector -> Environmental and Societal,"Inter-Organizational / Sector: The phrase 'Our partnership with Nature Source Genetics' explicitly refers to a collaboration between two distinct entities, classifying it as inter-organizational.; Environmental and Societal: The text mentions 'global demand', 'communities that rely on the crop for income', 'crop diversity', 'drought, disease and pests', which all represent broad societal or natural systems.","[Inter-Organizational / Sector -> Environmental and Societal] A partnership uses plant breeding to meet global demand, support communities, and stem crop diversity decline."
Unilever_Annual_Report_and_Accounts_2014_Strategic_Report_page_27.pdf,"In his first Independence Day address in 2014, Narendra Modi, India’s new Prime Minister, made a commitment that by 2019 every Indian would have access to a toilet. The promise highlights that about 2.5 billion people globally are without access to adequate sanitation, good hygiene and safe drinking water. There are still 46 countries in the world where less than half the population has access to adequate sanitation facilities. 800,000 children die every year from diarrhoea caused by unsafe water, and poor sanitation and hygiene.",Yes,N/A,No,N/A,N/A,N/A,N/A,,N/A,No,1.0,N/A,N/A,N/A,,N/A,No,0.0,N/A,N/A,N/A,,N/A,Yes,1.0,"Environmental and Societal, Individual",Direct Causal Link,Environmental and Societal -> Individual,"Environmental and Societal: Unsafe water, poor sanitation, and hygiene are described as conditions at the broader societal and environmental level.; Individual: Children are specific individuals whose deaths are directly attributed to the societal/environmental conditions.","[Environmental and Societal -> Individual] Unsafe water, poor sanitation, and hygiene cause the deaths of 800,000 children every year."
Unilever_Annual_Report_and_Accounts_2014_Strategic_Report_page_27.pdf,"Transformational change is needed to combat these issues. Unilever is uniquely placed to help because of our expertise in consumer behaviour change, our global reach and our portfolio of health and hygiene brands, including Domestos, Lifebuoy and Pureit, our water purifier. However, bringing about widespread, sustainable behaviour change is not something we can do alone, so we need to work closely with governments, NGOs, academia and funding partners to increase our reach and impact.",No,Inter-Organizational,Yes,0.9,"Environmental and Societal, Inter-Organizational, Organizational",Bidirectional Link,Organizational <-> Inter-Organizational/Environmental and Societal,"Organizational: Unilever is identified as a single company with its brands (Domestos, Lifebuoy, Pureit); Inter-Organizational: Academia and funding partners represent collaborations across multiple organizations; Environmental and Societal: Governments represent macro-level societal structures","[Organizational <-> Inter-Organizational/Environmental and Societal] Unilever must collaborate with governments, NGOs, academia and funding partners to achieve widespread behavior change that neither could accomplish alone.",Yes,1.0,"Environmental and Societal, Organizational",Convergent Influence,"[Organizational, Environmental and Societal] -> Environmental and Societal","Organizational: Unilever is a single organization with expertise in consumer behaviour change.; Environmental and Societal: Governments, NGOs, academia, and funding partners represent societal-level systems.","[Organizational, Environmental and Societal] -> Environmental and Societal] Unilever collaborates with societal systems to enhance sustainable behaviour change impact.",Yes,0.8,"Environmental and Societal, Organizational",Convergent Influence,"Organizational, Environmental and Societal -> Environmental and Societal","Organizational: Unilever is a specific organization mentioned in the text.; Environmental and Societal: Governments, NGOs, and academia represent societal-level systems.","[Organizational, Environmental and Societal -> Environmental and Societal] Unilever collaborates with various entities to drive sustainable behavior change.",Yes,1.0,"Environmental and Societal, Organizational",Convergent Influence,"[Organizational, Environmental and Societal] -> Environmental and Societal","Organizational: Unilever is identified as a single company, which falls under the Organizational scale.; Environmental and Societal: Governments are societal-level systems. The goal of 'widespread, sustainable behaviour change' is a societal-level outcome, impacting communities and natural systems broadly.","[Organizational, Environmental and Societal] Unilever and governments must work together to bring about widespread, sustainable behaviour change."
Unilever_Annual_Report_and_Accounts_2014_Strategic_Report_page_27.pdf,"In 2014 we committed to help 25 million people gain improved access to a toilet by 2020. By helping people who don’t have a toilet to get one and by promoting the benefits of using a clean toilet, we will open new markets and drive demand for our products.",Yes,"Environmental and Societal, Inter-Organizational / Sector",Yes,1.0,"Individual, Inter-Organizational / Sector, Organizational",Causal Chain,Organizational -> Individual -> Inter-Organizational / Sector,Organizational: The 'we' refers to a single company making commitments and taking action.; Individual: The '25 million people' who will gain improved access to toilets.; Inter-Organizational / Sector: The 'new markets' that will be opened as a result of the initiative.,[Organizational -> Individual -> Inter-Organizational / Sector] A company's initiative to provide toilet access to individuals will subsequently create new markets and drive product demand.,Yes,1.0,"Individual, Organizational",Direct Causal Link,Organizational -> Individual,Individual: Refers to the 25 million people gaining access to toilets.; Organizational: Refers to the entity committing to help people gain access to toilets and promoting benefits.,"[Organizational -> Individual] An organization's commitment helps individuals gain access to toilets, opening new markets.",No,0.0,N/A,N/A,N/A,,N/A,Yes,1.0,"Environmental and Societal, Individual, Organizational",Feedback Loop,Organizational -> Individual -> Environmental and Societal -> Organizational,Organizational: 'we' refers to a single organization making commitments and driving product demand for its own benefit.; Individual: '25 million people' and 'people who don’t have a toilet' represent specific individuals.; Environmental and Societal: 'new markets' refers to a societal-level economic system influenced by changes in individual behavior and demand.,"[Organizational -> Individual -> Environmental and Societal -> Organizational] An organization's aid to individuals creates new markets, driving demand and benefiting the organization."
Unilever_Annual_Report_and_Accounts_2014_Strategic_Report_page_27.pdf,"Lifebuoy has long championed the health benefits of handwashing with soap and aims to change the hygiene behaviour of 1 billion consumers across Asia, Africa and Latin America. To achieve this ambition, we have to find ways to scale up our programmes: we need to develop lower cost, mass-scale behaviour change approaches and expand our partnerships and co-investment models. Lifebuoy has enjoyed four years of sequential double-digit sales growth.",Yes,Inter-Organizational / Sector,Yes,0.9,"Individual, Organizational",Direct Causal Link,Organizational -> Individual,"Organizational: Lifebuoy is a brand/company that is implementing programs and strategies.; Individual: Consumers across Asia, Africa and Latin America whose hygiene behavior Lifebuoy aims to change.","[Organizational -> Individual] Lifebuoy, as an organization, is implementing programs specifically designed to change the hygiene behavior of one billion individual consumers across multiple continents.",No,1.0,N/A,N/A,N/A,,N/A,No,0.0,N/A,N/A,N/A,,N/A,Yes,1.0,"Individual, Inter-Organizational / Sector, Organizational",Causal Chain,Organizational -> Inter-Organizational / Sector -> Individual,"Organizational: Lifebuoy is identified as a single company that initiates actions and strategies.; Inter-Organizational / Sector: Lifebuoy's 'partnerships and co-investment models' represent collaborative groups or alliances of organizations formed to scale efforts.; Individual: Consumers across Asia, Africa, and Latin America are specific individuals whose hygiene behavior Lifebuoy aims to influence.",[Organizational -> Inter-Organizational / Sector -> Individual] Lifebuoy's strategic expansion of partnerships and co-investment models is designed to scale its programs and change the hygiene behavior of 1 billion consumers.
Unilever_Annual_Report_and_Accounts_2014_Strategic_Report_page_27.pdf,Women are the majority of our consumer base and their purchasing decisions are pivotal to our growth. They are strongly represented in our agricultural supply chains and in the distribution of our brands to market. At the same time we are a large employer and need the best available talent to succeed in our business goals.,Yes,None,Yes,0.9,"Individual, Organizational",Direct Causal Link,Individual -> Organizational,Individual: Women as consumers making purchasing decisions and as workers in supply chains; Organizational: The company ('we'/'our') that employs people and has business goals,"[Individual -> Organizational] Women's purchasing decisions as consumers directly impact the company's growth, establishing a clear causal influence from individual-scale actions to organizational outcomes.",No,1.0,N/A,N/A,N/A,,N/A,No,0.0,N/A,N/A,N/A,,N/A,Yes,1.0,"Individual, Organizational",Direct Causal Link,Individual -> Organizational,"Individual: Refers to 'women' as consumers making 'purchasing decisions' and 'best available talent' as individuals sought for employment.; Organizational: Refers to 'our growth' and 'our business goals' as outcomes for 'we' (the company), which is a single organization.",[Individual -> Organizational] Individual purchasing decisions and the availability of talent both directly influence the organization's growth and business goals.
Unilever_Annual_Report_and_Accounts_2014_Strategic_Report_page_27.pdf,"Our approach starts with respect for the rights of women, such as safety, and extends to their promotion as well as helping to develop skills and open opportunities, both in our own operations, where 43% of managers are women, and in our value chain.",Yes,N/A,No,N/A,N/A,N/A,N/A,,N/A,No,1.0,N/A,N/A,N/A,,N/A,No,0.0,N/A,N/A,N/A,,N/A,Yes,1.0,"Individual, Inter-Organizational / Sector, Organizational",Direct Causal Link,Organizational -> Individual,"Organizational: The phrase 'Our approach' refers to the company's policies and actions, and 'our own operations' falls under this scale.; Individual: Specific 'women' and 'managers' are targeted beneficiaries of the approach, representing specific individuals.; Inter-Organizational / Sector: 'Our value chain' represents a network of organizations beyond the single company, fitting this definition, though it acts as a context rather than a direct causal agent in the primary interaction described.",[Organizational -> Individual] An organizational approach directly helps develop skills and open opportunities for women within its operations and value chain.
