Source,Full Paragraph Text,Interaction Present Disagreement,Scale Disagreement,claude3.7: Interaction Present,claude3.7: Confidence,claude3.7: Scales,claude3.7: Causal Type,claude3.7: Causal Pathway,claude3.7: Scale Explanations,claude3.7: Summary,4o: Interaction Present,4o: Confidence,4o: Scales,4o: Causal Type,4o: Causal Pathway,4o: Scale Explanations,4o: Summary,o4_mini: Interaction Present,o4_mini: Confidence,o4_mini: Scales,o4_mini: Causal Type,o4_mini: Causal Pathway,o4_mini: Scale Explanations,o4_mini: Summary,gemini2.5: Interaction Present,gemini2.5: Confidence,gemini2.5: Scales,gemini2.5: Causal Type,gemini2.5: Causal Pathway,gemini2.5: Scale Explanations,gemini2.5: Summary
Nestle_Annual_Report_2014_page_33.pdf,"In 2014, we transformed a dairy factory in Mexico into the company’s first ‘zero water’ manufacturing site in the world. Cow’s milk is 88% water, so by extracting some of it to use in the factory’s systems, we are saving enough water to meet the average daily consumption of 6400 people in the surrounding area.",No,None,Yes,1.0,"Environmental and Societal, Organizational",Direct Causal Link,Organizational -> Environmental and Societal,Organizational: The company ('we') that owns and transformed the dairy factory in Mexico.; Environmental and Societal: The surrounding area with 6400 people whose water consumption is affected by the company's actions.,[Organizational -> Environmental and Societal] A company's water extraction technology in its dairy factory directly benefits the surrounding community by saving water equivalent to 6400 people's daily consumption.,Yes,1.0,"Environmental and Societal, Organizational",Direct Causal Link,Organizational -> Environmental and Societal,"Organizational: The dairy factory is part of a company, which is an organization.; Environmental and Societal: The water savings impact the surrounding area's water consumption, which is a societal-level system.",[Organizational -> Environmental and Societal] The factory's water-saving measures reduce water consumption for 6400 people in the surrounding area.,Yes,1.0,"Environmental and Societal, Organizational",Direct Causal Link,Organizational -> Environmental and Societal,Organizational: The dairy factory represents a specific organization implementing a zero water manufacturing process.; Environmental and Societal: The surrounding area's water consumption reflects societal-level systems impacted by the factory's water-saving measures.,[Organizational -> Environmental and Societal] The dairy factory's zero water initiative saves enough water for 6400 people daily in the surrounding area.,Yes,1.0,"Environmental and Societal, Organizational",Direct Causal Link,Organizational -> Environmental and Societal,"Organizational: 'we' refers to the company transforming its factory, which is a single organization operating internally.; Environmental and Societal: '6400 people in the surrounding area' represents a community, which is classified as a societal-level system.",[Organizational -> Environmental and Societal] A company's factory transformation and water extraction efforts lead to saving water that meets the daily consumption needs of the surrounding community.
Nestle_Annual_Report_2014_page_33.pdf,"The new technology used at the factory in Jalisco, Mexico, heats milk at low pressure to remove some of the water. The resulting steam is then condensed and treated and used to clean machines. It is then recycled and used again. The process reduces by 15% the total amount of water used by Nestlé Mexico. Work is now underway to deploy similar tech nology in five other manufacturing sites in water stressed are as around the world. It is just one of a number of water-saving initiatives we have introduced in recent years, allowing us to reduce total water withdrawal in absolute terms by almost one third in the last decade.",No,None,Yes,1.0,"Environmental and Societal, Organizational",Direct Causal Link,Organizational -> Environmental and Societal,Organizational: Nestlé Mexico and Nestlé global are formal companies/organizations implementing water-saving technologies; Environmental and Societal: Water resources and water-stressed areas represent environmental systems being affected,"[Organizational -> Environmental and Societal] Nestlé's implementation of water-saving technologies at its factories directly reduces water withdrawal, positively impacting water resources in stressed areas.",Yes,1.0,"Environmental and Societal, Organizational",Direct Causal Link,Organizational -> Environmental and Societal,Organizational: Nestlé Mexico and its manufacturing sites are specific organizations.; Environmental and Societal: Water usage and conservation impact societal-level systems.,"[Organizational -> Environmental and Societal] Nestlé Mexico's new technology reduces water usage, impacting societal water conservation efforts.",Yes,0.9,"Environmental and Societal, Organizational",Direct Causal Link,Organizational -> Environmental and Societal,Organizational: Nestlé Mexico is a specific organization implementing new technology.; Environmental and Societal: The reduction of water usage impacts broader environmental and societal water resources.,"[Organizational -> Environmental and Societal] Nestlé Mexico's new technology reduces water usage, positively impacting environmental water resources.",Yes,0.8,"Environmental and Societal, Organizational",Direct Causal Link,Organizational -> Environmental and Societal,Organizational: Nestlé Mexico and Nestlé (referred to as 'we') are identified as single organizations that initiate and deploy water-saving technologies and initiatives.; Environmental and Societal: The 'water stressed areas around the world' represent a societal-level environmental condition or natural system that is implicitly affected by Nestlé's water reduction efforts within those areas.,"[Organizational -> Environmental and Societal] Nestlé deploys water-saving technology in its manufacturing sites located in water-stressed areas, reducing water withdrawal and impacting the environmental system."
Nestle_Annual_Report_2014_page_33.pdf,"Today our people are carrying out 170 water-saving projects in Nestlé factories, which will save around 3.6 million cubic metres of water.",Yes,Environmental and Societal,Yes,1.0,"Environmental and Societal, Individual, Organizational",Causal Chain,Individual -> Organizational -> Environmental and Societal,Individual: Nestlé employees ('our people') who are implementing the projects; Organizational: Nestlé factories where the projects are being implemented; Environmental and Societal: Water resources being conserved (3.6 million cubic metres),[Individual -> Organizational -> Environmental and Societal] Nestlé employees implement water-saving projects in company factories that will conserve 3.6 million cubic metres of water.,Yes,1.0,"Individual, Organizational",Direct Causal Link,Individual -> Organizational,Individual: The term 'our people' refers to specific individuals or informal groups working on projects.; Organizational: Nestlé is a single organization where the projects are being carried out.,"[Individual -> Organizational] Individuals are executing water-saving projects in Nestlé factories, leading to significant water conservation.",No,0.0,N/A,N/A,N/A,,N/A,Yes,1.0,"Environmental and Societal, Individual, Organizational",Causal Chain,Individual -> Organizational -> Environmental and Societal,Individual: 'Our people' refers to specific individuals or informal groups undertaking actions.; Organizational: 'Nestlé factories' refers to units belonging to a single organization.; Environmental and Societal: Saving 'water' indicates an impact on natural systems.,"[Individual -> Organizational -> Environmental and Societal] People are carrying out water-saving projects in Nestlé factories, projected to save 3.6 million cubic metres of water."
Nestle_Annual_Report_2014_page_33.pdf,"In March 2014, we opened the Nestlé Food Safety Institute in Beijing, China. The new centre has three objectives: to collaborate with Chinese universities, research institutes and regulatory authorities in food safety research; to increase our ability to assess risks, anticipate problems and provide accurate information in any food safety situations; and to engage on scientific communication and food safety training.",Yes,None,No,0.9,N/A,N/A,N/A,,N/A,Yes,1.0,"Environmental and Societal, Inter-Organizational / Sector, Organizational",Convergent Influence,"[Organizational, Inter-Organizational / Sector] -> Environmental and Societal",Organizational: Nestlé is a single organization opening a new institute.; Inter-Organizational / Sector: Collaboration with Chinese universities and research institutes involves multiple organizations.; Environmental and Societal: Regulatory authorities and food safety situations pertain to societal-level systems.,"[Organizational, Inter-Organizational / Sector] -> Environmental and Societal] Nestlé's new institute collaborates with multiple entities to enhance food safety at a societal level.",No,0.0,N/A,N/A,N/A,,N/A,Yes,1.0,"Environmental and Societal, Inter-Organizational / Sector, Organizational",Feedback Loop,"Organizational -> [Inter-Organizational / Sector, Environmental and Societal] -> Organizational","Organizational: Nestlé and its Food Safety Institute represent a single company and its internal unit.; Inter-Organizational / Sector: Chinese universities and research institutes are treated as groups of organizations within specific sectors that Nestlé collaborates with.; Environmental and Societal: Regulatory authorities are governmental bodies, which fall under societal-level systems.","[Organizational -> [Inter-Organizational / Sector, Environmental and Societal] -> Organizational] Nestlé's Food Safety Institute enables collaboration with universities, research institutes, and regulatory authorities, which in turn enhances Nestlé's internal capabilities."
Nestle_Annual_Report_2014_page_33.pdf,"A researcher at the zero water factory in Jalisco, Mexico, does a quality check. The water resource savings at the factory are equivalent to the volume needed per day to fill an Olympic size swimming pool.",Yes,N/A,No,1.0,N/A,N/A,N/A,,N/A,No,1.0,N/A,N/A,N/A,,N/A,No,0.0,N/A,N/A,N/A,,N/A,Yes,1.0,"Environmental and Societal, Organizational",Direct Causal Link,Organizational -> Environmental and Societal,"Organizational: The 'zero water factory' is a single organization whose operations lead to water resource savings.; Environmental and Societal: The 'volume needed per day to fill an Olympic size swimming pool' quantifies the factory's water savings, representing a direct impact on natural water systems.",[Organizational -> Environmental and Societal] The zero water factory's water resource savings directly translate to a significant positive impact on natural water systems.
Nestle_Annual_Report_2014_page_39.pdf,"Nestlé is deeply integrated into people’s lives with many buying our products on a daily basis. This gives us opportunities to contribute meaningfully to their quality of life. It is what our promise of Good Food, Good Life is all about: offering the best tasting, healthiest choices across a wide range of food and beverages, from morning to night and throughout life, helping people to live more enjoyable, healthy lives.",Yes,N/A,Yes,0.9,"Individual, Organizational",Bidirectional Link,Individual <-> Organizational,Individual: Consumers/people who buy Nestlé products and whose quality of life is affected; Organizational: Nestlé as a single company offering products and services,[Individual <-> Organizational] Consumers buy Nestlé products while Nestlé contributes to their quality of life by offering healthy food and beverage choices.,No,1.0,N/A,N/A,N/A,,N/A,No,0.0,N/A,N/A,N/A,,N/A,No,0.0,N/A,N/A,N/A,,N/A
Nestle_Annual_Report_2014_page_39.pdf,"However, today, even brands that enjoy a high level of loyalty and trust need attention grabbing, engaging consumer communication to ensure they remain relevant to consumers. Therefore, excellence in brand building discipline and conviction about the importance of strong, sustainable brand equity is more important than ever, especially in an increasingly complex and crowded digital world.",Yes,Environmental and Societal,Yes,0.9,"Individual, Organizational",Bidirectional Link,Individual <-> Organizational,"Individual: Consumers who provide loyalty, trust, and attention to brands; Organizational: Brands as formal business entities that engage in communication activities",[Individual <-> Organizational] Consumers provide loyalty to brands while brands must deliver engaging communication to maintain relevance with those consumers in a complex digital environment.,No,1.0,N/A,N/A,N/A,,N/A,No,0.0,N/A,N/A,N/A,,N/A,Yes,1.0,"Environmental and Societal, Individual, Organizational",Convergent Influence,"[Individual, Environmental and Societal] -> Organizational",Individual: Refers to 'consumers' whose loyalty and relevance are targets for brand communication and influence the importance of brand building.; Organizational: Refers to 'brands' and their 'brand building discipline' and 'brand equity' as entities and internal practices.; Environmental and Societal: Refers to the 'digital world' as an external system that contributes to the complexity impacting brand building.,"[Individual, Environmental and Societal] -> Organizational] The need for relevance to consumers and the complexity of the digital world both increase the importance of organizational brand building."
Nestle_Annual_Report_2014_page_41.pdf,"The successful roll-out of Maggi Oats Noodles demonstrated that healthy eating can be both enjoyable and tasty. Strong sales of the new product show that it is also good business. Maggi Oats Noodles meet Nestlé Nutritional Foundation criteria, which are based on public health recommendations. The consumer communication reinforces the importance for families to start the day with a well-balanced breakfast, including fruits and milk. In 2014, we continued to renovate Maggi products all around the world, reducing salt and fat and improving their nutritional benefits.",Yes,Environmental and Societal,Yes,0.9,"Individual, Organizational",Direct Causal Link,Organizational -> Individual,Organizational: Nestlé/Maggi is a single company making product decisions and communications.; Individual: Consumers and families who purchase products and receive nutritional messaging.,[Organizational -> Individual] Nestlé's development and marketing of healthier Maggi products influences consumer purchasing behavior and family nutritional practices.,No,1.0,N/A,N/A,N/A,,N/A,No,0.0,N/A,N/A,N/A,,N/A,Yes,1.0,"Environmental and Societal, Individual, Organizational",Causal Chain,Environmental and Societal -> Organizational -> Individual,"Environmental and Societal: Public health recommendations are societal-level systems that influence organizational standards.; Organizational: Nestlé, its internal criteria (Nestlé Nutritional Foundation criteria), products (Maggi Oats Noodles, Maggi products), and consumer communication represent a single organization's actions and standards.; Individual: Families are specific informal groups of individuals targeted by consumer communication.","[Environmental and Societal -> Organizational -> Individual] Public health recommendations inform Nestlé's nutritional criteria, which guide consumer communication reinforcing importance for families."
Nestle_Annual_Report_2014_page_41.pdf,"The Maggi company began selling powdered soups in Switzerland in 1885. Julius Maggi had pioneered the production of pea and bean soups at the request of the Swiss Public Welfare Society to address the dietary deficiency of the work ing population. The advent of factory work for women meant less time to prepare food, and the soups were a convenient and nourishing alternative.",Yes,None,Yes,1.0,"Environmental and Societal, Individual, Organizational",Causal Chain,Organizational -> Organizational -> Individual,Organizational: The Maggi company and the Swiss Public Welfare Society are formal organizations; Individual: The working population and factory-working women represent individuals or informal groups; Environmental and Societal: The advent of factory work represents a societal-level change in labor structure,"[Organizational -> Organizational -> Individual] The Swiss Public Welfare Society requested Maggi to develop nutritious soups, which the company produced to address dietary deficiencies of the working population.",Yes,1.0,"Environmental and Societal, Individual, Organizational",Causal Chain,Environmental and Societal -> Organizational -> Individual,Individual: Women working in factories are individuals affected by the lack of time to prepare food.; Organizational: Maggi company is an organization producing and selling soups.; Environmental and Societal: The Swiss Public Welfare Society is a societal-level entity addressing dietary deficiencies.,"[Environmental and Societal -> Organizational -> Individual] The Swiss Public Welfare Society's request led Maggi to produce soups, benefiting working women with limited time.",No,0.0,N/A,N/A,N/A,,N/A,Yes,1.0,"Environmental and Societal, Individual, Organizational",Causal Chain,Environmental and Societal -> Individual -> Organizational -> Individual,Environmental and Societal: The Swiss Public Welfare Society represents a societal-level system by addressing a public welfare issue (dietary deficiency) and making a request on behalf of the community.; Individual: Julius Maggi is a specific person whose pioneering efforts were directly influenced by the societal request. The 'working population' and 'women' are specific groups of individuals who benefited from the product.; Organizational: The Maggi company is a single organization that produced and sold the powdered soups.,"[Environmental and Societal -> Individual -> Organizational -> Individual] The Swiss Public Welfare Society's request prompted Julius Maggi to pioneer soups for the Maggi company, which then provided a nourishing alternative for the working population."
Nestle_Annual_Report_2014_page_43.pdf,"Parents want their children to make the most of their potential. Nestlé Milo, which is mainly consumed by children aged 7–12, can help to provide the nourishing energy they need to succeed. Activ-Go plays a role in energy release, muscle function, bone maintenance and red blood cell formation, all essential for physical activity.",Yes,N/A,No,N/A,N/A,N/A,N/A,,N/A,No,1.0,N/A,N/A,N/A,,N/A,No,0.0,N/A,N/A,N/A,,N/A,Yes,1.0,"Individual, Organizational",Direct Causal Link,Organizational -> Individual,"Organizational: Nestlé Milo, along with its component Activ-Go, represents a product of a specific organization (Nestlé).; Individual: Children aged 7–12 are specific individuals whose energy and success are influenced by the product.","[Organizational -> Individual] Nestlé Milo, an organizational product, is consumed by children to provide nourishing energy essential for their physical activity and potential."
Nestle_Annual_Report_2014_page_43.pdf,"The re-launched recipe with Activ-Go was developed by our scientists and intro duced in 2014 in Indonesia, Malaysia and Vietnam. It will be launched in other Asian, African and Latin American countries this year.",Yes,N/A,No,1.0,N/A,N/A,N/A,,N/A,No,1.0,N/A,N/A,N/A,,N/A,No,0.0,N/A,N/A,N/A,,N/A,Yes,1.0,"Environmental and Societal, Organizational",Direct Causal Link,Organizational -> Environmental and Societal,"Organizational: The 'scientists' represent an internal unit or formal group within a company, and the 're-launched recipe' is a product developed and introduced by that organization.; Environmental and Societal: The specified countries (Indonesia, Malaysia, Vietnam, other Asian, African, and Latin American countries) represent national markets or communities, which are societal-level systems.",[Organizational -> Environmental and Societal] A recipe developed by an organization's scientists is introduced and launched into various countries.
Nestle_Annual_Report_2014_page_43.pdf,"Nestlé Milo celebrated its 80th birthday in 2014. It was created by Nestlé engineer Thomas Mayne to help children who had poor diets get sufficient nutrition. He created Nestlé Milo from malt, milk and cocoa to give children the nutritious energy they need to get the best out of their day. It was launched at the Sydney Easter Show in 1934.",Yes,N/A,No,N/A,N/A,N/A,N/A,,N/A,No,1.0,N/A,N/A,N/A,,N/A,No,0.0,N/A,N/A,N/A,,N/A,Yes,1.0,"Individual, Organizational",Causal Chain,Individual -> Organizational -> Individual,"Individual: Thomas Mayne is a specific individual, and 'children' refers to an informal group of individuals.; Organizational: Nestlé Milo is a product created by Nestlé, a single organization, representing its output and purpose.",[Individual -> Organizational -> Individual] Nestlé engineer Thomas Mayne (Individual) created Nestlé Milo (Organizational) to provide nutrition to children (Individual).
Nestle_Annual_Report_2014_page_43.pdf,"Nestlé Milo has been a staunch supporter of youth sports throughout its history, and has fuelled generations through their formative years.",Yes,None,Yes,0.8,"Individual, Organizational",Direct Causal Link,Organizational -> Individual,"Organizational: Nestlé Milo is a brand/product line of a company, which fits the organizational scale definition.; Individual: The 'generations' and 'youth' refer to collections of individual people.",[Organizational -> Individual] Nestlé Milo (a brand) has supported youth sports and fuelled generations of young people through their formative years.,No,1.0,N/A,N/A,N/A,,N/A,No,0.0,N/A,N/A,N/A,,N/A,Yes,1.0,"Individual, Organizational",Direct Causal Link,Organizational -> Individual,"Organizational: Nestlé Milo is identified as a specific brand, which represents an organization.; Individual: 'Generations' refers to groups of specific individuals who were 'fuelled' by the organization.",[Organizational -> Individual] Nestlé Milo has fuelled generations through their formative years.
Nestle_Annual_Report_2014_page_46.pdf,"In 2014 Nestlé’s organic growth was 4.5%, composed of 2.3% real internal growth and 2.2% pricing. Sales were CHF 91.6 billion, down 0.6%, impacted by negative foreign exchange of –5.5%. Acquisitions, net of divestitures, added 0.4% to sales.",Yes,None,Yes,1.0,"Environmental and Societal, Organizational",Direct Causal Link,Environmental and Societal -> Organizational,"Organizational: Nestlé is a single company with its own growth metrics, sales figures, and acquisition activities.; Environmental and Societal: Foreign exchange rates are macro-level economic factors operating at the societal/market level.",[Environmental and Societal -> Organizational] Macro-level foreign exchange rates negatively impacted Nestlé's organizational sales performance by -5.5%.,No,1.0,N/A,N/A,N/A,,N/A,No,0.0,N/A,N/A,N/A,,N/A,Yes,1.0,"Environmental and Societal, Organizational",Direct Causal Link,Environmental and Societal -> Organizational,"Organizational: Nestlé and its 'Sales' are defined as a single organization and its internal performance metrics.; Environmental and Societal: 'Negative foreign exchange' refers to external economic factors, specifically capital markets, which are part of societal-level systems.",[Environmental and Societal -> Organizational] Negative foreign exchange directly impacted Nestlé’s sales.
Nestle_Annual_Report_2014_page_46.pdf,"The Group’s trading operating profit was CHF 14.0 billion, representing a margin of 15.3%, up 10 basis points, and up 30 basis points in constant currencies. The cost of goods sold fell by 30 basis points as a percentage of sales, driven by product mix and pricing actions and savings created by Nestlé Continuous Excellence which more than offset increases in raw material costs. Distribution costs were up by 10 basis points. Total marketing and administration expenses rose by 10 basis points as we increased consumer facing marketing support for our brands.",Yes,N/A,No,1.0,N/A,N/A,N/A,,N/A,No,1.0,N/A,N/A,N/A,,N/A,No,0.0,N/A,N/A,N/A,,N/A,Yes,1.0,"Environmental and Societal, Organizational",Convergent Influence,"[Environmental and Societal, Organizational] -> Organizational","Environmental and Societal: Refers to 'increases in raw material costs', which are external market or supply chain factors affecting the company.; Organizational: Refers to 'The Group' (Nestlé), 'cost of goods sold', 'product mix', 'pricing actions', and 'Nestlé Continuous Excellence', which are all internal operations, financial metrics, or programs of a single organization.","[Environmental and Societal, Organizational] Organizational actions like product mix, pricing, and internal savings offset external increases in raw material costs, driving down the Group's cost of goods sold."
